标题,中文标题,发布日期,领域分类,研究机构,PDF链接,论文链接,arXiv ID,简明摘要
MokA: Multimodal Low-Rank Adaptation for MLLMs,MokA：用于多模态大语言模型的多模态低秩适配,05 Jun 2025,Multimodal LLM,Other,http://arxiv.org/pdf/2506.05191v1,http://arxiv.org/abs/2506.05191v1,2506.05191v1,本文针对多模态大语言模型（MLLMs）高效微调存在的不足，提出了一种名为MokA的多模态低秩适配方法。该方法通过分别压缩单模态信息和增强跨模态交互，有效实现了单模态和跨模态的联合适配。作者在音视频文本、视觉文本及语音文本等多种场景，以及多个主流模型上进行了广泛实验，结果显示MokA在性能和效率上均有显著提升。该方法为多模态模型的高效微调提供了更具针对性的解决方案，具有较强的实用价值和推广潜力。
Counterfactual reasoning: an analysis of in-context emergence,反事实推理：对上下文中出现现象的分析,05 Jun 2025,LLM,Other,http://arxiv.org/pdf/2506.05188v1,http://arxiv.org/abs/2506.05188v1,2506.05188v1,本文研究了大型语言模型在无需参数更新的情况下，基于上下文进行反事实推理的能力。通过设计一个线性回归任务，作者展示了模型能够通过推断并复制观察到的噪声，实现对假设情景结果的准确预测。研究发现，模型的自注意力机制、层数深度及预训练数据多样性是提升表现的关键因素。此外，工作还初步验证了该方法在序列数据上的应用潜力，暗示语言模型具备生成反事实故事的能力。相关代码已公开。
Single GPU Task Adaptation of Pathology Foundation Models for Whole Slide Image Analysis,基于单GPU的病理基础模型任务适配用于全切片图像分析,05 Jun 2025,Other,Other,http://arxiv.org/pdf/2506.05184v1,http://arxiv.org/abs/2506.05184v1,2506.05184v1,本文提出了一种基于单GPU的病理基础模型任务适应方法（TAPFM），用于高效分析全切片图像。该方法通过视觉变换器的注意力机制改进多实例学习聚合，同时优化特征表示和注意力权重，实现了稳定的端到端训练。实验证明，TAPFM在膀胱癌和肺腺癌的基因突变预测任务中优于传统方法，且能处理多标签分类问题。该方法降低了对硬件的要求，提升了预训练病理模型在临床应用中的实用性和适应性。
TreeRPO: Tree Relative Policy Optimization,TreeRPO：基于树的相对策略优化,05 Jun 2025,LLM,Other,http://arxiv.org/pdf/2506.05183v1,http://arxiv.org/abs/2506.05183v1,2506.05183v1,本文提出了一种名为TreeRPO的新方法，旨在提升大语言模型在推理任务中的表现。该方法通过树状采样技术，精确估计推理过程中各步骤的奖励信号，克服了以往只在整体路径层面定义奖励导致的指导不足问题。与现有方法相比，TreeRPO生成了更细粒度和密集的奖励反馈，从而显著提升模型的学习效率和推理准确率。实验证明，TreeRPO在多个测试集上显著优于基线方法，提升了准确率并减少了响应长度，展现出较强的实用价值和潜力。
Associative Memory and Generative Diffusion in the Zero-noise Limit,零噪声极限下的联想记忆与生成扩散,05 Jun 2025,Diffusion Model,Other,http://arxiv.org/pdf/2506.05178v1,http://arxiv.org/abs/2506.05178v1,2506.05178v1,本文探讨了生成扩散模型与连续状态联想记忆模型之间的联系，重点分析了Morse-Smale动力系统作为梯度驱动联想记忆和扩散模型的通用近似器。研究揭示了随着噪声水平降低，系统从生成模式向记忆模式的转变机制，并证明了系统在零噪声极限下的结构稳定性。通过对梯度系统的分析，论文展示了学习和生成过程中的稳定性及其在特定点的突变行为，进而为经典和现代神经网络（如Hopfield网络和注意力机制）的稳定性提供了理论依据和结构稳定性判据。
Qwen3 Embedding: Advancing Text Embedding and Reranking Through Foundation Models,Qwen3 Embedding：基于基础模型的文本嵌入与重排序技术进展,05 Jun 2025,LLM,Other,http://arxiv.org/pdf/2506.05176v1,http://arxiv.org/abs/2506.05176v1,2506.05176v1,本文提出了基于Qwen3基础模型的Qwen3 Embedding系列，显著提升了文本嵌入和重排序能力。通过结合大规模无监督预训练与高质量数据的监督微调，并利用模型融合策略，增强了模型的鲁棒性和适应性。该系列提供多种规模模型，兼顾效率与效果，支持多语言和多领域应用。实验证明，Qwen3 Embedding在多语言文本嵌入及多种检索任务中表现优异，达到领先水平。模型已开源，促进社区研究与应用发展。
Track Any Anomalous Object: A Granular Video Anomaly Detection Pipeline,Track Any Anomalous Object：一种细粒度视频异常检测流程,05 Jun 2025,Other,Other,http://arxiv.org/pdf/2506.05175v1,http://arxiv.org/abs/2506.05175v1,2506.05175v1,本文提出了一种名为Track Any Anomalous Object（TAO）的细粒度视频异常检测框架，首次实现了对多个异常对象的统一检测与跟踪。与传统方法侧重于异常帧或对象不同，TAO通过像素级跟踪异常对象，提升了异常定位的精度和稳定性，且无需复杂的阈值调整。该方法在复杂视频场景中表现出更高的准确性和鲁棒性，为视频异常检测提供了更细致和实用的解决方案。
Fabrica: Dual-Arm Assembly of General Multi-Part Objects via Integrated Planning and Learning,Fabrica：通过集成规划与学习实现通用多部件物体的双臂装配,05 Jun 2025,Embodied AI,Other,http://arxiv.org/pdf/2506.05168v1,http://arxiv.org/abs/2506.05168v1,2506.05168v1,本文提出了Fabrica，一种双臂机器人系统，能够自主完成多部件物体的组装任务。系统结合了分层规划和轻量级强化学习，实现了从整体规划到局部控制的无缝衔接，支持复杂几何形状和多步骤操作。通过并行设计提升规划效率，并利用学习策略增强接触丰富的组装稳定性。该方法无需领域知识或人工示范，直接在真实环境中实现80%的组装成功率。研究还设计了涵盖多样物体的评测基准，验证了系统的通用性和实用价值。
ECoRAG: Evidentiality-guided Compression for Long Context RAG,ECoRAG：基于证据性的长上下文RAG压缩方法,05 Jun 2025,LLM,Other,http://arxiv.org/pdf/2506.05167v1,http://arxiv.org/abs/2506.05167v1,2506.05167v1,本文提出了ECoRAG，一种基于证据性的长文本压缩方法，旨在提升大语言模型在开放域问答中的表现。通过筛选并保留与答案生成密切相关的关键信息，ECoRAG有效减少了冗余内容，确保生成答案时依托正确证据。此外，方法还动态判断压缩内容的充分性，必要时补充更多信息。实验结果表明，ECoRAG不仅优于现有压缩技术，还显著降低了计算成本和响应延迟，提升了问答系统的效率和准确性。
Dissecting Bias in LLMs: A Mechanistic Interpretability Perspective,剖析LLMs中的偏见：一种机制可解释性视角,05 Jun 2025,LLM,Other,http://arxiv.org/pdf/2506.05166v1,http://arxiv.org/abs/2506.05166v1,2506.05166v1,本文通过机械可解释性方法，系统分析了大型语言模型（如GPT-2和Llama2）中性别和人口统计偏见的内部结构。研究发现，偏见相关的计算主要集中在模型的少数层级，且这些关键部分在不同数据集和语言环境下表现出一定的变化。通过消融实验，作者证明去除这些偏见组件能有效减少模型偏见，但同时也影响了模型在命名实体识别和语言合理性判断等任务上的表现，揭示了偏见与其他语言能力之间的复杂关联。该工作为理解和缓解语言模型偏见提供了新的视角和方法。
LiPo: A Lightweight Post-optimization Framework for Smoothing Action Chunks Generated by Learned Policies,LiPo：一种用于平滑学习策略生成动作块的轻量级后优化框架,05 Jun 2025,Embodied AI,Other,http://arxiv.org/pdf/2506.05165v1,http://arxiv.org/abs/2506.05165v1,2506.05165v1,本文提出了一种轻量级的后期优化框架，用于平滑由学习策略生成的分段动作序列，解决了动作分段边界处的不连续性问题。该方法通过提前调度重叠动作段、在重叠区域进行线性混合以及限制范围内的轨迹优化，有效减少了动作的震动和抖动。实验验证表明，该方法显著提升了机器人动态操作任务中的运动平滑度和机械稳定性，增强了系统的执行质量和鲁棒性。
FRED: The Florence RGB-Event Drone Dataset,FRED：佛罗伦萨RGB-事件无人机数据集,05 Jun 2025,Other,Other,http://arxiv.org/pdf/2506.05163v1,http://arxiv.org/abs/2506.05163v1,2506.05163v1,本文提出了FRED数据集，一种结合RGB视频和事件相机数据的多模态无人机数据集，专为无人机检测、跟踪及轨迹预测设计。FRED包含超过7小时的精细标注轨迹，涵盖5种不同无人机型号及雨天和复杂光照等挑战场景。该数据集弥补了现有基准在时间分辨率和无人机运动模式上的不足，提供了标准评测协议和指标，有助于推动高速无人机感知和多模态时空理解的研究进展。
Knowledgeable-r1: Policy Optimization for Knowledge Exploration in Retrieval-Augmented Generation,Knowledgeable-r1：用于检索增强生成中知识探索的策略优化,05 Jun 2025,LLM,Other,http://arxiv.org/pdf/2506.05154v1,http://arxiv.org/abs/2506.05154v1,2506.05154v1,本文提出了Knowledgeable-r1，一种针对检索增强生成（RAG）方法的策略优化框架，旨在平衡模型对检索信息和自身知识的利用。通过联合采样和多策略分布设计，Knowledgeable-r1促进大语言模型更好地整合参数化知识与上下文信息。实验结果表明，该方法在处理信息冲突和推理任务中显著提升了鲁棒性和准确率，尤其在反事实场景中较基线方法提升了17.07%。该研究为提升RAG系统的知识探索能力提供了有效途径。
Do Large Language Models Judge Error Severity Like Humans?,大型语言模型是否像人类一样判断错误严重性？,05 Jun 2025,Multimodal LLM,Other,http://arxiv.org/pdf/2506.05142v1,http://arxiv.org/abs/2506.05142v1,2506.05142v1,本文系统比较了大型语言模型（LLMs）与人类在评估图像描述中语义错误严重性上的差异。研究涵盖文本和图文两种模式，分析了年龄、性别、服装类型及颜色四类错误。结果显示，人类对不同错误的严重性感知存在差异，且视觉信息增强了颜色和类型错误的严重性判断。大多数LLMs在性别错误评分偏低、颜色错误评分偏高，反映其受社会规范影响但缺乏对颜色感知的理解。仅有少数模型如Doubao和DeepSeek-V3在模拟人类判断方面表现较好，尤其DeepSeek-V3在多模态条件下优于其他模型。研究揭示了LLMs在错误严重性评估中的局限与潜力。
Information Locality as an Inductive Bias for Neural Language Models,信息局部性作为神经语言模型的归纳偏置,05 Jun 2025,LLM,Other,http://arxiv.org/pdf/2506.05136v1,http://arxiv.org/abs/2506.05136v1,2506.05136v1,本文提出了一种定量框架，通过引入“局部熵”指标，衡量语言中前序信息对预测下一个符号的不确定性影响。实验证明，局部熵较高的语言对Transformer和LSTM语言模型的学习难度更大，表明神经语言模型对语言的局部统计结构高度敏感。该研究为理解神经语言模型的归纳偏置提供了新的视角，揭示其在处理语言时与人类认知过程的相似性，促进了语言模型设计与人类语言机制之间的桥梁构建。
DiCoRe: Enhancing Zero-shot Event Detection via Divergent-Convergent LLM Reasoning,DiCoRe：通过发散-收敛大语言模型推理增强零样本事件检测,05 Jun 2025,LLM,Other,http://arxiv.org/pdf/2506.05128v1,http://arxiv.org/abs/2506.05128v1,2506.05128v1,本文提出了DiCoRe，一种针对零样本事件检测的新方法，旨在解决大型语言模型在理解复杂事件和提取领域特定信息时的局限。DiCoRe通过“发散-收敛”推理框架，先进行开放式事件发现以提升覆盖率，再通过约束解码使结果符合任务要求，最后采用判别机制确保输出准确。实验证明，DiCoRe在多个领域和模型上均显著优于现有方法，平均F1值提升4-7%，展现了其在无训练数据条件下高效检测事件的能力和广泛适用性。
PixCell: A generative foundation model for digital histopathology images,PixCell：用于数字组织病理图像的生成基础模型,05 Jun 2025,Diffusion Model,Other,http://arxiv.org/pdf/2506.05127v1,http://arxiv.org/abs/2506.05127v1,2506.05127v1,本文提出了PixCell，一种基于扩散模型的数字病理生成基础模型，训练于涵盖多种癌症类型的大规模病理图像数据集。PixCell无需标注数据，通过自监督学习生成多样且高质量的合成病理图像，可替代真实数据用于模型训练，促进数据共享且减少隐私风险。该模型支持精确控制图像生成，助力数据增强和教学应用，并能基于常规染色图像推断分子标记结果。PixCell的公开发布为计算病理学研究提供了重要工具和资源。
Membership Inference Attacks on Sequence Models,针对序列模型的成员推断攻击,05 Jun 2025,LLM,Other,http://arxiv.org/pdf/2506.05126v1,http://arxiv.org/abs/2506.05126v1,2506.05126v1,本文针对序列模型（如大型语言模型和自回归图像生成器）在生成过程中可能泄露敏感信息的问题，提出了一种改进的隐私检测方法。作者指出现有工具未能充分利用序列数据中的关联性，导致隐私风险评估不足。通过调整现有的成员推断攻击，使其考虑序列内的相关性，实验结果表明该方法在不增加计算成本的情况下显著提升了检测效果。该研究为更可靠地审计序列模型中的记忆泄露风险提供了重要思路。
The NTNU System at the S&I Challenge 2025 SLA Open Track,NTNU系统在2025年Speak & Improve挑战赛S&I公开赛道中的表现,05 Jun 2025,Multimodal LLM,Other,http://arxiv.org/pdf/2506.05121v1,http://arxiv.org/abs/2506.05121v1,2506.05121v1,本文提出了一种结合语音特征和多模态语言模型的口语评估系统，旨在提升说话能力的自动评分准确性。该系统融合了wav2vec 2.0对声音细节的捕捉和Phi-4多模态语言模型的语义理解，弥补了单一模型在语音或文本信息上的不足。在Speak & Improve Challenge 2025比赛中，该方法以0.375的均方根误差获得第二名，表现优于官方基线，展示了多模态融合策略在口语评估中的有效性和潜力。
Realizing Text-Driven Motion Generation on NAO Robot: A Reinforcement Learning-Optimized Control Pipeline,基于强化学习优化控制流程的NAO机器人文本驱动动作生成实现,05 Jun 2025,Embodied AI,Other,http://arxiv.org/pdf/2506.05117v1,http://arxiv.org/abs/2506.05117v1,2506.05117v1,本文提出了一种基于文本驱动的人体动作生成方法，用于实现人类动作到NAO机器人上的迁移。通过设计一种角度信号网络，结合特殊损失函数生成适合机器人的关节角度，并利用强化学习优化的控制策略，实现了机器人动作的稳定跟踪。实验结果表明，该方法有效解决了动作表达与机器人运动限制之间的差异，成功将文本描述的人体动作转化为机器人可执行的动作，推动了文本驱动机器人动作生成的实际应用。
Whole-Body Constrained Learning for Legged Locomotion via Hierarchical Optimization,通过分层优化实现的全身约束学习用于多足机器人运动,05 Jun 2025,Embodied AI,Other,http://arxiv.org/pdf/2506.05115v1,http://arxiv.org/abs/2506.05115v1,2506.05115v1,本文提出了一种基于分层优化的全身约束学习方法，将硬约束和软约束融入强化学习框架，以提升多足机器人在复杂环境中的安全性和稳定性。该方法结合了模型控制的优势，实现了训练和部署过程中的多种约束设定，缓解了仿真到现实的迁移难题，同时保持了强化学习在非结构化环境下的鲁棒性。通过在六足机器人上的实地测试，验证了该方法在雪地坡道和楼梯等多样环境中的优越通过能力和安全性能，具备广泛的实际应用潜力。
Truly Self-Improving Agents Require Intrinsic Metacognitive Learning,真正的自我提升智能体需要内在的元认知学习,05 Jun 2025,Agent,Other,http://arxiv.org/pdf/2506.05109v1,http://arxiv.org/abs/2506.05109v1,2506.05109v1,本文提出，实现真正的自我提升智能体需要具备内在的元认知学习能力，即智能体能够主动评估、反思并调整自身的学习过程。作者构建了一个包含元认知知识、计划和评估的框架，指出现有方法多依赖固定的外部元认知机制，限制了智能体的适应性和扩展性。论文分析了内在元认知学习的关键要素，并探讨了人类与智能体在元认知职责分配及评估方法上的优化路径，为实现持续、通用且可控的自我提升提供了理论基础和实践方向。
DIMCIM: A Quantitative Evaluation Framework for Default-mode Diversity and Generalization in Text-to-Image Generative Models,DIMCIM：一种用于文本生成图像模型中默认模式多样性与泛化的定量评估框架,05 Jun 2025,Diffusion Model,Other,http://arxiv.org/pdf/2506.05108v1,http://arxiv.org/abs/2506.05108v1,2506.05108v1,本文提出了DIM-CIM框架，一种无需参考图像数据即可评估文本生成图像模型多样性和泛化能力的方法。通过构建基于COCO数据集及大语言模型扩展的COCO-DIMCIM基准，作者揭示了模型规模增大时泛化能力提升但默认模式多样性下降的趋势。该框架还能细致识别模型在特定属性生成上的不足，并发现训练数据多样性与模型默认多样性高度相关。DIM-CIM为全面理解和评估文本生成图像模型性能提供了灵活且易解释的工具。
CL-ISR: A Contrastive Learning and Implicit Stance Reasoning Framework for Misleading Text Detection on Social Media,CL-ISR：一种用于社交媒体误导性文本检测的对比学习与隐式立场推理框架,05 Jun 2025,Other,Other,http://arxiv.org/pdf/2506.05107v1,http://arxiv.org/abs/2506.05107v1,2506.05107v1,本文提出了一种名为CL-ISR的新框架，用于提升社交媒体误导性文本的检测效果。该方法结合了对比学习和隐含立场推理：通过对比学习增强模型区分真实与误导文本的能力，捕捉细微语义差异；通过隐含立场推理挖掘文本中的潜在立场倾向及其与相关话题的关系，有助于识别通过立场转变或情绪操控进行误导的内容。实验表明，CL-ISR有效提升了误导文本的检测准确率，具有重要的实际应用价值。
EDEN: Efficient Dual-Layer Exploration Planning for Fast UAV Autonomous Exploration in Large 3-D Environments,EDEN：用于大型三维环境中快速无人机自主探索的高效双层探索规划,05 Jun 2025,Embodied AI,Other,http://arxiv.org/pdf/2506.05106v1,http://arxiv.org/abs/2506.05106v1,2506.05106v1,本文提出了一种高效的双层探索规划方法，旨在提升无人机在大规模三维环境中的自主探索速度和计算效率。该方法通过近似算法快速确定长远区域路径，并在首个路径区域内选择曲率代价最低的视点作为下一个目标，从而减少转弯减速。结合激进且安全的轨迹规划，显著增强了探索的连续性。仿真和实地实验结果表明，该方法在探索效率、计算开销和飞行速度方面均优于现有先进方法，具备良好的实用价值。
Survey on the Evaluation of Generative Models in Music,生成模型在音乐中的评估综述,05 Jun 2025,Other,Other,http://arxiv.org/pdf/2506.05104v1,http://arxiv.org/abs/2506.05104v1,2506.05104v1,本文综述了音乐生成模型的评估方法，系统梳理了当前对生成系统输出质量和模型可用性的多样化评价目标、手段及指标。研究涵盖了主观与客观、定性与定量，以及经验和计算方法，结合音乐学、工程学和人机交互等视角，分析了各类评估方法的优势与挑战。该综述为理解和改进音乐生成系统的评价提供了全面的参考框架，促进了跨学科的研究交流与实践应用。
Privacy Amplification Through Synthetic Data: Insights from Linear Regression,通过合成数据实现隐私放大：来自线性回归的洞见,05 Jun 2025,Other,Other,http://arxiv.org/pdf/2506.05101v1,http://arxiv.org/abs/2506.05101v1,2506.05101v1,本文通过线性回归模型探讨了合成数据在隐私保护中的作用。研究发现，当生成模型的随机种子被攻击者掌控时，单个合成数据点可能泄露的信息量与直接公开模型相当，存在隐私风险。相反，在随机输入条件下，有限数量的合成数据释放能够增强隐私保护效果，超过模型自身的保障水平。该工作为理解和量化合成数据的隐私放大效应提供了理论基础，推动了合成数据在隐私保护中的应用研究。
Astraea: A GPU-Oriented Token-wise Acceleration Framework for Video Diffusion Transformers,Astraea：面向GPU的逐令牌加速框架用于视频扩散Transformer,05 Jun 2025,Diffusion Model,Other,http://arxiv.org/pdf/2506.05096v1,http://arxiv.org/abs/2506.05096v1,2506.05096v1,本文提出了ASTRAEA，一种针对视频扩散变换器的视频生成加速框架。通过引入轻量级的令牌选择机制和高效的稀疏注意力策略，ASTRAEA显著减少了计算时间，同时保持生成视频的质量。此外，框架采用进化算法自动优化不同时间步的令牌分配，实现了推理速度的显著提升。在单GPU上加速达2.4倍，多GPU环境下最高可达13.2倍，且视频质量优于现有方法，展示了其在实际应用中的潜力和广泛适用性。
"FG 2025 TrustFAA: the First Workshop on Towards Trustworthy Facial Affect Analysis: Advancing Insights of Fairness, Explainability, and Safety (TrustFAA)",FG 2025 TrustFAA：首届“迈向可信面部情感分析”研讨会——推进公平性、可解释性与安全性的洞见（TrustFAA）,05 Jun 2025,Other,Other,http://arxiv.org/pdf/2506.05095v1,http://arxiv.org/abs/2506.05095v1,2506.05095v1,本文介绍了首届“迈向可信面部情感分析（TrustFAA）”研讨会，聚焦提升面部情感分析系统的公平性、可解释性和安全性。随着情感人工智能技术的广泛应用，系统的可信度问题日益突出。该研讨会汇集了关注系统解释能力、不确定性、偏见和隐私等挑战的研究者，涵盖表情识别、面部动作单元检测及相关应用如疼痛和抑郁检测等领域。通过促进关于伦理和可信技术的交流，研讨会支持FG2025推动负责任人工智能发展的目标。
Synthetic Dataset Generation for Autonomous Mobile Robots Using 3D Gaussian Splatting for Vision Training,利用3D高斯点渲染生成合成数据集用于自主移动机器人视觉训练,05 Jun 2025,Embodied AI,Other,http://arxiv.org/pdf/2506.05092v1,http://arxiv.org/abs/2506.05092v1,2506.05092v1,本文提出了一种基于虚幻引擎和3D高斯点技术自动生成带标注的合成数据集的方法，解决了机器人视觉训练中数据标注耗时且易出错的问题。实验表明，该方法生成的合成数据在机器人足球场景中训练的目标检测模型性能可与真实数据相媲美，且结合真实与合成数据能进一步提升检测效果。该方法大幅降低了人工标注成本，提供了一个高效、可扩展的数据生成方案，特别适用于需要多样化训练数据的机器人应用。
Interpretable Multimodal Framework for Human-Centered Street Assessment: Integrating Visual-Language Models for Perceptual Urban Diagnostics,面向以人为本的街道评估的可解释多模态框架：融合视觉-语言模型进行感知城市诊断,05 Jun 2025,Multimodal LLM,Other,http://arxiv.org/pdf/2506.05087v1,http://arxiv.org/abs/2506.05087v1,2506.05087v1,本文提出了一种融合视觉和语言模型的多模态街道评估框架，旨在结合客观数据与居民主观感知，实现对城市街景的可解释诊断。通过对中国哈尔滨15000余张街景图像的训练，模型不仅准确识别街道特征，还揭示了不同环境下感知的复杂矛盾和非线性关系。该方法通过生成自然语言解释，增强了结果的透明度和可理解性，为以人为中心的城市规划提供了创新工具，促进了基础设施精准管理与居民体验的有效结合，助力可持续城市发展目标的实现。
