标题,中文标题,发布日期,领域分类,研究机构,PDF链接,论文链接,arXiv ID,简明摘要
VideoMathQA: Benchmarking Mathematical Reasoning via Multimodal Understanding in Videos,VideoMathQA：通过视频中的多模态理解评测数学推理能力,05 Jun 2025,Multimodal LLM,Other,http://arxiv.org/pdf/2506.05349v1,http://arxiv.org/abs/2506.05349v1,2506.05349v1,本文提出了VideoMathQA，一个针对视频中数学推理能力的多模态理解基准测试。该测试涵盖10个数学领域，视频时长从10秒到1小时不等，要求模型结合视觉、音频和文本信息进行跨时序的复杂推理。通过专家团队耗费大量人力标注，设计了涵盖直接问题解决、概念迁移和深度理解的多步骤问题。实验表明现有方法在该任务上存在显著不足，VideoMathQA为评估和推动视频中数学推理模型的发展提供了系统化平台和资源。
Contrastive Flow Matching,对比流匹配,05 Jun 2025,Diffusion Model,Other,http://arxiv.org/pdf/2506.05350v1,http://arxiv.org/abs/2506.05350v1,2506.05350v1,本文提出了一种名为Contrastive Flow Matching的新方法，用于改进条件生成模型中的样本流匹配问题。该方法通过引入对比目标，增强不同条件下生成流的区分度，解决了传统流匹配在条件设置中流重叠导致生成模糊的问题。实验结果表明，Contrastive Flow Matching不仅显著加快了训练速度，减少了去噪步骤，还提升了生成质量，在多个图像生成任务中表现优异。该方法为条件生成模型的训练效率和效果提供了有效提升。
SparseMM: Head Sparsity Emerges from Visual Concept Responses in MLLMs,SparseMM：多模态大语言模型中视觉概念响应引发的头部稀疏性,05 Jun 2025,Multimodal LLM,Other,http://arxiv.org/pdf/2506.05344v1,http://arxiv.org/abs/2506.05344v1,2506.05344v1,本文研究了多模态大语言模型（MLLMs）在处理视觉信息时的注意力机制，发现仅约5%的注意力头对视觉理解起关键作用。基于此，作者提出了一种无需训练即可识别这些关键视觉头的方法，并设计了SparseMM，一种利用视觉头稀疏性分配计算资源的优化策略。SparseMM显著提升了模型推理速度和内存效率，同时保持了性能稳定，在多个多模态任务中表现优异。该方法为加速多模态模型推理提供了有效路径，并已开源。
Inference-Time Hyper-Scaling with KV Cache Compression,推理时超尺度扩展与KV缓存压缩,05 Jun 2025,LLM,Other,http://arxiv.org/pdf/2506.05345v1,http://arxiv.org/abs/2506.05345v1,2506.05345v1,本文提出了一种在推理阶段通过压缩Transformer大模型中的关键缓存（KV缓存）实现超大规模推理的方法，称为推理时超扩展。作者设计了动态记忆稀疏化（DMS）技术，仅需少量训练即可实现高效压缩，同时保持模型准确性。该方法通过延迟丢弃缓存信息，有效保留关键信息，允许生成更多内容而不增加计算资源。实验证明，DMS在多种大模型上显著提升了推理准确率，在相同计算预算下表现优于传统方法，展示了其在提升大模型推理效率和效果上的潜力。
Why LLM Safety Guardrails Collapse After Fine-tuning: A Similarity Analysis Between Alignment and Fine-tuning Datasets,为什么大语言模型安全防护在微调后失效：对齐数据集与微调数据集相似性的分析,05 Jun 2025,LLM,Other,http://arxiv.org/pdf/2506.05346v1,http://arxiv.org/abs/2506.05346v1,2506.05346v1,本文研究了大语言模型在微调过程中安全保护机制失效的原因，重点分析了原始安全对齐数据与微调任务数据之间的相似性。实验结果表明，当两者高度相似时，模型的安全防护能力显著下降，更易被绕过；而相似度较低则能显著提升模型的安全性，降低有害输出。该研究强调了设计微调数据时考虑与安全对齐数据差异的重要性，为提升模型抗攻击能力和构建更稳健的安全机制提供了实用指导。
ContentV: Efficient Training of Video Generation Models with Limited Compute,ContentV：在有限计算资源下高效训练视频生成模型,05 Jun 2025,Other,Other,http://arxiv.org/pdf/2506.05343v1,http://arxiv.org/abs/2506.05343v1,2506.05343v1,本文提出了ContentV，一种拥有80亿参数的文本驱动视频生成模型，能够在有限计算资源下高效训练并实现领先性能。通过采用简化的模型架构、分阶段训练策略以及结合人类反馈的强化学习方法，ContentV在仅用四周时间和256个64GB神经处理单元训练后，生成多样且高质量的视频。该方法显著降低了视频生成模型的训练成本，为实际应用提供了有效解决方案。所有代码和模型已公开，促进后续研究与应用。
Refer to Anything with Vision-Language Prompts,使用视觉-语言提示实现任意对象的指代,05 Jun 2025,Multimodal LLM,Other,http://arxiv.org/pdf/2506.05342v1,http://arxiv.org/abs/2506.05342v1,2506.05342v1,本文提出了一种新的任务——全模态指代表达分割（ORES），旨在根据文本或文本加参考图像实体的提示，生成对应的图像区域掩码。为此，作者设计了一个名为RAS的框架，通过引入大型多模态模型，实现对复杂视觉语言提示的理解和分割。为支持该任务，作者构建了包含多样掩码组的训练和测试数据集。实验结果表明，RAS在新任务及传统指代表达分割任务中均表现优异，推动了视觉语言交互的应用发展。
Direct Numerical Layout Generation for 3D Indoor Scene Synthesis via Spatial Reasoning,基于空间推理的3D室内场景合成直接数值布局生成,05 Jun 2025,Embodied AI,Other,http://arxiv.org/pdf/2506.05341v1,http://arxiv.org/abs/2506.05341v1,2506.05341v1,本文提出了DirectLayout，一种基于大型语言模型空间推理能力的3D室内场景布局生成方法。该方法通过分阶段生成鸟瞰图布局、转换为三维空间并细化物体摆放，实现了从文本描述直接生成数值化布局。通过引入链式思维激活和基于生成奖励的优化，提升了模型对空间关系的理解和泛化能力。实验表明，DirectLayout在语义一致性、通用性和物理合理性方面表现优异，克服了现有方法依赖有限数据和预设约束的局限，推动了开放词汇和细粒度指令驱动的室内场景合成。
Exploring Diffusion Transformer Designs via Grafting,通过嫁接探索扩散Transformer设计,05 Jun 2025,Diffusion Model,Other,http://arxiv.org/pdf/2506.05340v1,http://arxiv.org/abs/2506.05340v1,2506.05340v1,本文提出了一种名为“嫁接”的方法，通过对预训练的扩散变换器模型进行局部修改，实现新的模型架构设计，显著降低了架构探索的计算成本。基于对模型激活和注意力机制的分析，作者构建了测试平台，验证了替换注意力和多层感知机结构等多种混合设计的有效性，且多数设计在计算资源消耗不到2%的情况下，保持了较高的生成质量。此外，作者还展示了通过嫁接实现模型结构重组，提升速度和性能的案例。该方法为扩散模型的高效设计和优化提供了新思路。
VideoMolmo: Spatio-Temporal Grounding Meets Pointing,VideoMolmo：时空定位与指点的结合,05 Jun 2025,Multimodal LLM,Other,http://arxiv.org/pdf/2506.05336v1,http://arxiv.org/abs/2506.05336v1,2506.05336v1,本文提出了VideoMolmo，一种结合大语言模型和时序注意力机制的多模态视频模型，专注于基于文本描述的细粒度时空定位与指向。通过引入双向点传播的时序掩码融合方法，提升了视频序列中的时空一致性和分割连贯性。为支持模型训练，作者构建了包含7.2万视频-文本对及10万个目标点的标注数据集，并设计了涵盖细胞追踪、自动驾驶等多场景的评测基准。实验结果表明，VideoMolmo在时空指向准确性和推理能力上显著优于现有方法，推动了视频理解与交互技术的发展。
Search Arena: Analyzing Search-Augmented LLMs,Search Arena：分析搜索增强型大语言模型,05 Jun 2025,LLM,Other,http://arxiv.org/pdf/2506.05334v1,http://arxiv.org/abs/2506.05334v1,2506.05334v1,本文提出了Search Arena，一个包含超过2.4万组多轮用户与搜索增强大型语言模型交互的规模化数据集，涵盖多种意图和语言，并收录了约1.2万条用户偏好投票。通过分析，发现用户偏好受引用数量影响，但引用内容不一定支持相关陈述，揭示了感知可信度与实际可信度的差距。研究还表明，社区驱动平台更受欢迎，而静态百科类资源的可靠性有限。跨场景测试显示，网络搜索在非搜索环境中不会降低性能，甚至有所提升，但在搜索密集型环境中，仅依赖模型内知识会影响表现。该数据集已开源，助力相关领域研究。
Kinetics: Rethinking Test-Time Scaling Laws,Kinetics：重新思考测试时的规模定律,05 Jun 2025,LLM,Other,http://arxiv.org/pdf/2506.05333v1,http://arxiv.org/abs/2506.05333v1,2506.05333v1,本文重新审视了模型推理阶段的计算规模效应，指出以往研究高估了小模型的效率，忽略了推理时的内存访问瓶颈。作者提出了新的“动力学规模法则”，综合考虑计算和内存成本，发现较大模型在推理时更具优势。基于此，论文引入了稀疏注意力机制，显著降低了每个生成步骤的资源消耗，使得模型能在相同资源下实现更长生成和更多并行样本。实验证明，稀疏注意力模型在问题解决准确率上优于传统密集模型，尤其在资源有限时提升显著，展示了稀疏注意力在推理扩展中的关键作用。
Unleashing Hour-Scale Video Training for Long Video-Language Understanding,释放小时级视频训练以实现长视频语言理解,05 Jun 2025,Multimodal LLM,Other,http://arxiv.org/pdf/2506.05332v1,http://arxiv.org/abs/2506.05332v1,2506.05332v1,本文提出了VideoMarathon，一个涵盖约9700小时长视频的大规模多领域数据集，包含330万高质量问答对，支持多种视频理解任务，显著扩展了长视频训练的时长。基于此，作者设计了Hour-LLaVA模型，通过记忆增强机制实现了对小时级视频的高效训练与推理。实验结果表明，Hour-LLaVA在多个长视频语言理解基准测试中表现优异，验证了数据集和模型在长视频理解领域的有效性和先进性。
MINT-CoT: Enabling Interleaved Visual Tokens in Mathematical Chain-of-Thought Reasoning,MINT-CoT：在数学链式思维推理中实现交错视觉标记,05 Jun 2025,Multimodal LLM,Other,http://arxiv.org/pdf/2506.05331v1,http://arxiv.org/abs/2506.05331v1,2506.05331v1,本文提出了MINT-CoT，一种在数学推理中灵活融合视觉信息的新方法，突破了以往依赖粗糙图像区域和有限视觉理解能力的限制。通过引入可动态选择任意形状视觉区域的交错视觉标记，MINT-CoT实现了图文推理的深度结合。作者构建了包含5.4万道数学题的标注数据集，并设计了分阶段训练策略，显著提升了模型在多模态数学问题上的表现。实验结果显示，MINT-CoT在多个数学视觉推理基准上均取得了大幅领先，验证了其在复杂数学视觉推理任务中的有效性和实用价值。
AV-Reasoner: Improving and Benchmarking Clue-Grounded Audio-Visual Counting for MLLMs,AV-Reasoner：提升与评测基于线索的多模态音视频计数能力,05 Jun 2025,Multimodal LLM,Other,http://arxiv.org/pdf/2506.05328v1,http://arxiv.org/abs/2506.05328v1,2506.05328v1,"本文针对多模态大语言模型（MLLMs）在视频计数任务中的不足，提出了CG-AV-Counting，一个包含497个长视频、1,027个多模态问题及5,845条线索的手工标注基准，支持多种评测方式。基于此，作者设计了AV-Reasoner模型，结合强化学习和逐步学习策略，提升模型的计数能力，并在多个基准测试中取得领先表现。研究还发现，语言空间的推理在跨领域任务中效果有限。该工作为多模态计数任务提供了新的数据资源和有效方法。"
Revisiting Depth Representations for Feed-Forward 3D Gaussian Splatting,重新审视用于前馈3D高斯点溅射的深度表示,05 Jun 2025,Other,Other,http://arxiv.org/pdf/2506.05327v1,http://arxiv.org/abs/2506.05327v1,2506.05327v1,本文针对基于深度图的三维高斯点云渲染方法中，由于物体边界深度不连续导致点云稀疏和渲染质量下降的问题，提出了一种基于预训练变换器预测的点图的新型正则化损失（PM-Loss）。该方法通过增强几何平滑性，尤其是在边界处，有效提升了深度图的质量。实验表明，改进后的深度表示在多种网络结构和场景中均显著提升了渲染效果，推动了高效准确的三维视图合成技术的发展。
LSM-2: Learning from Incomplete Wearable Sensor Data,LSM-2：从不完整的可穿戴传感器数据中学习,05 Jun 2025,Other,Other,http://arxiv.org/pdf/2506.05321v1,http://arxiv.org/abs/2506.05321v1,2506.05321v1,本文提出了第二代大规模传感器模型LSM-2，采用了一种创新的自监督学习方法——自适应继承掩码（AIM），能够直接从不完整的可穿戴传感器数据中学习有效表示，无需对缺失数据进行填补。该方法通过引入可学习的掩码标记，灵活处理真实世界中常见的数据缺失问题。LSM-2在包含4000万小时多模态传感器数据的大规模预训练下，在分类、回归和生成任务中表现优异，且在模拟临床场景的缺失数据环境中依然保持高性能，展现了其在实际应用中的稳健性和可靠性。
"Generalizable, real-time neural decoding with hybrid state-space models",具有通用性和实时性的混合状态空间模型神经解码,05 Jun 2025,Other,Other,http://arxiv.org/pdf/2506.05320v1,http://arxiv.org/abs/2506.05320v1,2506.05320v1,本文提出了一种名为POSSM的混合模型，结合了跨注意力机制和递归状态空间模型，实现了对神经活动的实时、高效解码。该方法兼顾了快速在线预测和对新任务、新个体的良好泛化能力。实验证明，POSSM在猴子运动任务和人类书写、语音解码中表现出与先进Transformer模型相当的准确性，但推理速度提升了近九倍。特别地，跨物种预训练显著提升了人类任务的解码效果，展示了该方法在神经接口和临床应用中的广泛潜力。
ProJo4D: Progressive Joint Optimization for Sparse-View Inverse Physics Estimation,ProJo4D：用于稀疏视角逆物理估计的渐进式联合优化,05 Jun 2025,Other,Other,http://arxiv.org/pdf/2506.05317v1,http://arxiv.org/abs/2506.05317v1,2506.05317v1,本文提出了ProJo4D，一种用于稀疏视角下物理参数估计的渐进式联合优化框架。该方法通过逐步扩展同时优化的参数集合，有效解决了传统方法在三维重建和物理参数估计中的误差累积和优化困难问题。实验结果表明，ProJo4D在未来状态预测、新视角渲染及材料参数估计方面均优于现有方法，提升了基于视觉数据的物理场景理解能力，具有广泛的应用潜力。
Improving Data Efficiency for LLM Reinforcement Fine-tuning Through Difficulty-targeted Online Data Selection and Rollout Replay,通过难度定向的在线数据选择与回滚重放提升大语言模型强化学习微调的数据效率,05 Jun 2025,LLM,Other,http://arxiv.org/pdf/2506.05316v1,http://arxiv.org/abs/2506.05316v1,2506.05316v1,本文针对大型语言模型的强化学习微调中数据效率低的问题，提出了两种改进方法：基于自适应难度的在线数据选择和回放机制。通过优先选择中等难度的问题，模型能获得更有效的学习信号；利用注意力机制估计问题难度，减少了计算开销。同时，回放机制复用近期计算结果，降低了每步训练成本。实验证明，该方法在多个模型和数据集上显著缩短了训练时间，提升了数据利用效率，达到了与传统方法相当的性能水平。
Constrained Entropic Unlearning: A Primal-Dual Framework for Large Language Models,受限熵式遗忘：一种用于大语言模型的原始-对偶框架,05 Jun 2025,LLM,Other,http://arxiv.org/pdf/2506.05314v1,http://arxiv.org/abs/2506.05314v1,2506.05314v1,本文提出了一种面向大语言模型的信息“遗忘”新方法，将忘记敏感或过时信息的问题转化为带约束的优化任务。通过设计一种稳定且高效的损失函数，显式推动模型在指定数据上输出均匀分布，同时严格保持对其他数据的性能。该方法采用可扩展的原始-对偶算法实现，能灵活平衡遗忘与保留。实验证明，该方法在多个基准测试中优于现有技术，有效去除目标信息且保持模型整体表现，提升了大语言模型在实际应用中的安全性和可靠性。
Learning normalized image densities via dual score matching,通过双重得分匹配学习归一化图像密度,05 Jun 2025,Diffusion Model,Other,http://arxiv.org/pdf/2506.05310v1,http://arxiv.org/abs/2506.05310v1,2506.05310v1,本文提出了一种基于双重得分匹配的新方法，用于学习归一化的图像概率模型。该方法通过改进得分网络结构，使其不仅能估计图像的概率梯度，还能计算能量函数，并引入额外的优化目标以保证不同噪声水平下能量的一致性和归一化。实验在ImageNet64数据集上取得了与现有最先进方法相当的性能，且模型表现出较强的泛化能力。此外，研究发现图像的概率分布和局部结构维度随内容显著变化，挑战了传统的低维流形假设。该工作为高维图像概率建模提供了新的有效途径。
Time to Talk: LLM Agents for Asynchronous Group Communication in Mafia Games,该说话了：用于Mafia游戏中异步群体交流的LLM智能体,05 Jun 2025,Agent,Other,http://arxiv.org/pdf/2506.05309v1,http://arxiv.org/abs/2506.05309v1,2506.05309v1,本文提出了一种能够自主决定发言时机和内容的异步大型语言模型代理，专门用于模拟多人社交环境中的非轮流交流。通过在在线“黑手党”游戏中的实验，结果显示该代理在游戏表现和融入人类玩家方面与真实玩家相当。研究还发现代理在发言时机上的决策与人类相似，但在信息内容上存在差异。该工作推动了大型语言模型在更真实的多人异步交流场景中的应用，为团队协作、教育和职业环境中的复杂社交互动提供了新的技术支持。
ProRefine: Inference-time Prompt Refinement with Textual Feedback,ProRefine：基于文本反馈的推理时提示词优化方法,05 Jun 2025,Agent,Other,http://arxiv.org/pdf/2506.05305v1,http://arxiv.org/abs/2506.05305v1,2506.05305v1,本文提出了ProRefine，一种在推理过程中动态优化提示词的方法，通过利用大型语言模型生成的文本反馈，自动改进多步骤推理任务中的提示设计，无需额外训练或标注。该方法在五个数学推理基准测试中显著优于传统零样本链式思维策略，提升准确率3%至37%。ProRefine不仅增强了推理效果，还使较小模型达到大模型的性能水平，展现出提升AI系统可靠性和扩展性的潜力，有助于推动高效且普及的智能应用发展。
"Perceive Anything: Recognize, Explain, Caption, and Segment Anything in Images and Videos",Perceive Anything：图像与视频中的识别、解释、描述与分割,05 Jun 2025,Multimodal LLM,Other,http://arxiv.org/pdf/2506.05302v1,http://arxiv.org/abs/2506.05302v1,2506.05302v1,本文提出了Perceive Anything Model（PAM），一种高效且易用的视觉理解框架，能够在图像和视频中实现区域级别的对象分割及多样化语义信息生成。通过结合先进的分割模型和大型语言模型，PAM不仅能识别对象，还能提供类别、功能解释和详细描述。作者还构建了包含大量高质量标注的新数据集，提升模型的多层次理解能力。PAM在性能和资源消耗上优于现有方法，具备良好的实用价值，为区域视觉理解领域提供了有力的基线方案。
Power Law Guided Dynamic Sifting for Efficient Attention,基于幂律引导的动态筛选用于高效注意力机制,05 Jun 2025,LLM,Other,http://arxiv.org/pdf/2506.05300v1,http://arxiv.org/abs/2506.05300v1,2506.05300v1,本文针对大语言模型在GPU上推理时因内存带宽限制导致的效率瓶颈，提出了一种名为SiftAttention的近似注意力机制。该方法通过动态估计阈值，筛选出重要的注意力分数及对应向量，替代传统计算量大且效率低的top-k操作，从而减少了数据传输量。实验证明，SiftAttention在保持模型性能的同时，有效降低了内存带宽使用，提升了推理效率，具有较高的实用价值。
Control Tax: The Price of Keeping AI in Check,Control Tax：保持AI受控的代价,05 Jun 2025,Agent,Other,http://arxiv.org/pdf/2506.05296v1,http://arxiv.org/abs/2506.05296v1,2506.05296v1,本文提出了“控制成本”概念，量化在人工智能系统中实施安全监督措施所带来的运营和财务负担。通过建立理论框架，作者将模型性能与安全保障关联起来，并在对抗环境中评估了先进语言模型的检测能力。此外，论文还提供了控制方案的实际成本估算，设计了在预算限制下兼顾安全性与经济性的监控策略。该研究为人工智能安全控制的经济可行性提供了系统评估工具，促进了其在实际应用中的合理部署。
Sample Complexity and Representation Ability of Test-time Scaling Paradigms,测试时缩放范式的样本复杂度与表示能力,05 Jun 2025,LLM,Other,http://arxiv.org/pdf/2506.05295v1,http://arxiv.org/abs/2506.05295v1,2506.05295v1,本文系统分析了大型语言模型在测试阶段采用的多种采样策略的样本效率，发现“最佳选择”策略在样本需求上优于“自洽性”策略。此外，研究表明带有验证反馈的自我纠正方法使单一模型能够在未知任务环境中实现多任务学习，拓展了模型的表达能力。最后，通过实验证实了理论分析的有效性，展示了自我纠正策略在实际应用中的潜力。该工作深化了对测试时扩展技术的理解，为提升语言模型的泛化能力提供了理论支持。
A Smooth Sea Never Made a Skilled $\texttt{SAILOR}$: Robust Imitation via Learning to Search,风平浪静造不出能干的水手：通过学习搜索实现鲁棒模仿的SAILOR方法,05 Jun 2025,Agent,Other,http://arxiv.org/pdf/2506.05294v1,http://arxiv.org/abs/2506.05294v1,2506.05294v1,本文针对传统模仿学习中行为克隆方法只能复制专家在有限状态下的操作，难以应对错误后恢复的问题，提出了一种基于“学习搜索”的新方法SAILOR。该方法通过学习环境模型和奖励模型，使智能体能够在测试时自主规划，恢复并完成专家目标。实验证明，SAILOR在多个视觉操作任务中显著优于现有基于行为克隆的扩散策略，且在示范数据量大幅增加时仍保持优势，具备识别细微失败和防止奖励欺骗的能力，提升了模仿学习的鲁棒性和实用性。
"EOC-Bench: Can MLLMs Identify, Recall, and Forecast Objects in an Egocentric World?",EOC-Bench：多模态大语言模型能否在第一视角世界中识别、回忆及预测物体？,05 Jun 2025,Embodied AI,Other,http://arxiv.org/pdf/2506.05287v1,http://arxiv.org/abs/2506.05287v1,2506.05287v1,"本文提出了EOC-Bench，一个专门评测多模态大语言模型在动态第一视角环境中识别、记忆和预测物体能力的新基准。该基准包含3,277个涵盖过去、现在和未来三种时间维度的问答对，覆盖多种细致的评价指标和视觉引用类型。通过引入人机协作的多样化标注方法及创新的时间准确度评测，EOC-Bench能够全面衡量模型对动态物体变化的理解。基于此，作者对多种模型进行了系统评测，推动了多模态模型在具身认知领域的发展，为构建更可靠的智能交互系统奠定基础。"
Stable Vision Concept Transformers for Medical Diagnosis,用于医学诊断的稳定视觉概念Transformer,05 Jun 2025,Other,Other,http://arxiv.org/pdf/2506.05286v1,http://arxiv.org/abs/2506.05286v1,2506.05286v1,本文针对医疗诊断中模型透明性和解释性的需求，提出了稳定视觉概念变换器（Stable Vision Concept Transformer，SVCT）。该方法在传统概念瓶颈模型基础上，融合了图像的内在特征与高层次概念特征，提升了模型的决策能力和解释稳定性。通过引入去噪扩散平滑技术，SVCT在面对输入扰动时仍能保持准确且可信的解释。实验证明，SVCT在多个医疗数据集上既保证了诊断准确性，又增强了解释的可靠性，满足了医疗领域对可解释AI的严格要求。
