标题,中文标题,发布日期,领域分类,研究机构,PDF链接,论文链接,arXiv ID,简明摘要
Reconfigurable Tendon-Driven Robots: Eliminating Inter-segmental Coupling via Independently Lockable Joints,可重构肌腱驱动机器人：通过独立锁定关节消除节间耦合,23 Jul 2025,Embodied AI,Other,http://arxiv.org/pdf/2507.17163v1,http://arxiv.org/abs/2507.17163v1,2507.17163v1,本文提出了一种具有独立锁定关节的新型肌腱驱动机器人，通过控制关节的锁定与释放，有效消除了机器人各段之间的相互影响，简化了控制难度。该设计无需持续供能即可保持关节状态，允许操作人员灵活选择运动段，实现更精准的动作控制。通过仿真和实验验证，该机器人在工作空间和运动能力上优于传统设计，且使用更少电机即可完成复杂环境中的多关节运动，展现出良好的可重构性和实用价值。
DOOMGAN:High-Fidelity Dynamic Identity Obfuscation Ocular Generative Morphing,DOOMGAN：高保真动态身份混淆眼部生成变形,23 Jul 2025,Other,Other,http://arxiv.org/pdf/2507.17158v1,http://arxiv.org/abs/2507.17158v1,2507.17158v1,本文提出了DOOMGAN，一种针对可见光眼部生物特征的高保真身份混淆生成方法。该方法通过结合眼部关键点编码和注意力机制，实现了在复杂环境下真实感强的眼部图像融合，有效保留了虹膜边界和周围纹理细节。实验结果表明，DOOMGAN在攻击成功率、虹膜结构准确性和视线一致性方面显著优于现有方法。此外，论文还发布了首个全面的眼部混合数据集，为相关研究提供了重要资源，推动了眼部生物特征识别安全性的提升。
UNICE: Training A Universal Image Contrast Enhancer,UNICE：训练通用图像对比度增强器,23 Jul 2025,Other,Other,http://arxiv.org/pdf/2507.17157v1,http://arxiv.org/abs/2507.17157v1,2507.17157v1,本文提出了一种通用图像对比度增强方法UNICE，旨在解决现有方法在不同任务和数据集间泛化能力不足的问题。作者通过收集大量高动态范围（HDR）原始图像，生成多曝光序列及其伪真值，训练网络从单张图像生成多曝光序列，再融合为增强图像。该方法无需人工标注，显著提升了跨任务和跨数据集的对比度增强效果，在多项无参考图像质量指标上优于现有方法和人工真值，展示了良好的实用价值和推广潜力。
JAM: Keypoint-Guided Joint Prediction after Classification-Aware Marginal Proposal for Multi-Agent Interaction,JAM：基于关键点引导的分类感知边缘提议后的多智能体交互联合预测,23 Jul 2025,Agent,Other,http://arxiv.org/pdf/2507.17152v1,http://arxiv.org/abs/2507.17152v1,2507.17152v1,本文提出了一种名为JAM的两阶段多智能体交互预测框架，旨在提升自动驾驶中多参与者未来轨迹预测的质量。第一阶段通过分类引导模型学习多样化轨迹类型，提供丰富的模式信息；第二阶段利用关键路径点引导联合预测，更准确地捕捉轨迹间的关联。实验结果表明，JAM在真实数据集上表现优异，优于现有方法，达到了交互轨迹预测的先进水平。该方法为复杂交通场景下的多智能体行为预测提供了有效解决方案。
CogDual: Enhancing Dual Cognition of LLMs via Reinforcement Learning with Implicit Rule-Based Rewards,CogDual：通过隐式规则奖励的强化学习提升大语言模型的双重认知能力,23 Jul 2025,Agent,Other,http://arxiv.org/pdf/2507.17147v1,http://arxiv.org/abs/2507.17147v1,2507.17147v1,本文提出了CogDual，一种基于认知心理学启发的角色扮演语言模型，采用“先认知后响应”的推理方式，同时结合外部情境感知与内部自我意识，从而提升生成文本的角色一致性和情境契合度。通过引入基于隐式规则的强化学习奖励机制，CogDual在多个角色扮演任务中表现优异，显著优于现有方法，展现出良好的泛化能力。该研究为提升大型语言模型在复杂角色模拟中的认知能力提供了新思路。
Falconry-like palm landing by a flapping-wing drone based on the human gesture interaction and distance-aware flight planning,基于人体手势交互与距离感知飞行规划的类猎鹰手掌着陆振翼无人机,23 Jul 2025,Embodied AI,Other,http://arxiv.org/pdf/2507.17144v1,http://arxiv.org/abs/2507.17144v1,2507.17144v1,本文提出了一种仿猎鹰引导方式的互动系统，使带有振翅翼的无人机能够安全地在人体手掌上着陆。通过设计结合飞行速度和与人体距离的轨迹规划方法，系统有效保障了用户的物理和心理安全。实验结果表明，该方法实现了无人机与人之间首次基于接触的安全互动，展示了振翅无人机在人机交互和狭小环境应用中的潜力。
Towards Human-level Intelligence via Human-like Whole-Body Manipulation,通过类人全身操作迈向人类水平智能,23 Jul 2025,Embodied AI,Other,http://arxiv.org/pdf/2507.17141v1,http://arxiv.org/abs/2507.17141v1,2507.17141v1,本文提出了Astribot Suite，一套面向日常多样环境的全身操控机器人学习系统，旨在推动通用智能机器人的发展。该系统通过设计具有人体水平能力的安全硬件、直观的全身远程操作界面及从人类示范中学习的算法，有效解决了实现全身视觉运动控制的关键难题。实验表明，Astribot能完成需要全身协调、灵活性和精细操作的多种任务，展示了其在实现类人智能机器人方面的重要潜力和应用前景。
Multi-Objective Trajectory Planning for a Robotic Arm in Curtain Wall Installation,用于幕墙安装的机械臂多目标轨迹规划,23 Jul 2025,Embodied AI,Other,http://arxiv.org/pdf/2507.17140v1,http://arxiv.org/abs/2507.17140v1,2507.17140v1,本文针对幕墙安装中机器人臂的轨迹规划问题，提出了一种多目标优化方法，以应对复杂施工环境下的多重需求。设计了一种结合多种机械结构的机器人臂，并引入了一种改进的优化算法（NSGA-III-FO），该算法通过聚焦机制加快收敛速度，显著提升了多目标规划的效率。通过标准测试函数和实际机器人平台实验验证，结果表明该方法在轨迹规划的准确性和实用性方面具有较大优势，有助于提高建筑机器人在施工中的性能和适应性。
Dynamic Parameter Identification of a Curtain Wall Installation Robotic Arm,幕墙安装机器人臂的动态参数识别,23 Jul 2025,Embodied AI,Other,http://arxiv.org/pdf/2507.17136v1,http://arxiv.org/abs/2507.17136v1,2507.17136v1,本文针对幕墙安装中的效率和质量需求，设计了一种液压驱动的机器人臂及其动态参数识别方法。通过建立机器人结构与液压系统的联合动力学模型，设计优化激励信号以充分激发系统参数，采用分层递进的最小二乘法识别策略，实现了机器人臂及液压缸动态参数的高精度识别。实验结果表明，该方法能有效降低理论与实测关节力矩误差，提升了幕墙安装机器人的智能化水平和作业性能。
SADA: Stability-guided Adaptive Diffusion Acceleration,SADA：基于稳定性引导的自适应扩散加速,23 Jul 2025,Diffusion Model,Other,http://arxiv.org/pdf/2507.17135v1,http://arxiv.org/abs/2507.17135v1,2507.17135v1,本文提出了SADA，一种基于稳定性指导的自适应加速方法，用于提升扩散模型的采样效率。该方法通过统一考虑采样过程中的时间步和信息单元的稀疏性，结合数值求解的梯度信息，动态调整计算资源分配，从而显著减少计算成本。实验证明，SADA在多个主流模型和任务中均实现了近两倍的加速，同时保持生成质量几乎无损，优于现有无训练加速策略。此外，SADA具备良好的通用性，可无缝应用于不同模型和数据类型，展现出广泛的实用价值。
Resilient Multi-Agent Negotiation for Medical Supply Chains:Integrating LLMs and Blockchain for Transparent Coordination,面向医疗供应链的弹性多智能体协商：集成大语言模型与区块链实现透明协调,23 Jul 2025,Agent,Other,http://arxiv.org/pdf/2507.17134v1,http://arxiv.org/abs/2507.17134v1,2507.17134v1,本文提出了一种结合区块链技术和大型语言模型驱动的多智能体协商系统的新框架，旨在提升医疗供应链在突发公共卫生事件中的韧性和透明度。该系统通过自主代理代表不同利益方进行高效、公正的资源分配决策，区块链确保决策过程的不可篡改和可追溯。仿真结果表明，该方法显著增强了供应链的响应能力和审计性，为应对动态不确定性下的医疗物资协调提供了一种创新且可扩展的解决方案。
Dynamic Modeling and Dimensional Optimization of Legged Mechanisms for Construction Robot,用于建筑机器人的腿式机构动态建模与尺寸优化,23 Jul 2025,Embodied AI,Other,http://arxiv.org/pdf/2507.17132v1,http://arxiv.org/abs/2507.17132v1,2507.17132v1,本文针对建筑机器人在复杂环境下的高能效、高机动性和大载重需求，设计并优化了仿生多足机械结构。通过建立动态模型并结合运动轨迹，提出了一种结构优化方法，对机械腿的几何参数进行了系统优化。优化结果显示，机械腿的关节峰值扭矩和能耗均降低了20%以上。仿真验证进一步证明了优化方案有效性。该研究为高性能建筑机器人的设计提供了理论依据和技术支持。
Enabling Self-Improving Agents to Learn at Test Time With Human-In-The-Loop Guidance,使能具有人类参与指导的自我改进智能体在测试时学习,23 Jul 2025,Agent,ByteDance,http://arxiv.org/pdf/2507.17131v1,http://arxiv.org/abs/2507.17131v1,2507.17131v1,本文提出了一种名为ARIA的自我改进型大语言模型代理框架，旨在解决模型在规则和领域知识频繁变化环境中的适应难题。ARIA通过主动识别自身知识盲点，与人类专家互动获取指导，并动态更新内部知识库，从而实现测试时的持续学习。实验证明，ARIA在客户尽职调查等实际任务中显著提升了准确性和适应性，且已成功应用于TikTok Pay，支持数亿用户，展示了其在快速变化场景中的实用价值。
"MARSCalib: Multi-robot, Automatic, Robust, Spherical Target-based Extrinsic Calibration in Field and Extraterrestrial Environments",MARSCalib：基于多机器人系统的自动鲁棒球形目标外参标定方法，适用于野外及外星环境,23 Jul 2025,Other,Other,http://arxiv.org/pdf/2507.17130v1,http://arxiv.org/abs/2507.17130v1,2507.17130v1,本文提出了一种基于球形目标的多机器人激光雷达与相机外参自动标定方法，专为户外及行星环境设计。该方法通过图像中的椭圆中心与点云中的球心配对，计算传感器间的变换矩阵，具备对目标和传感器数据损坏的鲁棒性。实验验证了该方法在多种激光雷达类型和不同相机位置下的有效性，且在目标受损情况下仍能准确检测球体，优于传统标定目标。该方法提升了多机器人系统在复杂环境中的标定可靠性，代码已开源。
BucketServe: Bucket-Based Dynamic Batching for Smart and Efficient LLM Inference Serving,BucketServe：基于桶的动态批处理用于智能高效的LLM推理服务,23 Jul 2025,LLM,Other,http://arxiv.org/pdf/2507.17120v1,http://arxiv.org/abs/2507.17120v1,2507.17120v1,本文提出了BucketServe，一种基于请求长度分组的动态批处理框架，旨在提升大语言模型推理服务的效率。通过将相似长度的请求归为一组，BucketServe有效减少了计算资源浪费和内存溢出风险，并通过智能调整批次大小及优先级调度，适应动态负载变化，保障服务响应时间。实验结果表明，BucketServe在吞吐量和系统负载能力上显著优于现有方法，提升了大语言模型在实际应用中的性能和稳定性。
HySafe-AI: Hybrid Safety Architectural Analysis Framework for AI Systems: A Case Study,HySafe-AI：面向AI系统的混合安全架构分析框架——案例研究,23 Jul 2025,Other,Other,http://arxiv.org/pdf/2507.17118v1,http://arxiv.org/abs/2507.17118v1,2507.17118v1,本文针对安全关键领域中广泛应用的人工智能系统，特别是端到端单体架构如大型语言模型，提出了一种混合安全架构分析框架HySafe-AI。作者评估了传统安全分析方法（如失效模式与影响分析、故障树分析）在处理复杂模型内部表示时的局限，并提出改进方案以提升其适用性。该框架有效结合传统技术与AI系统特点，为保障未来人工智能系统的安全性提供了新的思路和方法，推动了AI安全标准的发展。
Probabilistic Graphical Models: A Concise Tutorial,概率图模型：简明教程,23 Jul 2025,Other,Other,http://arxiv.org/pdf/2507.17116v1,http://arxiv.org/abs/2507.17116v1,2507.17116v1,本文简明介绍了概率图模型这一机器学习领域的重要工具，该模型通过结合概率论与图论，提供了一种紧凑且直观的方式来表示复杂的概率关系。论文系统讲解了多变量概率分布的图形表示方法，参数及结构的学习算法，以及用于推断的精确与近似算法。该教程不仅阐释了理论基础，还展示了模型在不确定环境下进行预测和决策的应用价值，为读者理解和使用概率图模型提供了实用指导。
Reinforcement Learning Fine-Tunes a Sparse Subnetwork in Large Language Models,强化学习微调大型语言模型中的稀疏子网络,23 Jul 2025,LLM,"OpenAI, Meta",http://arxiv.org/pdf/2507.17107v1,http://arxiv.org/abs/2507.17107v1,2507.17107v1,本文发现，在强化学习微调大型语言模型时，仅有5%至30%的参数发生显著变化，其余参数保持不变，呈现出一种自然产生的稀疏更新现象。该稀疏子网络在不同算法、模型及数据间表现出高度一致性，且仅调整这部分参数即可达到与全模型微调相当的性能。研究表明，强化学习主要通过针对性修改模型的一小部分参数来适应任务需求，为提升微调效率和理解模型适应机制提供了新视角。
Weather-Aware AI Systems versus Route-Optimization AI: A Comprehensive Analysis of AI Applications in Transportation Productivity,天气感知AI系统与路径优化AI：交通生产力中AI应用的综合分析,23 Jul 2025,Other,Other,http://arxiv.org/pdf/2507.17099v1,http://arxiv.org/abs/2507.17099v1,2507.17099v1,本文通过对比传统路线优化AI与集成天气预测的综合AI系统，揭示了后者在提升出租车司机生产力方面的显著优势。基于1万次模拟运营数据，研究发现天气感知AI系统使司机收入提升107.3%，远超仅优化路线的14%。天气预测对需求变化的影响尤为关键，带来最大增益。经济分析显示该系统具备快速回本和高投资回报潜力。研究指出，当前AI应用过于局限于路线优化，忽视了天气等多维因素，未来应采用更全面的智能方案以实现运输效率的根本提升。
IONext: Unlocking the Next Era of Inertial Odometry,IONext：开启惯性测程的新时代,23 Jul 2025,Embodied AI,Other,http://arxiv.org/pdf/2507.17089v1,http://arxiv.org/abs/2507.17089v1,2507.17089v1,本文提出了一种基于卷积神经网络的新型惯性里程计方法IONext，旨在克服现有Transformer模型对局部运动细节感知不足的问题。核心创新包括双翼自适应动态混合模块（DADM），用于同时捕捉全局和局部运动特征，以及时空门控单元（STGU），提升时间维度的运动特征提取能力。实验结果表明，IONext在多个公开数据集上显著优于现有先进方法，有效提升了定位精度和鲁棒性，展示了其在惯性里程计领域的广泛应用潜力。
Deformable Cluster Manipulation via Whole-Arm Policy Learning,通过全臂策略学习进行可变形簇群操控,22 Jul 2025,Embodied AI,Other,http://arxiv.org/pdf/2507.17085v1,http://arxiv.org/abs/2507.17085v1,2507.17085v1,本文提出了一种基于强化学习的全臂策略框架，用于操控变形物体簇，解决了传统方法在模型构建、感知不确定性及空间抽象效率方面的不足。该方法融合三维点云和触觉信息，实现了全身接触感知，提升了训练效率和实时推理能力。通过设计新的遮挡处理策略，系统在电力线清理任务中展现出多臂协同的创新操作能力。最终，方法实现了无须额外训练的仿真到现实环境迁移，成功应对真实场景中复杂的遮挡和动态变化，具有广泛应用潜力。
SDGOCC: Semantic and Depth-Guided Bird's-Eye View Transformation for 3D Multimodal Occupancy Prediction,SDGOCC：基于语义和深度引导的鸟瞰视角变换用于三维多模态占用预测,22 Jul 2025,Other,Other,http://arxiv.org/pdf/2507.17083v1,http://arxiv.org/abs/2507.17083v1,2507.17083v1,本文提出了一种名为SDG-OCC的多模态三维占用预测网络，结合语义和深度信息，实现更准确的视角变换和特征融合。该方法通过融合像素语义与激光雷达深度数据，提升深度估计精度，并通过主动蒸馏机制增强图像特征的语义表达。实验结果表明，SDG-OCC在多个自动驾驶数据集上实现了实时且领先的性能，展示了其在复杂环境下的鲁棒性和实用价值。相关代码已公开，有助于推动多模态感知技术的发展。
VL-CLIP: Enhancing Multimodal Recommendations via Visual Grounding and LLM-Augmented CLIP Embeddings,VL-CLIP：通过视觉定位与大语言模型增强的CLIP嵌入提升多模态推荐,22 Jul 2025,Multimodal LLM,Other,http://arxiv.org/pdf/2507.17080v1,http://arxiv.org/abs/2507.17080v1,2507.17080v1,本文提出了VL-CLIP框架，针对电商推荐中现有视觉-语言模型在细粒度视觉理解、文本描述歧义及领域适应性方面的不足，结合视觉定位技术和大语言模型辅助文本增强，提升了图像与文本的匹配效果。该方法在美国大型电商平台上显著提升了点击率、加购率和成交额，且在多项检索和推荐指标上优于现有主流模型，展示了细粒度视觉信息与丰富文本表达结合在多模态推荐中的应用潜力。
LoRA is All You Need for Safety Alignment of Reasoning LLMs,LoRA是推理大语言模型安全对齐的全部所需,22 Jul 2025,LLM,Other,http://arxiv.org/pdf/2507.17075v1,http://arxiv.org/abs/2507.17075v1,2507.17075v1,本文针对大型推理语言模型在安全对齐微调过程中出现的“安全成本”问题，即安全性提升伴随推理能力下降，提出了基于低秩适配（LoRA）的方法。该方法通过限制权重更新在低秩空间，有效实现了安全对齐而不损害模型的推理性能。大量实验表明，LoRA微调在保证与全模型微调相当的安全水平的同时，显著减少了对推理能力的负面影响。研究还探讨了进一步减少权重更新重叠的策略，展示了在某些任务上的潜在改进，推动了推理能力与安全性平衡的优化方向。
Advancing Robustness in Deep Reinforcement Learning with an Ensemble Defense Approach,利用集成防御方法提升深度强化学习的鲁棒性,22 Jul 2025,Agent,Other,http://arxiv.org/pdf/2507.17070v1,http://arxiv.org/abs/2507.17070v1,2507.17070v1,本文针对深度强化学习（DRL）在自动驾驶中的鲁棒性问题，提出了一种基于集成防御的新架构，以抵御对抗性攻击。通过在高速公路和合流场景中的实验验证，该方法显著提升了模型的稳定性和安全性，平均奖励值较传统方法提升超过两倍，碰撞率则大幅降低。研究结果表明，集成防御策略优于单一防御手段，为提升自动驾驶系统在复杂环境下的可靠性提供了有效方案。
Risk In Context: Benchmarking Privacy Leakage of Foundation Models in Synthetic Tabular Data Generation,风险语境：基础模型在合成表格数据生成中的隐私泄露基准测试,22 Jul 2025,LLM,Other,http://arxiv.org/pdf/2507.17066v1,http://arxiv.org/abs/2507.17066v1,2507.17066v1,本文针对低数据环境下利用大型预训练模型生成合成表格数据的隐私风险进行了系统评估。通过对比三种基础模型与四个传统方法，在35个真实数据集上分析了数据质量、实用性及隐私泄露情况。结果表明，基础模型在隐私保护方面存在显著风险，部分模型的敏感信息泄露率远高于传统方法。研究还发现，通过调整生成参数和输入方式，可以在保持数据质量的同时显著降低隐私泄露。该工作为在数据有限情况下安全使用基础模型生成合成数据提供了实用指导。
Parallelism Meets Adaptiveness: Scalable Documents Understanding in Multi-Agent LLM Systems,并行性遇上自适应性：多智能体大语言模型系统中的可扩展文档理解,22 Jul 2025,Agent,Other,http://arxiv.org/pdf/2507.17061v1,http://arxiv.org/abs/2507.17061v1,2507.17061v1,本文提出了一种多智能体大语言模型协作框架，通过动态任务分配、双向反馈和并行评估三大机制，实现了系统的自适应能力。该框架允许智能体根据任务难度和工作负载灵活调整分工，互相提供结构化反馈以提升结果质量，并通过竞争选择最优输出。实验结果显示，该方法在信息覆盖、内容连贯性和处理效率上显著优于传统固定流程和部分自适应系统，展示了结合灵活协作与有序竞争对提升多智能体协作效果的重要价值。
Shared Control of Holonomic Wheelchairs through Reinforcement Learning,通过强化学习实现全向轮椅的共享控制,22 Jul 2025,Embodied AI,Other,http://arxiv.org/pdf/2507.17055v1,http://arxiv.org/abs/2507.17055v1,2507.17055v1,本文提出了一种基于强化学习的共享控制方法，提升全向电动轮椅的操控体验。该方法通过将二维用户输入转换为三维运动指令，兼顾用户舒适度和减轻认知负担，实现安全且直观的导航。作者在仿真环境中比较了不同模型和奖励设计，结果显示该方法在避免碰撞和运动平滑度方面优于传统非学习方法。最后，研究实现了强化学习共享控制在真实全向轮椅上的首次应用，展示了其实际可行性和潜在价值。
New Mechanisms in Flex Distribution for Bounded Suboptimal Multi-Agent Path Finding,用于有界次优多智能体路径规划的灵活分配新机制,22 Jul 2025,Agent,Other,http://arxiv.org/pdf/2507.17054v1,http://arxiv.org/abs/2507.17054v1,2507.17054v1,本文针对多智能体路径规划中的有界次优算法EECBS，提出了三种新的灵活分配机制：基于冲突数量的分配、基于延迟估计的分配及其混合策略。新机制有效调整路径代价阈值，避免了原有方法中因阈值过大导致效率下降的问题，保证了算法的完整性和有界次优性。实验结果表明，所提方法在提升规划效率和解质量方面优于传统的贪心灵活分配策略，推动了多智能体路径规划算法的性能提升。
Toward Scalable Video Narration: A Training-free Approach Using Multimodal Large Language Models,迈向可扩展视频叙述：一种基于多模态大语言模型的无训练方法,22 Jul 2025,Multimodal LLM,Other,http://arxiv.org/pdf/2507.17050v1,http://arxiv.org/abs/2507.17050v1,2507.17050v1,本文提出了VideoNarrator，一种无需额外训练的视频解说生成方法，能够为视频内容生成带有精确时间戳的详细描述。该方法通过结合多模态大语言模型和视觉语言模型，提升了视频叙述的时间对齐准确性，显著减少了错误信息的出现。实验结果表明，该系统不仅增强了视频理解能力，还为视频摘要和问答等下游任务提供了支持，具备广泛的应用潜力。
Evaluating Uncertainty and Quality of Visual Language Action-enabled Robots,评估具备视觉语言动作能力机器人的不确定性与质量,22 Jul 2025,Embodied AI,Other,http://arxiv.org/pdf/2507.17049v1,http://arxiv.org/abs/2507.17049v1,2507.17049v1,本文针对视觉语言动作（VLA）机器人模型的评估问题，提出了八项不确定性指标和五项质量指标，用以衡量机器人任务执行的质量和模型决策的置信度。通过对三种先进模型在四种机器人操作任务中908次成功执行的实证分析，结合人工专家标注，验证了这些指标与任务质量的相关性。研究表明，所提指标不仅能反映执行质量，还能区分不同水平的任务表现，弥补了传统仅依赖成功率的评价方法不足，为机器人系统的实时监控和自适应改进提供了新的评价手段。
Controllable Hybrid Captioner for Improved Long-form Video Understanding,可控混合式字幕生成器用于提升长视频理解,22 Jul 2025,Multimodal LLM,Other,http://arxiv.org/pdf/2507.17047v1,http://arxiv.org/abs/2507.17047v1,2507.17047v1,本论文提出了一种可控混合视频描述生成方法，旨在提升长视频内容的理解与问答能力。通过将视频划分为合理片段，结合动态动作描述与静态场景信息，构建更丰富的文本记忆库。该方法利用视觉语言模型增强场景描述，并对视频描述模型进行联合微调，实现动作与场景描述的高效切换。实验表明，该方法显著提升了视频内容摘要的完整性和多样性，扩展了基于文本的复杂视频问答能力。
