标题,中文标题,发布日期,领域分类,研究机构,PDF链接,论文链接,arXiv ID,简明摘要
Collaborative Device-Cloud LLM Inference through Reinforcement Learning,通过强化学习实现协同设备-云端大语言模型推理,28 Sep 2025,LLM,Other,http://arxiv.org/pdf/2509.24050v1,http://arxiv.org/abs/2509.24050v1,2509.24050v1,无法生成摘要。
Optimism as Risk-Seeking in Multi-Agent Reinforcement Learning,多智能体强化学习中的乐观主义作为风险寻求,28 Sep 2025,Agent,Other,http://arxiv.org/pdf/2509.24047v1,http://arxiv.org/abs/2509.24047v1,2509.24047v1,无法生成摘要。
PartnerMAS: An LLM Hierarchical Multi-Agent Framework for Business Partner Selection on High-Dimensional Features,PartnerMAS：一种基于大语言模型的层级多智能体框架用于高维特征下的商业合作伙伴选择,28 Sep 2025,Agent,Other,http://arxiv.org/pdf/2509.24046v1,http://arxiv.org/abs/2509.24046v1,2509.24046v1,本文提出了PartnerMAS，一种基于大型语言模型的层级多智能体框架，用于处理包含多种特征的复杂商业伙伴选择问题。该框架通过规划者、专业评估者和监督者三层协作，有效分解任务并整合结果。作者还构建了一个涵盖多样企业属性的风险投资联合投资基准数据集。实验表明，PartnerMAS在匹配准确率上显著优于单一智能体和传统多智能体方法，提升幅度达10-15%。研究表明，结构化的多智能体协作能更好地应对高维决策任务，具有广泛应用潜力。
GPS-MTM: Capturing Pattern of Normalcy in GPS-Trajectories with self-supervised learning,GPS-MTM：利用自监督学习捕捉GPS轨迹中的正常模式,28 Sep 2025,Agent,Other,http://arxiv.org/pdf/2509.24031v1,http://arxiv.org/abs/2509.24031v1,2509.24031v1,本文提出了GPS-MTM，一种基于自监督学习的轨迹建模基础模型，专注捕捉人类移动中的正常模式。与传统方法不同，GPS-MTM将轨迹分解为地点类别和行为两种信息，通过双向Transformer自动恢复缺失轨迹片段，学习丰富的语义关联。该模型在多个数据集上的轨迹补全和下一站预测任务中表现优异，尤其在需要上下文理解的动态任务中优势明显。研究展示了GPS-MTM在大规模轨迹分析中的潜力，推动了移动数据在表示学习领域的发展。
The Role of Logic and Automata in Understanding Transformers,[翻译]The Role of Logic and Automata in Understanding Transformers,28 Sep 2025,Other,Other,http://arxiv.org/pdf/2509.24024v1,http://arxiv.org/abs/2509.24024v1,2509.24024v1,本文回顾了近年来关于变换器模型能力的研究进展，强调逻辑和自动机理论在理解变换器功能中的关键作用。作者指出，尽管变换器推动了大型语言模型的发展，但我们对其本质能力的认识仍有限。论文还探讨了逻辑、自动机、模型验证与变换器交叉领域中的若干未解问题，为未来深入研究提供了方向。整体上，本文为揭示变换器的理论基础和潜力提供了重要视角。
FrameMind: Frame-Interleaved Chain-of-Thought for Video Reasoning via Reinforcement Learning,FrameMind：通过强化学习实现的视频推理帧交错链式思维方法,28 Sep 2025,Agent,Other,http://arxiv.org/pdf/2509.24008v1,http://arxiv.org/abs/2509.24008v1,2509.24008v1,无法生成摘要。
SLA: Beyond Sparsity in Diffusion Transformers via Fine-Tunable Sparse-Linear Attention,[翻译]SLA: Beyond Sparsity in Diffusion Transformers via Fine-Tunable Sparse-Linear Attention,28 Sep 2025,Other,Other,http://arxiv.org/pdf/2509.24006v1,http://arxiv.org/abs/2509.24006v1,2509.24006v1,本文针对视频生成中的扩散变换器模型，提出了一种名为SLA的可微调稀疏-线性注意力机制。该方法将注意力权重分为关键、边缘和可忽略三类，分别采用不同计算策略，有效降低了计算复杂度。通过少量微调，SLA实现了高达20倍的注意力计算减少，显著加速模型推理且保持生成质量。实验表明，SLA在保持生成效果的同时，将注意力计算降低95%，并在实际GPU上实现了约14倍的加速，显著提升了视频生成效率。
MCPMark: A Benchmark for Stress-Testing Realistic and Comprehensive MCP Use,MCPMark：用于压力测试真实且全面MCP使用的基准,28 Sep 2025,Agent,Other,http://arxiv.org/pdf/2509.24002v1,http://arxiv.org/abs/2509.24002v1,2509.24002v1,本文提出了MCPMark，一种针对多功能交互标准（MCP）使用的综合性测试基准，旨在弥补现有测试任务范围狭窄、交互深度有限的问题。MCPMark包含127个由领域专家与AI共同设计的高质量任务，涵盖更丰富多样的操作类型，能够更真实地模拟复杂工作流程。通过对多款先进语言模型的评估，结果显示当前模型在该基准上的表现仍有较大提升空间，验证了MCPMark在压力测试和推动模型能力发展的价值。
Gaze Estimation for Human-Robot Interaction: Analysis Using the NICO Platform,面向人机交互的注视估计：基于NICO平台的分析,28 Sep 2025,Embodied AI,Other,http://arxiv.org/pdf/2509.24001v1,http://arxiv.org/abs/2509.24001v1,2509.24001v1,本文针对人机交互中的视线估计问题，基于NICO机器人平台收集并标注了一个新数据集，评估了四种先进的视线估计模型。结果表明，虽然角度误差与通用基准相当，但在共享工作空间中的实际距离误差中位数为16.48厘米，揭示了当前方法在实际应用中的局限性。论文最后讨论了这些限制，并提出了将视线估计有效整合进人机交互系统的建议，为提升交互精度和实用性提供了重要参考。
TREAT-Net: Tabular-Referenced Echocardiography Analysis for Acute Coronary Syndrome Treatment Prediction,TREAT-Net：基于表格参考的超声心动图分析用于急性冠脉综合征治疗预测,28 Sep 2025,Multimodal LLM,Other,http://arxiv.org/pdf/2509.23999v1,http://arxiv.org/abs/2509.23999v1,2509.23999v1,无法生成摘要。
The AI Agent Code of Conduct: Automated Guardrail Policy-as-Prompt Synthesis,AI智能体行为准则：基于提示的自动化护栏策略合成,28 Sep 2025,Agent,Other,http://arxiv.org/pdf/2509.23994v1,http://arxiv.org/abs/2509.23994v1,2509.23994v1,无法生成摘要。
Advancing Multi-agent Traffic Simulation via R1-Style Reinforcement Fine-Tuning,通过R1风格强化微调推进多智能体交通仿真,28 Sep 2025,Agent,Other,http://arxiv.org/pdf/2509.23993v1,http://arxiv.org/abs/2509.23993v1,2509.23993v1,无法生成摘要。
Guide: Generalized-Prior and Data Encoders for DAG Estimation,[翻译]Guide: Generalized-Prior and Data Encoders for DAG Estimation,28 Sep 2025,Other,Other,http://arxiv.org/pdf/2509.23992v1,http://arxiv.org/abs/2509.23992v1,2509.23992v1,本文提出了GUIDE，一种结合大语言模型生成的邻接矩阵与观测数据的双编码器框架，用于因果图结构的高效估计。相比传统方法，GUIDE在处理超过70个节点的复杂数据时表现出更优的计算效率和准确性，平均运行时间减少约42%，准确率提升约117%。此外，GUIDE通过强化学习动态平衡准确性与因果图约束，实现了对混合数据类型的良好适应性，显著提升了因果发现方法的可扩展性和实用性。
"The Hidden Costs of Translation Accuracy: Distillation, Quantization, and Environmental Impact",翻译准确性的隐性成本：蒸馏、量化与环境影响,28 Sep 2025,LLM,Other,http://arxiv.org/pdf/2509.23990v1,http://arxiv.org/abs/2509.23990v1,2509.23990v1,无法生成摘要。
LLM/Agent-as-Data-Analyst: A Survey,LLM/Agent作为数据分析师：综述,28 Sep 2025,Agent,Other,http://arxiv.org/pdf/2509.23988v1,http://arxiv.org/abs/2509.23988v1,2509.23988v1,本文综述了基于大型语言模型（LLM）和智能代理在数据分析中的应用，强调其在理解复杂数据、自然语言交互和自动化流程管理方面的优势。文章总结了智能数据分析代理的五大设计目标，包括语义感知、多模态融合、自动化管道、工具辅助及开放任务支持，并系统回顾了其在结构化、半结构化、非结构化及异构数据处理中的技术进展。最后，论文探讨了当前面临的挑战，提出了未来研究的方向，为推动该领域的发展提供了有价值的参考。
TusoAI: Agentic Optimization for Scientific Methods,TusoAI：面向科学方法的智能体优化,28 Sep 2025,Agent,Other,http://arxiv.org/pdf/2509.23986v1,http://arxiv.org/abs/2509.23986v1,2509.23986v1,无法生成摘要。
Toward Preference-aligned Large Language Models via Residual-based Model Steering,通过基于残差的模型引导实现偏好对齐的大型语言模型,28 Sep 2025,LLM,Other,http://arxiv.org/pdf/2509.23982v1,http://arxiv.org/abs/2509.23982v1,2509.23982v1,本文提出了一种名为PaLRS的无训练偏好对齐方法，通过利用大语言模型内部的残差信息，从少量偏好样本中提取轻量级调整向量，实现模型行为的快速引导。该方法无需大规模数据和复杂训练，能有效提升模型在数学推理和代码生成等任务上的表现，同时保持通用能力。实验表明，PaLRS在效率和效果上均优于传统偏好优化技术，提供了一种灵活且经济的模型对齐新途径。
Towards Redundancy Reduction in Diffusion Models for Efficient Video Super-Resolution,面向高效视频超分辨率的扩散模型冗余减少方法,28 Sep 2025,Diffusion Model,Other,http://arxiv.org/pdf/2509.23980v1,http://arxiv.org/abs/2509.23980v1,2509.23980v1,本文针对视频超分辨率中扩散模型存在的信息冗余问题，提出了一种高效的一步扩散模型OASIS。该方法通过注意力专门化机制，有效减少冗余操作并保留预训练知识，提升模型适应性和性能。同时，设计了渐进式训练策略以应对复杂降质情况。实验结果表明，OASIS在合成及真实视频数据上均达到领先效果，且推理速度较现有方法提升超过6倍，显著提高了视频超分辨率的效率和实用性。
ByteSized32Refactored: Towards an Extensible Interactive Text Games Corpus for LLM World Modeling and Evaluation,ByteSized32Refactored：面向大语言模型世界建模与评估的可扩展交互式文本游戏语料库,28 Sep 2025,LLM,Other,http://arxiv.org/pdf/2509.23979v1,http://arxiv.org/abs/2509.23979v1,2509.23979v1,本文提出了ByteSized32Refactored，一个对原始ByteSized32文本游戏数据集的重构版本，通过模块化和代码优化显著减少了代码量，并引入了统一的基础库以复用核心逻辑。该设计提升了数据集的可扩展性，便于添加新场景和功能。实验表明，尽管重构后的层次结构对大语言模型带来一定挑战，但在部分评价指标上实现了质量提升。该工作为构建灵活且易扩展的交互式文本游戏环境提供了重要支持，有助于推动大语言模型在复杂环境建模和评估中的应用。
Curriculum-Guided Reinforcement Learning for Synthesizing Gas-Efficient Financial Derivatives Contracts,基于课程引导的强化学习用于合成节能的金融衍生品合约,28 Sep 2025,Agent,Other,http://arxiv.org/pdf/2509.23976v1,http://arxiv.org/abs/2509.23976v1,2509.23976v1,本文提出了一种基于强化学习的方法，用于自动生成既功能正确又节省执行成本的金融衍生品智能合约。通过引入分阶段训练策略，模型先确保合约功能的准确性，再优化其运行成本，实现了高达35.59%的成本降低。该方法有效解决了将复杂金融规范转化为高效智能合约的难题，推动了金融合约自动化的实用应用。
VFSI: Validity First Spatial Intelligence for Constraint-Guided Traffic Diffusion,VFSI：基于有效性优先的空间智能用于约束引导的交通扩散模拟,28 Sep 2025,Diffusion Model,Other,http://arxiv.org/pdf/2509.23971v1,http://arxiv.org/abs/2509.23971v1,2509.23971v1,无法生成摘要。
HiPO: Hybrid Policy Optimization for Dynamic Reasoning in LLMs,HiPO：用于大型语言模型动态推理的混合策略优化,28 Sep 2025,LLM,Other,http://arxiv.org/pdf/2509.23967v1,http://arxiv.org/abs/2509.23967v1,2509.23967v1,本文提出了一种名为HiPO的混合策略优化框架，旨在提高大型语言模型在复杂任务中的推理效率。HiPO通过智能选择何时进行详细推理、何时直接回答，实现了推理过程的自适应控制。该方法结合了双重数据处理和强化学习奖励机制，平衡了准确率与推理成本。实验结果表明，HiPO在数学和编码任务中显著减少了生成文本长度，同时保持或提升了模型的准确性。该框架为资源有限环境下的高效推理提供了一种有效解决方案。
Conditional Advantage Estimation for Reinforcement Learning in Large Reasoning Models,用于大型推理模型强化学习的条件优势估计,28 Sep 2025,LLM,Other,http://arxiv.org/pdf/2509.23962v1,http://arxiv.org/abs/2509.23962v1,2509.23962v1,本文提出了一种名为CANON的条件优势估计方法，用于强化学习中提升大型语言模型的推理能力。与传统依赖预设方向性奖励的手工调整不同，CANON通过分组比较目标指标的趋势，自动识别对性能有利的特征，从而避免偏差和调参困难。实验表明，基于熵的CANON在数学推理和复杂逻辑任务上优于现有方法；基于响应长度的CANON则在提升性能的同时提高了生成效率，实现了更优的性能与成本平衡。该方法为强化学习优化大型语言模型提供了更稳健有效的策略。
MAD-PINN: A Decentralized Physics-Informed Machine Learning Framework for Safe and Optimal Multi-Agent Control,MAD-PINN：一种用于安全与最优多智能体控制的去中心化物理信息机器学习框架,28 Sep 2025,Agent,Other,http://arxiv.org/pdf/2509.23960v1,http://arxiv.org/abs/2509.23960v1,2509.23960v1,本文提出了MAD-PINN，一种用于多智能体系统的去中心化机器学习框架，旨在同时优化系统的安全性和性能。该方法通过结合物理信息神经网络和安全约束的优化重构，实现了对多智能体状态约束最优控制问题的高效求解。通过在简化的子系统上训练并在实际中分布式应用，MAD-PINN具备良好的扩展性，同时引入基于安全可达性的邻居选择和自适应执行策略，提升了系统的安全性与计算效率。实验结果表明，该方法在多智能体导航任务中表现出优越的安全-性能平衡，显著优于现有主流方法。
Reinforcement Learning with Inverse Rewards for World Model Post-training,基于逆向奖励的世界模型后训练强化学习,28 Sep 2025,Agent,Other,http://arxiv.org/pdf/2509.23958v1,http://arxiv.org/abs/2509.23958v1,2509.23958v1,本文提出了一种名为“逆向奖励强化学习”（RLIR）的后训练框架，旨在提升视频世界模型对人类指定动作的准确模拟能力。通过利用逆动力学模型从生成视频中恢复输入动作，RLIR构建了可验证的奖励信号，避免了昂贵的偏好标注和复杂的规则验证。实验表明，该方法在多种模型架构下显著提升了动作执行的准确性和视频质量，并获得更高的人类偏好评分，首次实现了针对视频世界模型动作跟随能力的有效后训练优化。
Vision-Grounded Machine Interpreting: Improving the Translation Process through Visual Cues,Vision-Grounded Machine Interpreting：通过视觉线索提升翻译过程的机器口译,28 Sep 2025,Multimodal LLM,Other,http://arxiv.org/pdf/2509.23957v1,http://arxiv.org/abs/2509.23957v1,2509.23957v1,本文提出了一种结合视觉信息的机器口译新方法——视觉引导口译（VGI），旨在克服传统仅依赖语音信号的系统在歧义消解上的局限。通过融合摄像头捕捉的视觉线索与语音输入，VGI原型系统能够在翻译过程中利用上下文视觉信息。实验结果表明，视觉信息显著提升了词义歧义的判别效果，对性别指代的解析有一定帮助，但对句法歧义无明显改善。研究表明，多模态融合是提升机器口译质量的重要方向。
ColLab: A Collaborative Spatial Progressive Data Engine for Referring Expression Comprehension and Generation,[翻译]ColLab: A Collaborative Spatial Progressive Data Engine for Referring Expression Comprehension and Generation,28 Sep 2025,Other,Other,http://arxiv.org/pdf/2509.23955v1,http://arxiv.org/abs/2509.23955v1,2509.23955v1,本文提出了ColLab，一种无需人工干预的自动化数据生成引擎，用于指代表达理解与生成任务。通过结合多模态大语言模型的协同交互策略和空间渐进增强模块，ColLab有效提升了生成描述的准确性和区分度。实验结果表明，该方法显著加快了数据标注速度并提升了表达质量。此外，ColLab部分应用于ICCV 2025多模态推理挑战的数据生成，丰富了数据集的多样性和复杂性，推动了相关领域的发展。
HunyuanImage 3.0 Technical Report,HunyuanImage 3.0 技术报告,28 Sep 2025,Multimodal LLM,Tencent,http://arxiv.org/pdf/2509.23951v1,http://arxiv.org/abs/2509.23951v1,2509.23951v1,本文介绍了HunyuanImage 3.0，一款集多模态理解与生成于一体的原生模型，采用自回归框架实现图像生成。该模型通过精心的数据准备、先进的架构设计及多阶段训练策略，成功构建了超过800亿参数的混合专家模型，推理时激活130亿参数，成为目前最大且开源的图像生成模型。实验结果表明，其在文本与图像匹配及视觉质量上达到领先水平。论文公开了代码和权重，旨在推动多模态领域的研究与应用发展。
DiBS-MTL: Transformation-Invariant Multitask Learning with Direction Oracles,DiBS-MTL：具有方向预言器的变换不变多任务学习,28 Sep 2025,Other,Other,http://arxiv.org/pdf/2509.23948v1,http://arxiv.org/abs/2509.23948v1,2509.23948v1,本文提出了一种名为DiBS-MTL的多任务学习方法，解决了传统方法中任务损失尺度差异导致某些任务主导训练的问题。基于最新的方向性博弈理论，DiBS-MTL具有对任务损失非线性变换的不变性，保证了训练过程的公平性和稳定性。论文还理论证明了该方法在非凸任务下的收敛性，并通过实验证明其在多个标准多任务学习基准上的竞争性能和鲁棒性，优于现有主流方法。相关代码已公开。
Explore-Execute Chain: Towards an Efficient Structured Reasoning Paradigm,Explore-Execute Chain：迈向高效的结构化推理范式,28 Sep 2025,LLM,Other,http://arxiv.org/pdf/2509.23946v1,http://arxiv.org/abs/2509.23946v1,2509.23946v1,本文提出了Explore-Execute Chain（E²C），一种将推理过程分为探索和执行两个阶段的新型结构化推理框架。该方法通过先生成简洁的高层计划，再确定性地执行计划，有效提升了计算效率和推理路径的多样性，同时增强了结果的可解释性。结合监督微调和强化学习的训练策略，E²C在多个任务中显著减少了推理所需的计算资源，提升了准确率，并展现出良好的跨领域适应能力。实验结果表明，E²C在保持高性能的同时，大幅降低了推理成本，推动了大语言模型高效推理的发展。
Brain-language fusion enables interactive neural readout and in-silico experimentation,Brain-language fusion实现交互式神经读出与计算机模拟实验,28 Sep 2025,Multimodal LLM,Other,http://arxiv.org/pdf/2509.23941v1,http://arxiv.org/abs/2509.23941v1,2509.23941v1,无法生成摘要。
Easy Turn: Integrating Acoustic and Linguistic Modalities for Robust Turn-Taking in Full-Duplex Spoken Dialogue Systems,Easy Turn：融合声学与语言模态的全双工语音对话系统中的鲁棒换话检测,28 Sep 2025,Agent,Other,http://arxiv.org/pdf/2509.23938v1,http://arxiv.org/abs/2509.23938v1,2509.23938v1,本文提出了Easy Turn，一种结合语音和语言信息的开源模块化模型，用于提升全双工语音对话系统中的话轮切换检测能力。为支持模型训练，作者还发布了包含1145小时语音数据的Easy Turn训练集。与现有开源模型相比，Easy Turn在话轮状态识别上表现出更高的准确率，显著增强了系统在自然交流中的响应判断能力。该模型及数据集将公开发布，推动相关研究和应用的发展。
Diffusion Models are Kelly Gamblers,扩散模型即凯利赌徒,28 Sep 2025,Diffusion Model,Other,http://arxiv.org/pdf/2509.23937v1,http://arxiv.org/abs/2509.23937v1,2509.23937v1,本文揭示了扩散模型与凯利准则之间的联系，表明条件扩散模型通过存储额外信息实现信号与条件信息之间的互信息最大化。作者指出，无分类器引导方法在采样时有效提升了这种互信息，特别有助于图像生成任务，因图像与标签间的互信息本身较低，这与流形假设密切相关。此外，论文对扩散模型作为无限深自编码器的常见看法提出了细微修正，并将去噪损失与量子力学中的费米黄金法则进行了关联，深化了对扩散模型原理的理解。
Assessing Large Language Models in Updating Their Forecasts with New Information,评估大语言模型在获取新信息后更新预测的能力,28 Sep 2025,LLM,Other,http://arxiv.org/pdf/2509.23936v1,http://arxiv.org/abs/2509.23936v1,2509.23936v1,本文提出了EVOLVECAST框架，用于评估大型语言模型在获得新信息后是否能合理调整对未来事件的预测。研究发现，尽管模型在一定程度上会根据最新信息更新预测，但这些调整往往不够一致且偏向保守。相比之下，人类预测者在调整信心和预测准确性方面表现更优。结果表明，目前模型在动态更新信念和置信度方面仍存在不足，强调了开发更有效预测更新方法的必要性。
AutoPrune: Each Complexity Deserves a Pruning Policy,AutoPrune：每种复杂度都应有其剪枝策略,28 Sep 2025,Multimodal LLM,Other,http://arxiv.org/pdf/2509.23931v1,http://arxiv.org/abs/2509.23931v1,2509.23931v1,无法生成摘要。
HiViS: Hiding Visual Tokens from the Drafter for Speculative Decoding in Vision-Language Models,HiViS：面向视觉语言模型推测解码的视觉标记隐藏方法,28 Sep 2025,Multimodal LLM,Other,http://arxiv.org/pdf/2509.23928v1,http://arxiv.org/abs/2509.23928v1,2509.23928v1,无法生成摘要。
SAR-KnowLIP: Towards Multimodal Foundation Models for Remote Sensing,SAR-KnowLIP：面向遥感的多模态基础模型,28 Sep 2025,Multimodal LLM,Other,http://arxiv.org/pdf/2509.23927v1,http://arxiv.org/abs/2509.23927v1,2509.23927v1,无法生成摘要。
Taming Masked Diffusion Language Models via Consistency Trajectory Reinforcement Learning with Fewer Decoding Step,[翻译]Taming Masked Diffusion Language Models via Consistency Trajectory Reinforcement Learning with Fewer Decoding Step,28 Sep 2025,Other,Other,http://arxiv.org/pdf/2509.23924v1,http://arxiv.org/abs/2509.23924v1,2509.23924v1,本文针对掩码扩散语言模型（MDLMs）在解码效率和训练一致性方面的挑战，提出了两种解码策略（EOS Early Rejection和Ascending Step-Size）以实现更少步数的全扩散式解码，同时引入了一种新的强化学习方法（Consistency Trajectory Group Relative Policy Optimization），以解决训练与推理过程中的不一致问题。通过在数学推理和规划任务上的实验证明，该方法显著提升了MDLM的性能和效率，为MDLM的实用化提供了有效路径。
DriveE2E: Closed-Loop Benchmark for End-to-End Autonomous Driving through Real-to-Simulation,[翻译]DriveE2E: Closed-Loop Benchmark for End-to-End Autonomous Driving through Real-to-Simulation,28 Sep 2025,Other,Other,http://arxiv.org/pdf/2509.23922v1,http://arxiv.org/abs/2509.23922v1,2509.23922v1,本文提出了DriveE2E，一个结合真实交通场景与仿真环境的闭环评估框架，用于端到端自动驾驶系统的测试。通过从100小时的真实视频中提取800个动态交通场景，并构建15个真实路口的数字孪生模型，DriveE2E在CARLA模拟器中实现了更贴近现实的驾驶环境。该方法考虑了多样的驾驶行为、天气和时间变化，提升了仿真测试的真实性和挑战性，为自动驾驶模型的性能评估提供了更全面和可靠的基准。
From Neural Networks to Logical Theories: The Correspondence between Fibring Modal Logics and Fibring Neural Networks,从神经网络到逻辑理论：纤维模态逻辑与纤维神经网络之间的对应关系,28 Sep 2025,Other,Other,http://arxiv.org/pdf/2509.23912v1,http://arxiv.org/abs/2509.23912v1,2509.23912v1,本文首次建立了模态逻辑纤维化与神经网络纤维化之间的形式对应，填补了两者关系未被明确阐释的空白。通过引入与纤维化神经网络兼容的纤维模型，论文揭示了神经网络组合机制的逻辑基础，并基于此推导出图神经网络、图注意力网络及Transformer编码器的非均匀逻辑表达能力。这一工作为利用逻辑工具解释神经网络所学理论提供了新的理论框架，推动了神经符号方法的发展。
