标题,中文标题,发布日期,领域分类,研究机构,PDF链接,论文链接,arXiv ID,简明摘要
Bandit Max-Min Fair Allocation,Bandit最大最小公平分配,08 May 2025,Agent,Other,http://arxiv.org/pdf/2505.05169v1,http://arxiv.org/abs/2505.05169v1,2505.05169v1,本文提出并研究了一种新的决策问题——带有半带反馈的最大最小公平分配问题，旨在通过多轮分配不可分割物品，最大化各参与者中的最小效用值。该问题的挑战在于效用信息仅能通过部分反馈获得，且奖励函数不具备常见的加性结构。作者设计了一种创新算法，证明其随着时间推移具有较优的性能界限，并给出了理论上的性能下界，二者仅相差对数因子。该研究拓展了带状算法在公平资源分配中的应用，为相关领域提供了新的理论和方法支持。
Online Velocity Profile Generation and Tracking for Sampling-Based Local Planning Algorithms in Autonomous Racing Environments,面向自主赛车环境中基于采样的局部规划算法的在线速度曲线生成与跟踪,08 May 2025,Agent,Other,http://arxiv.org/pdf/2505.05157v1,http://arxiv.org/abs/2505.05157v1,2505.05157v1,本文提出了一种用于自动驾驶赛车的在线速度规划方法，能够动态适应轮胎温度和赛道橡胶积累引起的抓地力变化。该方法结合了前后向速度优化算法和基于三维赛道的空间采样策略，实现了局部轨迹的实时规划。生成的速度曲线为局部规划提供参考，提升了系统对环境和车辆动态变化的适应能力。实验结果表明，该方法在赛车场景中表现出较强的鲁棒性和计算效率，同时也指出了对预设赛车线偏离敏感及速度曲线抖动较大的局限性。
FedTDP: A Privacy-Preserving and Unified Framework for Trajectory Data Preparation via Federated Learning,FedTDP：基于联邦学习的隐私保护与统一轨迹数据预处理框架,08 May 2025,LLM,Other,http://arxiv.org/pdf/2505.05155v1,http://arxiv.org/abs/2505.05155v1,2505.05155v1,本文提出FedTDP，一种基于联邦学习的轨迹数据处理框架，旨在提升轨迹数据质量的同时保护用户隐私。通过设计隐私自编码器保障数据安全，利用知识增强模块提升模型对轨迹任务的理解，并采用并行优化加速训练，FedTDP实现了对多种轨迹数据处理任务的统一支持。实验证明，该方法在多个真实数据集和任务上优于现有主流方案，展现出良好的隐私保护能力和广泛适用性。
Overcoming Dimensional Factorization Limits in Discrete Diffusion Models through Quantum Joint Distribution Learning,通过量子联合分布学习克服离散扩散模型中的维度因式分解限制,08 May 2025,Diffusion Model,Other,http://arxiv.org/pdf/2505.05151v1,http://arxiv.org/abs/2505.05151v1,2505.05151v1,本文提出了一种基于量子技术的离散扩散模型，旨在突破传统模型在高维数据分布学习中的限制。通过引入量子联合概率学习，该方法能够在指数级空间中实现联合分布的有效建模，避免了经典方法因逐维计算带来的性能瓶颈。设计的量子电路利用时间信息和可学习旋转，实现了从纯噪声中一步采样，显著提升了生成效率和准确性。实验结果表明，该量子模型在复杂分布建模上优于传统因式分解方法，开辟了生成模型的新理论方向。
A Benchmark Dataset and a Framework for Urdu Multimodal Named Entity Recognition,乌尔都语多模态命名实体识别的基准数据集与框架,08 May 2025,Multimodal LLM,Other,http://arxiv.org/pdf/2505.05148v1,http://arxiv.org/abs/2505.05148v1,2505.05148v1,本文针对低资源语言乌尔都语的多模态命名实体识别（MNER）研究不足问题，提出了U-MNER框架并发布了首个乌尔都语多模态数据集Twitter2015-Urdu。该数据集基于推特内容，结合乌尔都语语法规则进行标注。论文通过文本和多模态模型的基准测试，展示了该框架在整合文本与图像信息方面的优越性能，为乌尔都语及其他低资源语言的多模态命名实体识别研究提供了重要资源和方法基础。
Understanding In-context Learning of Addition via Activation Subspaces,通过激活子空间理解加法的上下文学习,08 May 2025,LLM,Other,http://arxiv.org/pdf/2505.05145v1,http://arxiv.org/abs/2505.05145v1,2505.05145v1,本文研究了现代语言模型在少样本学习中如何通过前向计算提取和整合信息以形成预测规则。以整数加法任务为例，发现Llama-3-8B模型能够准确完成任务，其少样本学习能力主要集中在三个注意力头上。进一步分析表明，模型在一个六维子空间内编码关键信息，包含数字的个位和整体大小两个部分。此外，模型通过自我纠正机制提升预测准确性。该研究揭示了追踪低维激活子空间有助于理解语言模型内部的细粒度计算过程。
Sparse Training from Random Initialization: Aligning Lottery Ticket Masks using Weight Symmetry,从随机初始化进行稀疏训练：利用权重对称性对齐Lottery Ticket掩码,08 May 2025,Other,Other,http://arxiv.org/pdf/2505.05143v1,http://arxiv.org/abs/2505.05143v1,2505.05143v1,本文针对“彩票票据假说”中稀疏模型难以迁移到不同随机初始化的问题，提出通过调整稀疏掩码以对齐新的优化路径的方法。研究表明，掩码未对齐是导致稀疏模型泛化能力受限的主要原因。通过对掩码进行排列对齐，作者在多个数据集和网络结构上实现了显著的性能提升。该方法有效降低了稀疏训练的计算成本，增强了稀疏模型在不同初始化条件下的适应性，推动了高效神经网络训练的发展。
Research on Anomaly Detection Methods Based on Diffusion Models,基于扩散模型的异常检测方法研究,08 May 2025,Diffusion Model,Other,http://arxiv.org/pdf/2505.05137v1,http://arxiv.org/abs/2505.05137v1,2505.05137v1,本文提出了一种基于扩散模型的新型异常检测方法，通过模拟正常数据的分布并利用逆向扩散过程重建输入，结合重建误差和语义差异来识别异常。方法引入多尺度特征提取、注意力机制和小波域表示，提升了对数据细节和全局关系的捕捉能力。实验结果表明，该方法在图像和音频数据上的表现优于现有技术，展现了其在实际应用中高效且鲁棒的异常检测能力。
Taming OOD Actions for Offline Reinforcement Learning: An Advantage-Based Approach,驯服离线强化学习中的OOD动作：一种基于优势的策略,08 May 2025,Agent,Other,http://arxiv.org/pdf/2505.05126v1,http://arxiv.org/abs/2505.05126v1,2505.05126v1,本文针对离线强化学习中因分布偏移导致的过度估计问题，提出了一种基于优势函数的评估方法——优势扩散演员-评论家（ADAC）。该方法通过利用批量最优价值函数，有效区分并利用有益的超出训练数据分布的动作，避免了以往方法对所有此类动作一刀切的保守处理。作者设计了专门环境验证该策略的有效性，并在多个基准测试中取得了领先成绩，尤其在复杂任务中表现突出，显著提升了离线强化学习的泛化能力和决策质量。
Text2Cypher: Data Pruning using Hard Example Selection,Text2Cypher：基于困难样本选择的数据剪枝,08 May 2025,LLM,Other,http://arxiv.org/pdf/2505.05122v1,http://arxiv.org/abs/2505.05122v1,2505.05122v1,本文针对基于大语言模型的图数据库查询生成任务，提出了五种困难样本选择方法，用于从Text2Cypher数据集中筛选关键样本。该方法有效减少了训练数据规模，显著降低了模型微调的时间和成本，同时保持了查询生成的性能。实验结果表明，困难样本选择是一种降低资源消耗而不牺牲效果的高效策略，为自然语言与数据库交互模型的训练提供了实用的优化路径。
Enhancing Text2Cypher with Schema Filtering,通过模式过滤增强Text2Cypher,08 May 2025,LLM,Other,http://arxiv.org/pdf/2505.05118v1,http://arxiv.org/abs/2505.05118v1,2505.05118v1,本文针对将自然语言问题转换为图数据库查询语句的任务，提出了一种“模式过滤”方法，通过只保留相关的数据库结构信息，减少了无关内容的干扰和计算资源消耗。研究表明，该方法显著提升了查询生成的准确性和效率，尤其对小型模型效果更为明显。尽管大型模型因具备更强的上下文处理能力，对模式过滤的依赖较低，但该方法在降低成本方面依然具有重要价值。该工作为优化自然语言到图查询的转换提供了有效策略。
Is there a half-life for the success rates of AI agents?,AI智能体成功率是否存在半衰期？,08 May 2025,Agent,Other,http://arxiv.org/pdf/2505.05115v1,http://arxiv.org/abs/2505.05115v1,2505.05115v1,本文基于Kwa等人（2025年）的实证研究，提出了一种简单数学模型来解释AI代理在长时间任务中的表现。模型假设在完成任务的每一分钟内，AI都有固定概率失败，导致成功率随任务时长呈指数下降，进而可用“半衰期”来描述各个代理的表现。该规律不仅帮助预测不同任务长度下的成功率，还暗示长任务失败源于众多子任务中任一失败即导致整体失败。该模型的适用范围及其对其他任务类型的推广仍需进一步研究。
MDAA-Diff: CT-Guided Multi-Dose Adaptive Attention Diffusion Model for PET Denoising,MDAA-Diff：基于CT引导的多剂量自适应注意力扩散模型用于PET去噪,08 May 2025,Diffusion Model,Other,http://arxiv.org/pdf/2505.05112v1,http://arxiv.org/abs/2505.05112v1,2505.05112v1,本文提出了一种基于CT引导的多剂量自适应注意力扩散模型（MDAA-Diff），用于低剂量PET图像的去噪处理。该方法结合了CT图像中的解剖结构信息和不同剂量水平的适应性调整，有效提升了低剂量PET图像的质量和细节表现。通过引入高频小波注意力模块和剂量自适应注意力模块，模型能够更精准地恢复图像边缘和结构特征。实验结果表明，MDAA-Diff在多个数据集上优于现有技术，显著提高了低剂量PET图像的诊断价值。
Unveiling Language-Specific Features in Large Language Models via Sparse Autoencoders,通过稀疏自编码器揭示大语言模型中的语言特定特征,08 May 2025,LLM,Other,http://arxiv.org/pdf/2505.05111v1,http://arxiv.org/abs/2505.05111v1,2505.05111v1,本文提出利用稀疏自编码器（SAEs）对大型语言模型的内部激活进行分解，揭示了模型中存在与特定语言高度相关的特征。通过新设计的单语言特征评估指标，作者发现部分特征在仅影响某一语言能力的同时，对其他语言几乎无影响。此外，多个语言相关特征的联合消融显示出更显著的效果。最后，基于这些语言特异性特征，研究实现了对模型生成语言的有效控制，提升了多语言模型的可解释性和可调节性。
Multi-agent Embodied AI: Advances and Future Directions,多智能体具身人工智能：进展与未来方向,08 May 2025,Embodied AI,Other,http://arxiv.org/pdf/2505.05108v1,http://arxiv.org/abs/2505.05108v1,2505.05108v1,本文系统回顾了多智能体具身人工智能的发展现状，强调了具身AI在感知、推理和环境交互中的重要作用。作者指出，当前研究多集中于单智能体和静态环境，难以应对复杂动态场景下多智能体的协作与适应需求。论文分析了该领域的主要进展，剖析了面临的挑战，并提出未来研究方向，旨在推动多智能体具身AI在现实应用中的创新与发展。
MDE-Edit: Masked Dual-Editing for Multi-Object Image Editing via Diffusion Models,MDE-Edit：基于扩散模型的多目标图像编辑的掩码双重编辑方法,08 May 2025,Diffusion Model,Other,http://arxiv.org/pdf/2505.05101v1,http://arxiv.org/abs/2505.05101v1,2505.05101v1,本文提出了一种名为MDE-Edit的新方法，专注于在复杂场景中对多个对象进行精确编辑。针对传统方法在定位不准和属性错配等问题上的不足，MDE-Edit通过优化扩散模型中的潜在特征，结合对象对齐和颜色一致性两种损失，有效提升了编辑的准确性和区域一致性。大量实验表明，该方法在多对象图像编辑任务中优于现有技术，提供了一种高效且稳定的解决方案。
X-Driver: Explainable Autonomous Driving with Vision-Language Models,X-Driver：基于视觉-语言模型的可解释自动驾驶,08 May 2025,Multimodal LLM,Other,http://arxiv.org/pdf/2505.05098v1,http://arxiv.org/abs/2505.05098v1,2505.05098v1,本文提出了X-Driver，一种结合视觉和语言模型的统一框架，用于闭环自动驾驶。该方法通过引入链式思维和自回归建模，提升了感知和决策能力。实验在CARLA仿真环境中的多个公开测试集上验证了X-Driver的有效性，结果显示其在闭环驾驶任务中表现优于现有最先进方法，同时增强了驾驶决策的可解释性。研究表明，结构化推理对端到端自动驾驶系统至关重要，X-Driver为未来闭环自动驾驶研究提供了有力基线。
SSH-Net: A Self-Supervised and Hybrid Network for Noisy Image Watermark Removal,SSH-Net：一种用于噪声图像水印去除的自监督混合网络,08 May 2025,Other,Other,http://arxiv.org/pdf/2505.05088v1,http://arxiv.org/abs/2505.05088v1,2505.05088v1,本文提出了SSH-Net，一种针对带噪声图像水印去除的自监督混合网络。该方法无需依赖成对的带水印和无水印图像，利用水印分布自生成参考图像，实现无需人工标注的训练。SSH-Net采用双网络结构，上层网络专注噪声去除，采用轻量卷积网络，下层网络结合Transformer模块，处理水印和噪声的复杂去除任务。共享的特征编码器提升了两网络的协同效果。实验表明，SSH-Net在实际应用中具备较强的水印去除能力和鲁棒性。
Learning dynamically inspired invariant subspaces for Koopman and transfer operator approximation,基于动力学启发的Koopman与转移算子近似的动态不变子空间学习,08 May 2025,AI4Science,Other,http://arxiv.org/pdf/2505.05085v1,http://arxiv.org/abs/2505.05085v1,2505.05085v1,本文提出了一种基于机器学习的方法，用于高效逼近复杂非线性动力系统中的转移算子和Koopman算子。通过学习动态适应的正交局部基函数，该方法构建了一个近似算子作用的有限维不变子空间，实现了对系统谱特性的准确捕捉。该方法不仅提升了算子估计的效率和精度，还增强了对系统动态行为的理解，展示了其在分析和预测非线性动力系统中的潜力。
Reliably Bounding False Positives: A Zero-Shot Machine-Generated Text Detection Framework via Multiscaled Conformal Prediction,可靠地界定误报率：基于多尺度保形预测的零样本机器生成文本检测框架,08 May 2025,LLM,Other,http://arxiv.org/pdf/2505.05084v1,http://arxiv.org/abs/2505.05084v1,2505.05084v1,本文针对大型语言模型生成文本检测中高误报率的问题，提出了一种基于多尺度置信预测的零样本检测框架（MCP），有效控制误报上限的同时提升检测效果。为支持方法验证，作者构建了涵盖多领域的高质量数据集RealDet，确保模型校准的真实性。实验证明，MCP不仅显著降低误报率，提升检测准确性，还增强了对抗攻击的鲁棒性，展现出在实际应用中平衡安全性与性能的潜力。
ItDPDM: Information-Theoretic Discrete Poisson Diffusion Model,ItDPDM：信息论离散泊松扩散模型,08 May 2025,Diffusion Model,Other,http://arxiv.org/pdf/2505.05082v1,http://arxiv.org/abs/2505.05082v1,2505.05082v1,本文提出了一种名为信息论离散泊松扩散模型（ItDPDM）的新方法，针对离散数据生成中的两大难题：避免将离散数据映射到连续空间和克服近似损失函数的不足。该模型基于泊松扩散过程，直接在离散空间中建模，并引入了新的泊松重构损失，精确对应真实的负对数似然，消除了对近似下界的依赖。实验证明，ItDPDM在音乐符号和图像生成任务上显著提升了性能，测试负对数似然降低最多达80%，且训练收敛更快，展示了其在离散数据生成领域的有效性和优势。
PIDiff: Image Customization for Personalized Identities with Diffusion Models,PIDiff：基于扩散模型的个性化身份图像定制,08 May 2025,Diffusion Model,Other,http://arxiv.org/pdf/2505.05081v1,http://arxiv.org/abs/2505.05081v1,2505.05081v1,本文提出了一种名为PIDiff的个性化身份图像生成方法，旨在通过文本提示和身份图像准确融合特定身份特征。针对现有方法难以有效区分身份与背景信息、导致身份特征丢失和图像多样性下降的问题，PIDiff结合了StyleGAN的W+空间和定制化微调策略，实现了身份特征的精准提取与定位。该方法不仅提升了身份信息的保持能力，还支持风格编辑，保持了预训练模型对真实场景图像的生成能力。实验结果表明，PIDiff在个性化图像生成任务中表现出显著优势。
The City that Never Settles: Simulation-based LiDAR Dataset for Long-Term Place Recognition Under Extreme Structural Changes,永不安定之城：基于仿真的LiDAR数据集用于极端结构变化下的长期地点识别,08 May 2025,Other,Other,http://arxiv.org/pdf/2505.05076v1,http://arxiv.org/abs/2505.05076v1,2505.05076v1,本文提出了“永不安定之城”（CNS）数据集，利用模拟环境生成涵盖大规模建筑施工与拆除的长期场所识别场景，弥补了现有数据集中户外结构变化不足的问题。作者还引入了一种改进的结构变化度量方法，实现了更一致的变化评估。实验表明，CNS数据集包含的环境变化远超现有真实数据集，且当前先进的激光雷达识别算法在该数据集上的表现显著下降，凸显了开发更鲁棒算法的必要性。该数据集为研究应对极端环境变化的长期场所识别提供了重要资源。
Visual Affordances: Enabling Robots to Understand Object Functionality,视觉可供性：赋能机器人理解物体功能,08 May 2025,Embodied AI,Other,http://arxiv.org/pdf/2505.05074v1,http://arxiv.org/abs/2505.05074v1,2505.05074v1,本文针对机器人辅助技术中视觉感知对象功能（可供性）预测存在的定义不统一和可复现性差的问题，提出了一个统一的预测框架。作者系统回顾了相关方法与数据集，分析了影响可复现性的因素，并引入“可供性表”以增强研究透明度。此外，论文提出将视觉信息与物理属性（如物体重量）结合，提升机器人对对象功能的理解和操作能力。该工作为实现机器人从感知到执行的完整闭环提供了理论基础和实践指导。
FG-CLIP: Fine-Grained Visual and Textual Alignment,FG-CLIP：细粒度视觉与文本对齐,08 May 2025,Multimodal LLM,Other,http://arxiv.org/pdf/2505.05071v1,http://arxiv.org/abs/2505.05071v1,2505.05071v1,本文提出了FG-CLIP，一种针对细粒度视觉和文本对齐的改进模型。通过构建包含16亿长文本描述的大规模数据集、配备详细区域标注的高质量图像集，以及引入千万级难负样本，FG-CLIP显著提升了模型对细节的理解能力。实验结果显示，该方法在细粒度识别、开放词汇目标检测和图文检索等多项任务中优于原始CLIP及其他先进模型，证明了其在细粒度多模态理解上的有效性和广泛应用潜力。相关资源已公开。
Performance Evaluation of Large Language Models in Bangla Consumer Health Query Summarization,大型语言模型在孟加拉语消费者健康查询摘要中的性能评估,08 May 2025,LLM,Other,http://arxiv.org/pdf/2505.05070v1,http://arxiv.org/abs/2505.05070v1,2505.05070v1,本文评估了九种先进大语言模型在无额外训练条件下对孟加拉语消费者健康查询进行摘要的表现。通过使用包含2350条标注数据的BanglaCHQ-Summ数据集，研究比较了这些模型与经过微调的Bangla T5模型的效果。结果显示，部分大语言模型在摘要质量上可与微调模型媲美，尤其在简洁表达和关键信息提取方面表现优异。该研究表明，大语言模型在处理低资源语言的医疗信息摘要任务中具备显著潜力，为相关领域提供了有效且可扩展的解决方案。
WaterDrum: Watermarking for Data-centric Unlearning Metric,WaterDrum：面向数据中心遗忘度量的大语言模型水印技术,08 May 2025,LLM,Other,http://arxiv.org/pdf/2505.05064v1,http://arxiv.org/abs/2505.05064v1,2505.05064v1,本文提出了WaterDrum，一种针对大型语言模型数据驱动的遗忘效果评估方法，利用稳健的文本水印技术解决现有基于模型性能的评估指标在处理语义相似数据、无法完全重训练及指标被操控等场景下的不足。作者还发布了包含不同相似度数据的新基准数据集，支持更严格地测试遗忘算法的有效性。该方法和数据集为实现和评估语言模型中的数据删除提供了实用且可靠的工具。相关代码和数据集已公开。
CodeMixBench: Evaluating Large Language Models on Code Generation with Code-Mixed Prompts,CodeMixBench：基于代码混合提示评估大型语言模型的代码生成能力,08 May 2025,LLM,Other,http://arxiv.org/pdf/2505.05063v1,http://arxiv.org/abs/2505.05063v1,2505.05063v1,本文提出了CodeMixBench，一个针对代码生成任务中混合语言提示的评测基准，填补了现有仅支持英文提示评测的空白。通过在三种语言对（印地语-英语、西班牙语-英语、汉语拼音-英语）中引入控制程度的语言混合，系统评估了多款开源大语言模型的表现。结果显示，混合语言提示显著降低了模型的代码生成准确率，尤其对参数较小的模型影响更大。该基准为多语言环境下的代码生成研究提供了现实且有效的测试平台，推动了构建更具鲁棒性的跨语言代码生成模型的发展。
Enhancing Reinforcement Learning for the Floorplanning of Analog ICs with Beam Search,结合束搜索提升模拟集成电路布局强化学习的方法,08 May 2025,Agent,Other,http://arxiv.org/pdf/2505.05059v1,http://arxiv.org/abs/2505.05059v1,2505.05059v1,本文提出了一种结合强化学习与束搜索策略的混合方法，用于模拟电路芯片布局设计。该方法通过束搜索提升了强化学习模型的推理能力，使其能够灵活调整布局目标权重，有效解决拥堵问题，无需重新训练模型。实验结果表明，该方法在芯片面积、空白区域和连线长度等关键指标上较传统强化学习方法提升显著，且性能接近当前先进技术，展示了良好的泛化能力和效率。此研究为自动化模拟电路布局设计提供了更高效且适应性强的解决方案。
Neural Pathways to Program Success: Hopfield Networks for PERT Analysis,通向项目成功的神经路径：基于Hopfield网络的PERT分析,08 May 2025,Agent,Other,http://arxiv.org/pdf/2505.05047v1,http://arxiv.org/abs/2505.05047v1,2505.05047v1,本文提出了一种基于Hopfield神经网络的新方法，用于解决项目任务调度中的不确定性问题。通过将任务开始时间和优先关系转化为神经网络中的能量最小化问题，该方法利用网络的优化特性生成全局一致的调度方案。论文还探讨了关键理论问题并扩展了模型以适应复杂任务依赖关系。数值实验表明，该方法在包含多达1000个任务的项目中表现出良好效果，能够实现接近最优的项目完成时间，且违约情况较少。研究表明，神经网络优化为复杂项目调度提供了一种高效且可扩展的新途径。
A Reputation System for Large Language Model-based Multi-agent Systems to Avoid the Tragedy of the Commons,基于大语言模型的多智能体系统声誉体系以避免公地悲剧,08 May 2025,Agent,Other,http://arxiv.org/pdf/2505.05029v1,http://arxiv.org/abs/2505.05029v1,2505.05029v1,本文针对生成型多智能体系统中因个体自利导致的“公地悲剧”问题，提出了一种名为RepuNet的声誉系统框架。该框架通过动态评估个体及其网络关系，基于直接互动和间接信息，帮助智能体调整合作伙伴选择，从而有效促进合作行为。实验结果表明，RepuNet不仅缓解了资源过度利用问题，还促成了合作群体的形成和不良行为者的社会隔离，展现了声誉机制在多智能体协作中的重要作用和潜力。
G-FOCUS: Towards a Robust Method for Assessing UI Design Persuasiveness,G-FOCUS：一种用于评估用户界面设计说服力的鲁棒方法,08 May 2025,Multimodal LLM,Other,http://arxiv.org/pdf/2505.05026v1,http://arxiv.org/abs/2505.05026v1,2505.05026v1,本文提出了G-FOCUS，一种基于视觉语言模型的新方法，用于评估用户界面设计的说服力，旨在补充传统耗时的A/B测试。作者构建了WiserUI-Bench数据集，包含300对真实界面设计及其用户偏好标签，支持成对比较分析。G-FOCUS通过改进推理策略，减少位置偏差，提高了评估的准确性和一致性。实验结果表明，该方法在界面设计优劣判断上优于现有技术，有助于实现更高效、可扩展的用户界面优化。代码和数据将公开发布，推动相关研究发展。
