标题,中文标题,发布日期,领域分类,研究机构,PDF链接,论文链接,arXiv ID,简明摘要
CODA: Coordinating the Cerebrum and Cerebellum for a Dual-Brain Computer Use Agent with Decoupled Reinforcement Learning,CODA：通过解耦强化学习协调大脑皮层与小脑的双脑计算机使用智能体,27 Aug 2025,Agent,Other,http://arxiv.org/pdf/2508.20096v1,http://arxiv.org/abs/2508.20096v1,2508.20096v1,本文提出了CODA，一种结合通用规划器（大脑）和专用执行器（小脑）的双脑协同框架，专为科学计算等需要长远规划与精准执行的图形界面自动化任务设计。通过两阶段训练策略，先针对各应用训练专家规划器，再整合成功经验进行统一优化，CODA有效提升了执行能力和跨领域泛化性能。实验证明，CODA在多个科学应用测试中优于现有开源方法，展现出更强的适应性和表现。
Discrete-Guided Diffusion for Scalable and Safe Multi-Robot Motion Planning,Discrete-Guided Diffusion用于可扩展且安全的多机器人运动规划,27 Aug 2025,Diffusion Model,Other,http://arxiv.org/pdf/2508.20095v1,http://arxiv.org/abs/2508.20095v1,2508.20095v1,本文提出了一种名为Discrete-Guided Diffusion（DGD）的多机器人运动规划新框架，有效结合了离散路径搜索与连续优化方法的优势。该方法通过将复杂的规划问题分解为易处理的子问题，利用离散路径结果引导生成模型，同时引入约束修复机制，确保轨迹的可行性。DGD在处理多达100台机器人时表现出高效性和成功率，显著提升了大规模复杂环境下的规划质量和扩展能力，推动了多机器人协同运动规划的发展。
AudioStory: Generating Long-Form Narrative Audio with Large Language Models,AudioStory：利用大语言模型生成长篇叙事音频,27 Aug 2025,Multimodal LLM,Tencent,http://arxiv.org/pdf/2508.20088v1,http://arxiv.org/abs/2508.20088v1,2508.20088v1,本文提出了AudioStory，一种结合大型语言模型与文本到音频生成技术的统一框架，专注于生成结构化的长篇叙事音频。通过将复杂叙事任务分解为有序子任务，AudioStory实现了场景连贯和情感一致性。其创新点包括解耦的桥接机制，促进事件内语义对齐与跨事件连贯，以及端到端训练，提升了各组件协同效果。实验结果表明，AudioStory在多领域长篇音频生成中表现优于现有方法，展现出更强的指令理解和音频质量。论文还发布了包含多样场景的AudioStory-10K基准数据集。
HERMES: Human-to-Robot Embodied Learning from Multi-Source Motion Data for Mobile Dexterous Manipulation,HERMES：基于多源人体运动数据的人机具身学习用于移动灵巧操作,27 Aug 2025,Embodied AI,Other,http://arxiv.org/pdf/2508.20085v1,http://arxiv.org/abs/2508.20085v1,2508.20085v1,本文提出了HERMES，一种基于多源人类手部动作数据的人机学习框架，旨在赋予移动双手机器人灵活的操作能力。该方法通过统一的强化学习策略，将多样化的人类动作转化为机器人可执行的行为，并结合基于深度图像的端到端仿真到现实迁移技术，提高了机器人在真实环境中的适应性。此外，HERMES融合了闭环定位机制，实现了精准的视觉目标对齐，促进了自主导航与灵巧操作的结合。实验证明，HERMES在多样化复杂任务中表现出良好的泛化能力和稳定性。
Disabling Self-Correction in Retrieval-Augmented Generation via Stealthy Retriever Poisoning,通过隐蔽的检索器投毒禁用检索增强生成中的自我纠正,27 Aug 2025,LLM,Other,http://arxiv.org/pdf/2508.20083v1,http://arxiv.org/abs/2508.20083v1,2508.20083v1,本文针对基于检索增强生成（RAG）系统的安全性进行了研究，发现现代大语言模型具备强大的自我纠正能力，能抵御传统的知识库中毒攻击。作者提出了一种新型攻击方法DisarmRAG，通过隐秘地修改检索器，使其返回包含攻击指令的结果，从而绕过模型的自我纠正机制，强制生成攻击者指定的输出。该方法在多种模型和问答任务中表现出高成功率和隐蔽性，揭示了当前防御手段的不足，强调了加强检索器安全防护的必要性。
Seam360GS: Seamless 360° Gaussian Splatting from Real-World Omnidirectional Images,Seam360GS：基于真实全向图像的无缝360°高斯点渲染,27 Aug 2025,Other,Other,http://arxiv.org/pdf/2508.20080v1,http://arxiv.org/abs/2508.20080v1,2508.20080v1,本文提出了一种新颖的校准框架，将双鱼眼相机模型融入三维高斯点渲染流程，有效解决了消费级双鱼眼摄像头因镜头间隙和角度畸变导致的全景图像缺陷。该方法通过联合优化三维高斯参数和校准变量，实现了对真实视觉畸变的模拟与补偿，能够从不完美的全景图像生成无缝衔接的360度视图。实验证明，该技术在真实数据集上显著提升了全景图像的渲染质量，优于现有的360度图像合成方法，具有广泛应用价值。
Discrete Diffusion VLA: Bringing Discrete Diffusion to Action Decoding in Vision-Language-Action Policies,Discrete Diffusion VLA：将离散扩散引入视觉-语言-动作策略中的动作解码,27 Aug 2025,Embodied AI,Other,http://arxiv.org/pdf/2508.20072v1,http://arxiv.org/abs/2508.20072v1,2508.20072v1,本文提出了一种名为Discrete Diffusion VLA的新型视觉语言动作解码器，用于机器人动作生成。该方法通过离散扩散模型对动作进行分块建模，实现了自适应的解码顺序和多轮修正，提升了动作预测的准确性和一致性。相比传统的自回归或连续扩散方法，Discrete Diffusion VLA支持并行解码，减少计算开销，且与预训练视觉语言模型无缝结合。实验结果显示，该方法在多个机器人任务数据集上显著优于现有基线，展示了其在提升视觉语言动作策略性能和扩展性方面的潜力。
11Plus-Bench: Demystifying Multimodal LLM Spatial Reasoning with Cognitive-Inspired Analysis,11Plus-Bench：基于认知启发分析的多模态大语言模型空间推理解析,27 Aug 2025,Multimodal LLM,Other,http://arxiv.org/pdf/2508.20068v1,http://arxiv.org/abs/2508.20068v1,2508.20068v1,本文提出了11Plus-Bench，一套基于真实空间能力测试设计的多模态大语言模型（MLLM）空间推理评估基准。通过对14个先进模型与人类表现的对比实验，研究发现当前模型在空间认知上展现出初步能力，其认知负荷与推理难度相关，类似人类思维模式。但模型在具体题目上的表现较为随机，远不及人类的稳定和可预测性。该工作揭示了现有MLLM空间推理的潜力与不足，为未来模型优化提供了重要参考。
Forewarned is Forearmed: Pre-Synthesizing Jailbreak-like Instructions to Enhance LLM Safety Guardrail to Potential Attacks,未雨绸缪：预合成类越狱指令以增强大语言模型安全防护对潜在攻击的抵御能力,27 Aug 2025,LLM,Other,http://arxiv.org/pdf/2508.20038v1,http://arxiv.org/abs/2508.20038v1,2508.20038v1,本文针对大型语言模型（LLM）在面对新型恶意指令时存在的安全漏洞，提出了一种名为IMAGINE的预合成框架。该方法通过分析指令的嵌入空间分布，生成类似“越狱”攻击的指令样本，弥补训练数据与真实攻击之间的分布差异。IMAGINE通过迭代优化不断丰富安全对齐数据，有效提升模型识别未知攻击的能力。实验证明，基于IMAGINE增强的数据集，多个主流LLM在抵御攻击时表现出显著改进，同时保持了模型的正常功能。
Visio-Verbal Teleimpedance Interface: Enabling Semi-Autonomous Control of Physical Interaction via Eye Tracking and Speech,Visio-Verbal Teleimpedance接口：通过眼动追踪与语音实现物理交互的半自主控制,27 Aug 2025,Embodied AI,Other,http://arxiv.org/pdf/2508.20037v1,http://arxiv.org/abs/2508.20037v1,2508.20037v1,本文提出了一种结合眼动追踪与语音交互的远程机器人控制界面，通过捕捉操作者的视线和语言指令，实现对机器人三维刚度参数的半自主调节。系统利用视觉语言模型理解操作者的意图，生成适应不同物理交互的刚度矩阵。实验在力反馈装置和远程机械臂上验证了该界面的有效性，展示了其在复杂任务中的应用潜力。该方法提升了远程机器人操作的自然性和灵活性，具有广泛的实际应用价值。
Pruning Strategies for Backdoor Defense in LLMs,大语言模型中用于后门防御的剪枝策略,27 Aug 2025,LLM,Other,http://arxiv.org/pdf/2508.20032v1,http://arxiv.org/abs/2508.20032v1,2508.20032v1,本文针对预训练语言模型中难以检测且能在微调后依然存在的后门攻击，提出了六种基于注意力头剪枝的防御策略。这些方法在无需了解攻击触发器或干净模型的情况下，通过逐步移除对模型贡献较小的部分，有效削弱了后门影响。实验结果表明，基于梯度的剪枝对语法类后门防御效果最佳，而强化学习和贝叶斯不确定性剪枝则更适合抵御风格类攻击。该研究为提升语言模型安全性提供了实用且无需先验信息的后门防御手段。
Large Language Models (LLMs) for Electronic Design Automation (EDA),用于电子设计自动化（EDA）的大型语言模型（LLMs）,27 Aug 2025,LLM,Other,http://arxiv.org/pdf/2508.20030v1,http://arxiv.org/abs/2508.20030v1,2508.20030v1,随着集成电路设计日益复杂，硬件开发流程变得繁琐且易出错，亟需更高效的自动化解决方案。本文探讨了将大型语言模型（LLMs）应用于电子设计自动化（EDA）的潜力，展示了其在理解设计文本、辅助设计、测试和优化中的优势。通过三个案例研究，论文系统分析了LLMs的能力与局限，提出未来发展方向和挑战，旨在推动AI技术在硬件设计领域的深度融合，提升EDA效率和智能化水平。
Using item recommendations and LLMs in marketing email titles,在营销邮件标题中使用商品推荐与大语言模型,27 Aug 2025,LLM,Other,http://arxiv.org/pdf/2508.20024v1,http://arxiv.org/abs/2508.20024v1,2508.20024v1,本文研究了电商平台如何利用大型语言模型（LLM）生成个性化营销邮件的标题，以提升用户兴趣和购买意愿。传统邮件标题多采用固定模板，缺乏吸引力，限制了邮件的效果。通过离线模拟和针对数百万用户的在线实验，作者验证了基于LLM生成主题化标题的方法能显著提升用户的互动率。研究展示了将自动化、可靠的标题生成技术应用于大规模营销的可行性和价值，为个性化营销策略提供了新的思路。
GS: Generative Segmentation via Label Diffusion,GS：通过标签扩散实现的生成式分割,27 Aug 2025,Diffusion Model,Other,http://arxiv.org/pdf/2508.20020v1,http://arxiv.org/abs/2508.20020v1,2508.20020v1,本文提出了GS（生成分割）框架，将图像分割任务转化为通过标签扩散直接生成分割掩码的生成过程，结合输入图像和自然语言描述进行条件控制。不同于传统以图像为中心的方法，GS以标签生成为核心，实现端到端训练并提升空间和语义的准确性。在多模态分割基准Panoptic Narrative Grounding上的实验表明，GS显著优于现有判别式和扩散模型方法，刷新了语言驱动图像分割的性能记录，展示了生成式思路在视觉语言理解中的潜力。
Symphony: A Decentralized Multi-Agent Framework for Scalable Collective Intelligence,Symphony：一种去中心化多智能体框架，实现可扩展的集体智能,27 Aug 2025,Agent,Other,http://arxiv.org/pdf/2508.20019v1,http://arxiv.org/abs/2508.20019v1,2508.20019v1,本文提出了Symphony，一种去中心化的多智能体系统，旨在解决现有基于大型语言模型的框架中存在的高成本、通信僵化和适应性差的问题。Symphony通过引入分布式能力记录、动态任务分配机制和基于推理链的加权投票，实现了低开销且具隐私保护、可扩展性和容错性的智能体协作。实验结果表明，Symphony在多个推理任务上显著优于现有方法，且在不同规模模型间表现出较强的鲁棒性，展示了其在集体智能领域的应用潜力。
SWIRL: A Staged Workflow for Interleaved Reinforcement Learning in Mobile GUI Control,SWIRL：一种用于移动GUI控制的交错强化学习分阶段工作流,27 Aug 2025,Agent,Other,http://arxiv.org/pdf/2508.20018v1,http://arxiv.org/abs/2508.20018v1,2508.20018v1,本文提出了SWIRL，一种分阶段的多智能体强化学习方法，通过交替更新单个智能体实现稳定高效的协同训练。该方法在移动图形界面控制任务中，将语言和屏幕信息转化为操作计划并执行，显著提升了任务表现。理论上，SWIRL具备安全性和收敛性保障。实验结果表明，其不仅在图形界面操作上表现优异，还具备解决多智能体数学推理问题的潜力，展示了作为通用多智能体系统开发框架的广泛应用价值。
Decomposing Behavioral Phase Transitions in LLMs: Order Parameters for Emergent Misalignment,分解LLM中的行为相变：涌现错位的序参量,27 Aug 2025,LLM,Other,http://arxiv.org/pdf/2508.20015v1,http://arxiv.org/abs/2508.20015v1,2508.20015v1,本文提出了一种系统方法，用于检测和分析大型语言模型在微调过程中行为的快速变化，特别是当模型在有限的有害数据上微调时，可能出现与人类价值观不一致的行为。研究通过统计方法量化了模型输出的分布变化，并引入易于理解的“顺序参数”来分解行为转变的不同方面，如对齐度和冗长度。结果显示，行为变化的发生时间晚于传统梯度指标的峰值，且该框架能够自动发现并评估多种基于语言的行为指标，涵盖知识、政治和伦理等领域。该研究为理解和监控模型微调中的行为偏差提供了有力工具。
Cross-Platform E-Commerce Product Categorization and Recategorization: A Multimodal Hierarchical Classification Approach,跨平台电子商务产品分类与重新分类：一种多模态层次分类方法,27 Aug 2025,Multimodal LLM,Other,http://arxiv.org/pdf/2508.20013v1,http://arxiv.org/abs/2508.20013v1,2508.20013v1,本文提出了一种多模态层次分类框架，解决跨平台电商产品分类中平台差异和分类体系结构限制的问题。通过融合文本和图像特征，方法在大规模国际时尚电商数据上实现了高精度分类。针对类别浅层或不一致问题，设计了自监督的产品重新分类流程，发现了细粒度子类。研究还揭示了复杂融合策略与模型泛化能力之间的权衡。该框架已成功部署于商业交易智能平台，展现出良好的工业应用潜力和扩展性。
Linear-Time Demonstration Selection for In-Context Learning via Gradient Estimation,基于梯度估计的线性时间上下文学习示例选择,27 Aug 2025,LLM,Other,http://arxiv.org/pdf/2508.19999v1,http://arxiv.org/abs/2508.19999v1,2508.19999v1,本文提出了一种基于梯度估计的高效示例选择算法，用于提升上下文学习中的示范样本挑选。该方法通过一阶梯度近似快速评估多个样本子集的影响力，进而线性时间内选出最相关的示范样本。实验表明，该算法在保持极低误差的同时，大幅提升了选择效率，能在数十亿参数模型上实现近38倍的加速，并平均优于传统基于输入嵌入的选择方法11%。该研究为大规模模型的示范样本优化提供了实用且高效的解决方案。
MathBuddy: A Multimodal System for Affective Math Tutoring,MathBuddy：一个多模态情感数学辅导系统,27 Aug 2025,Multimodal LLM,Other,http://arxiv.org/pdf/2508.19993v1,http://arxiv.org/abs/2508.19993v1,2508.19993v1,本文提出了MathBuddy，一种结合情感识别的多模态数学辅导系统。该系统通过分析学生的对话文本和面部表情，实时捕捉其情绪状态，并将情绪信息融入教学策略中，从而实现更具同理心的个性化辅导。实验结果表明，MathBuddy在多项教学指标上显著优于传统模型，验证了情感感知对提升智能辅导效果的重要性。这一工作为教育技术中情感驱动的智能教学提供了有效的解决方案。
AgentCoMa: A Compositional Benchmark Mixing Commonsense and Mathematical Reasoning in Real-World Scenarios,AgentCoMa：一个结合常识推理与数学推理的现实场景组合基准,27 Aug 2025,Agent,Other,http://arxiv.org/pdf/2508.19988v1,http://arxiv.org/abs/2508.19988v1,2508.19988v1,本文提出了AgentCoMa，一个结合常识推理与数学推理的综合性测试平台，旨在评估大型语言模型在真实场景中处理混合推理任务的能力。实验发现，尽管模型能较好地完成单一推理步骤，但在同时处理常识与数学推理时准确率平均下降约30%，表现出明显的脆弱性。相比之下，非专业人类参与者能稳定完成此类任务。研究还通过多种分析方法探讨了性能下降的原因，为未来提升模型在复杂多样推理中的表现提供了重要参考。
Evaluating Language Model Reasoning about Confidential Information,评估语言模型对机密信息的推理能力,27 Aug 2025,Agent,Other,http://arxiv.org/pdf/2508.19980v1,http://arxiv.org/abs/2508.19980v1,2508.19980v1,本文针对语言模型在处理机密信息时的安全性进行了研究，提出了一个名为PasswordEval的评测基准，用以检测模型是否能准确判断用户请求的授权性（如密码正确与否）。研究发现，当前主流模型在这一任务上表现较差，且推理能力并未带来明显提升，反而可能导致机密信息泄露。通过引入对抗性攻击和多轮对话增加难度，结果表明现有模型尚不适合处理敏感信息，提示需要改进训练方法以提升其在高风险环境中的安全性和可靠性。
CapTune: Adapting Non-Speech Captions With Anchored Generative Models,CapTune：基于锚定生成模型的非语音字幕自适应,27 Aug 2025,Other,Other,http://arxiv.org/pdf/2508.19971v1,http://arxiv.org/abs/2508.19971v1,2508.19971v1,本文提出了CapTune系统，旨在满足聋哑及听力障碍观众对非语音视频字幕的个性化需求，同时尊重内容创作者的意图。CapTune允许字幕作者通过具体示例设定安全的修改范围，观众则可在细节程度、表现力、声音呈现方式和风格四个方面调整字幕。通过与字幕创作者和观众的评估，结果显示该系统既维护了创作者的创意控制，又提升了观众的情感体验。此外，研究揭示了信息丰富度与认知负担之间的权衡，以及字幕偏好受上下文影响的特点。
"Assessing the Geolocation Capabilities, Limitations and Societal Risks of Generative Vision-Language Models",生成式视觉-语言模型的地理定位能力、局限性及社会风险评估,27 Aug 2025,Multimodal LLM,Other,http://arxiv.org/pdf/2508.19967v1,http://arxiv.org/abs/2508.19967v1,2508.19967v1,本文系统评估了25种先进视觉-语言模型在图像地理定位任务中的表现，分析了其能力、局限性及潜在社会风险。研究发现，这些模型在普通街景图像上的定位准确率较低，但在类似社交媒体内容的图像上准确率可达61%，显示出较强的定位能力。鉴于模型广泛应用和照片共享的普及，这一能力带来了显著的隐私风险，如跟踪和监控。该工作为理解生成视觉-语言模型的地理定位潜力及其社会影响提供了重要参考。
Dhati+: Fine-tuned Large Language Models for Arabic Subjectivity Evaluation,Dhati+：针对阿拉伯语主观性评估的微调大语言模型,27 Aug 2025,LLM,Other,http://arxiv.org/pdf/2508.19966v1,http://arxiv.org/abs/2508.19966v1,2508.19966v1,本文针对阿拉伯语主观性分析中缺乏大型标注数据的问题，构建了一个综合数据集AraDhati+，整合了多种现有资源。基于该数据集，作者对多款先进的阿拉伯语预训练模型进行了微调，并采用模型集成策略提升分类效果。实验结果表明，该方法在阿拉伯语文本主观性分类任务中达到97.79%的高准确率，显著推动了阿拉伯语情感分析工具的发展，缓解了资源匮乏带来的挑战。
Flocking Behavior: An Innovative Inspiration for the Optimization of Production Plants,群集行为：生产工厂优化的创新灵感,27 Aug 2025,Other,Other,http://arxiv.org/pdf/2508.19963v1,http://arxiv.org/abs/2508.19963v1,2508.19963v1,本文提出将基于群体行为的“boids”算法应用于大型生产工厂的优化问题，特别是半导体制造中的设备切换难题。传统线性优化方法难以在合理时间内解决大规模调度问题，而该算法通过模拟群体中个体的局部互动，能够灵活应对不同类型设备之间的切换需求。研究表明，这种仿生算法不仅提高了调度的适应性和效率，还为复杂生产系统提供了一种自底向上的优化新思路。
Long-VLA: Unleashing Long-Horizon Capability of Vision Language Action Model for Robot Manipulation,Long-VLA：释放视觉语言行动模型在机器人操作中的长时序能力,27 Aug 2025,Embodied AI,Other,http://arxiv.org/pdf/2508.19958v1,http://arxiv.org/abs/2508.19958v1,2508.19958v1,本文提出了Long-VLA，一种专为长时间、多步骤机器人操作设计的视觉语言行动模型。通过一种新颖的阶段感知输入屏蔽策略，模型能够有效区分并处理不同操作阶段的信息，提升子任务间的衔接能力。该方法保持了模型的训练效率和扩展性，且易于集成到现有系统中。作者还设计了L-CALVIN基准测试，系统评估长时间操作表现。实验结果表明，Long-VLA在模拟和真实环境中均显著优于现有方法，为长时序机器人控制树立了新标准。
"Divide, Discover, Deploy: Factorized Skill Learning with Symmetry and Style Priors",划分、发现、部署：基于对称性和风格先验的因式分解技能学习,27 Aug 2025,Agent,Other,http://arxiv.org/pdf/2508.19953v1,http://arxiv.org/abs/2508.19953v1,2508.19953v1,本文提出了一种模块化的无监督技能发现框架，通过将状态空间分解为多个部分，分别应用不同的技能学习策略，从而获得结构化且易于理解的行为。该方法引入了基于对称性的先验知识和风格因子，增强了技能的安全性和多样性。实验中，所学技能在四足机器人仿真与真实硬件上均表现出良好的迁移能力和实用性，且在后续任务中表现接近使用专门奖励训练的策略。该研究为机器人自主学习多样化且安全的技能提供了有效途径。
Constraint Learning in Multi-Agent Dynamic Games from Demonstrations of Local Nash Interactions,基于局部纳什交互示范的多智能体动态博弈中的约束学习,27 Aug 2025,Agent,Other,http://arxiv.org/pdf/2508.19945v1,http://arxiv.org/abs/2508.19945v1,2508.19945v1,本文提出了一种基于逆向动态博弈的方法，通过分析多智能体局部纳什均衡的交互示范，学习系统的参数约束。作者设计了混合整数线性规划模型，利用最优性条件恢复与示范一致的约束，并证明了该方法在安全性判定上的理论保障及其局限性。所学约束进一步用于规划满足安全要求的运动策略。实验结果表明，该方法能够有效推断多种复杂约束，支持非线性动态系统的安全交互规划，具有较强的实用价值和推广潜力。
KRETA: A Benchmark for Korean Reading and Reasoning in Text-Rich VQA Attuned to Diverse Visual Contexts,KRETA：面向多样视觉语境的韩文文本丰富视觉问答阅读与推理基准,27 Aug 2025,Multimodal LLM,Other,http://arxiv.org/pdf/2508.19944v1,http://arxiv.org/abs/2508.19944v1,2508.19944v1,本文提出了KRETA，一个面向韩语的文本丰富视觉问答（VQA）基准，旨在评估模型在多样视觉场景下对图像中文本的理解与推理能力。KRETA涵盖15个领域和26种图像类型，支持多维度性能评测。作者还设计了半自动化的数据生成流程和严格的质量评估标准，确保数据的高质量和实用性。该基准填补了韩语VQA领域的空白，并通过开放代码与数据，促进多语言视觉语言模型的研究与发展。
Socially Interactive Agents for Preserving and Transferring Tacit Knowledge in Organizations,用于组织中隐性知识保存与传递的社会交互智能体,27 Aug 2025,Agent,Other,http://arxiv.org/pdf/2508.19942v1,http://arxiv.org/abs/2508.19942v1,2508.19942v1,本文提出利用具备社会互动能力的智能代理，帮助组织保存和传递难以言表的隐性知识。这些代理通过自然对话和多种交流方式，模拟专家角色，促进员工表达深层经验和见解，从而支持决策和创新。技术手段包括生成相关对话和结构化引导思考，应用于员工培训和专家知识传承。论文强调建立信任、保护隐私和解决偏见等挑战，指出透明性和文化支持是成功关键。该方法为高效、可扩展的知识管理提供了新思路。
