标题,中文标题,发布日期,领域分类,研究机构,PDF链接,论文链接,arXiv ID,简明摘要
Transport Novelty Distance: A Distributional Metric for Evaluating Material Generative Models,[翻译]Transport Novelty Distance: A Distributional Metric for Evaluating Material Generative Models,10 Dec 2025,Other,Other,https://arxiv.org/pdf/2512.09514v1,http://arxiv.org/abs/2512.09514v1,2512.09514v1,本文提出了一种名为Transport Novelty Distance（TNovD）的新型评估指标，用于综合衡量材料生成模型产出结构的质量与新颖性。该指标基于最优传输理论，通过对训练数据和生成数据的特征进行匹配，区分模型的记忆能力与创新能力。特征由图神经网络提取，利用对比学习提升区分度。实验证明，TNovD能有效识别生成材料中的重复和低质量样本，并在多个数据集和模型上展示出良好适用性。该方法不仅适用于材料领域，也具备跨领域推广潜力。
Exploring Community-Powered Conversational Agent for Health Knowledge Acquisition: A Case Study in Colorectal Cancer,[翻译]Exploring Community-Powered Conversational Agent for Health Knowledge Acquisition: A Case Study in Colorectal Cancer,10 Dec 2025,Other,Other,https://arxiv.org/pdf/2512.09511v1,http://arxiv.org/abs/2512.09511v1,2512.09511v1,本文针对年轻人在在线社区获取健康知识时面临的信息碎片化、质量参差和术语难懂等问题，设计并实现了一款名为CanAnswer的对话式智能助手。通过结直肠癌案例研究及用户和专家评估，结果表明CanAnswer显著提升了用户的知识记忆效果并减轻了学习负担。专家反馈进一步验证了其可靠性和实用性。论文还探讨了该工具的通用性，并提出了促进社区驱动健康学习工具有效性和可信度的设计建议，推动了基于社区内容的健康知识获取方式的发展。
ViTA-Seg: Vision Transformer for Amodal Segmentation in Robotics,[翻译]ViTA-Seg: Vision Transformer for Amodal Segmentation in Robotics,10 Dec 2025,Other,Other,https://arxiv.org/pdf/2512.09510v1,http://arxiv.org/abs/2512.09510v1,2512.09510v1,本文提出了ViTA-Seg，一种基于视觉变换器的实时无类别遮挡物体分割框架，旨在解决机器人抓取过程中因遮挡导致的识别难题。该方法通过全局注意力机制恢复物体的完整轮廓，包括被遮挡部分，设计了单头和双头两种架构以分别预测完整和遮挡区域的掩码。同时，作者构建了针对工业场景的高真实感合成数据集ViTA-SimData。实验结果表明，ViTA-Seg在多个公开数据集上实现了高效且准确的遮挡分割，显著提升了机器人操作的鲁棒性和实时性能。
Estimation of Stochastic Optimal Transport Maps,[翻译]Estimation of Stochastic Optimal Transport Maps,10 Dec 2025,Other,Other,https://arxiv.org/pdf/2512.09499v1,http://arxiv.org/abs/2512.09499v1,2512.09499v1,本文提出了一种新的方法，用于估计在现实中常见但传统理论难以处理的随机最优传输映射。通过引入一种新的评价指标，作者设计了计算高效且具有近最优性能保证的估计器，且仅需简单易检验的假设条件。该方法还能抵抗数据中的恶意干扰，具备鲁棒性。实验证明了理论的有效性和实际应用价值。这项工作首次建立了适用于更广泛实际场景的最优传输映射估计理论，拓展了最优传输在统计和机器学习中的应用范围。
Gradient-Guided Learning Network for Infrared Small Target Detection,基于梯度引导学习网络的红外小目标检测,10 Dec 2025,Other,Other,https://arxiv.org/pdf/2512.09497v1,http://arxiv.org/abs/2512.09497v1,2512.09497v1,本文针对红外小目标检测中目标边缘定位不准确和易被背景淹没的问题，提出了一种创新的梯度引导学习网络（GGL-Net）。该方法首次引入梯度幅值图像以突出目标边缘细节，并设计了双分支特征提取网络及两路引导融合模块，实现多尺度特征的有效融合和丰富语义信息的提取。实验结果表明，GGL-Net在公开红外小目标数据集上表现优异，显著提升了检测精度，具有较强的实用价值和推广潜力。
On Mobile Ad Hoc Networks for Coverage of Partially Observable Worlds,关于用于部分可观测世界覆盖的移动自组网,10 Dec 2025,Agent,Other,https://arxiv.org/pdf/2512.09495v1,http://arxiv.org/abs/2512.09495v1,2512.09495v1,本文研究了在未知环境中移动智能体的部署与移动，以建立通信网络。作者将问题转化为一个几何覆盖与视线约束相关的守卫画廊问题，并提出其部分可观测的新变体。针对该问题，设计了两种算法：一种集中式规划方法和一种基于局部信息的分布式协调方案。通过大量模拟实验验证，方法能够有效实现网络的覆盖与连通，且分布式方案在性能和扩展性上表现优异。研究展示了几何方法在通信驱动探索中的潜力，为移动网络部署提供了实用策略。
StateSpace-SSL: Linear-Time Self-supervised Learning for Plant Disease Detectio,StateSpace-SSL：用于植物病害检测的线性时间自监督学习,10 Dec 2025,Other,Other,https://arxiv.org/pdf/2512.09492v1,http://arxiv.org/abs/2512.09492v1,2512.09492v1,本文提出了一种名为StateSpace-SSL的自监督学习方法，专为植物病害检测设计。该方法通过线性时间的状态空间编码器，有效捕捉叶片上病斑的连续变化，克服了传统卷积神经网络和视觉变换器在处理农业图像时的局限。通过多视角对齐策略，模型能够学习稳定且聚焦病斑的特征。实验证明，StateSpace-SSL在多个公开植物病害数据集上优于现有方法，展示了其在无标签数据利用和病害识别上的显著优势。
RouteRAG: Efficient Retrieval-Augmented Generation from Text and Graph via Reinforcement Learning,RouteRAG：通过强化学习实现文本与图谱的高效检索增强生成,10 Dec 2025,LLM,Other,https://arxiv.org/pdf/2512.09487v1,http://arxiv.org/abs/2512.09487v1,2512.09487v1,无法生成摘要。
Advancing LLM-Based Security Automation with Customized Group Relative Policy Optimization for Zero-Touch Networks,基于大语言模型的安全自动化推进：面向零接触网络的定制化组相对策略优化,10 Dec 2025,LLM,Other,https://arxiv.org/pdf/2512.09485v1,http://arxiv.org/abs/2512.09485v1,2512.09485v1,无法生成摘要。
Source Coverage and Citation Bias in LLM-based vs. Traditional Search Engines,基于LLM的搜索引擎与传统搜索引擎中的来源覆盖与引用偏差,10 Dec 2025,LLM,Other,https://arxiv.org/pdf/2512.09483v1,http://arxiv.org/abs/2512.09483v1,2512.09483v1,"本文通过对近56,000条查询结果的实证分析，比较了基于大语言模型的搜索引擎（LLM-SEs）与传统搜索引擎（TSEs）在信息来源覆盖和引用偏差方面的表现。研究发现，LLM-SEs引用的资源域名更为多样，约37%域名仅出现在LLM-SEs中，但在可信度、政治中立性和安全性方面并未优于传统搜索引擎。此外，论文还探讨了影响LLM-SEs选取信息来源的关键因素，为用户、网站运营者和开发者提供了有价值的参考和改进方向。"
Color encoding in Latent Space of Stable Diffusion Models,[翻译]Color encoding in Latent Space of Stable Diffusion Models,10 Dec 2025,Other,Other,https://arxiv.org/pdf/2512.09477v1,http://arxiv.org/abs/2512.09477v1,2512.09477v1,本文系统分析了Stable Diffusion生成模型中颜色信息的内部表示方式。通过合成数据集和统计方法，研究发现颜色主要沿特定的对立轴编码于模型的部分潜在通道中，而亮度和形状则分布在其他通道。结果表明，该模型的潜在空间结构具有较好的可解释性，反映出有效的信息编码机制。这一发现不仅深化了对生成模型内部机制的理解，也为未来模型的可控编辑和更具解耦性的设计提供了理论基础。
An Efficient Interaction Human-AI Synergy System Bridging Visual Awareness and Large Language Model for Intensive Care Units,一种高效的人机协同系统：连接视觉感知与大语言模型的重症监护病房应用,10 Dec 2025,LLM,Other,https://arxiv.org/pdf/2512.09473v1,http://arxiv.org/abs/2512.09473v1,2512.09473v1,本文提出了一种面向重症监护病房的高效人机协同系统，结合视觉感知技术和大型语言模型，实现对床旁监测数据的实时无创采集与语义交互。该系统通过云-边-端架构，减少了人工数据录入错误，提升了医生通过语音查询分散患者信息的便捷性，有效减轻医护人员认知负担。该方案在提高数据管理效率和保障患者安全方面展现出良好应用前景，推动智能医疗系统的发展。
WarmServe: Enabling One-for-Many GPU Prewarming for Multi-LLM Serving,WarmServe：实现多模型共享GPU的预热机制以支持多大语言模型服务,10 Dec 2025,LLM,Other,https://arxiv.org/pdf/2512.09472v1,http://arxiv.org/abs/2512.09472v1,2512.09472v1,无法生成摘要。
Temporal-Spatial Tubelet Embedding for Cloud-Robust MSI Reconstruction using MSI-SAR Fusion: A Multi-Head Self-Attention Video Vision Transformer Approach,[翻译]Temporal-Spatial Tubelet Embedding for Cloud-Robust MSI Reconstruction using MSI-SAR Fusion: A Multi-Head Self-Attention Video Vision Transformer Approach,10 Dec 2025,Other,Other,https://arxiv.org/pdf/2512.09471v1,http://arxiv.org/abs/2512.09471v1,2512.09471v1,本文针对云层遮挡导致多光谱影像（MSI）信息缺失的问题，提出了一种基于视频视觉变换器的新方法，通过局部时间空间特征融合提升MSI重建效果。该方法利用3D卷积提取短时段连续影像块，保持时间一致性，减少信息损失。实验结果表明，在仅使用MSI和融合合成孔径雷达（SAR）数据两种情况下，所提方法均显著优于现有模型，有效提升了云覆盖区域的光谱重建精度，为早期农作物监测提供了更可靠的数据支持。
LiePrune: Lie Group and Quantum Geometric Dual Representation for One-Shot Structured Pruning of Quantum Neural Networks,LiePrune：基于李群与量子几何双重表示的量子神经网络一次性结构化剪枝方法,10 Dec 2025,AI4Science,Other,https://arxiv.org/pdf/2512.09469v1,http://arxiv.org/abs/2512.09469v1,2512.09469v1,无法生成摘要。
Cauchy-Schwarz Fairness Regularizer,[翻译]Cauchy-Schwarz Fairness Regularizer,10 Dec 2025,Other,Other,https://arxiv.org/pdf/2512.09467v1,http://arxiv.org/abs/2512.09467v1,2512.09467v1,本文针对机器学习中实现群体公平性的正则化方法进行了系统分析，提出了一种基于柯西-施瓦茨散度的新型公平正则项。该方法通过减少模型预测与敏感属性之间的依赖，提高了公平性指标如人口统计平等和机会平等，同时保持了模型的准确性。相比现有方法，所提正则项在理论上具有更紧的泛化界限和更强的鲁棒性，且适用于多种敏感属性。实验证明，该方法在多个数据集上表现稳定，显著改善了公平性与效用之间的平衡。
Privacy-Preserving Computer Vision for Industry: Three Case Studies in Human-Centric Manufacturing,面向工业的隐私保护计算机视觉：以人为中心制造的三个案例研究,10 Dec 2025,Other,Other,https://arxiv.org/pdf/2512.09463v1,http://arxiv.org/abs/2512.09463v1,2512.09463v1,本文基于先前提出的隐私保护框架，在真实工业生产环境中进行了首次全面验证。通过三个典型应用场景——木工生产监控、智能导引车导航及人体工学风险评估，研究展示了通过视觉信息转换，有效隐藏敏感数据同时保留关键任务特征。实验结果和工业合作伙伴反馈表明，该方法在保障工人隐私的同时，实现了高效的任务执行，验证了框架的实用性和部署潜力，为工业中以人为本的AI应用提供了实用指导。
Development of a Compliant Gripper for Safe Robot-Assisted Trouser Dressing-Undressing,用于安全机器人辅助穿脱裤子的柔顺型夹持器开发,10 Dec 2025,Embodied AI,Other,https://arxiv.org/pdf/2512.09462v1,http://arxiv.org/abs/2512.09462v1,2512.09462v1,本文针对老年人及偏瘫患者在穿脱裤子时的辅助需求，设计并开发了一种兼具柔顺性和抓握力的机器人夹持器。该夹持器集成于定制机器人系统中，能够安全、精准地辅助用户完成穿脱裤子的动作。通过实验验证，该系统在狭小空间内表现出高成功率，显著提升了辅助穿衣的效果。研究成果为助力老年人和身体障碍者保持生活自理能力、提升生活质量提供了有效的技术支持。
Cytoplasmic Strings Analysis in Human Embryo Time-Lapse Videos using Deep Learning Framework,基于深度学习框架的人类胚胎时间流视频中细胞质丝分析,10 Dec 2025,AI4Science,Other,https://arxiv.org/pdf/2512.09461v1,http://arxiv.org/abs/2512.09461v1,2512.09461v1,无法生成摘要。
Architectures for Building Agentic AI,构建Agentic AI的架构设计,10 Dec 2025,Agent,Other,https://arxiv.org/pdf/2512.09458v1,http://arxiv.org/abs/2512.09458v1,2512.09458v1,无法生成摘要。
Sequential Testing for Descriptor-Agnostic LiDAR Loop Closure in Repetitive Environments,面向重复环境的描述符无关LiDAR闭环检测的序贯检验方法,10 Dec 2025,Other,Other,https://arxiv.org/pdf/2512.09447v1,http://arxiv.org/abs/2512.09447v1,2512.09447v1,本文提出了一种基于多帧序列检测的激光雷达闭环验证方法，将闭环识别问题建模为一种自适应的概率测试过程。该方法通过累积多个时间帧的匹配信息，动态判断是否接受闭环假设，有效抑制了结构重复环境中的误识别。实验结果表明，该方法在多个激光雷达描述子上均提升了闭环检测的准确率，减少了错误闭环的影响，从而提高了定位和地图构建的精度。论文还公开了相关实现和数据集，便于后续研究使用。
Defect-aware Hybrid Prompt Optimization via Progressive Tuning for Zero-Shot Multi-type Anomaly Detection and Segmentation,基于渐进调优的缺陷感知混合提示优化用于零样本多类型异常检测与分割,10 Dec 2025,Multimodal LLM,Other,https://arxiv.org/pdf/2512.09446v1,http://arxiv.org/abs/2512.09446v1,2512.09446v1,本文提出了一种名为DAPO的新方法，通过逐步优化结合固定文本和可学习嵌入的混合提示，实现了对多类型缺陷的零样本异常检测与分割。该方法能够细粒度识别不同异常类型，提升了异常表示的语义丰富度，有助于快速定位异常原因并采取针对性措施。实验结果表明，DAPO在多个公开数据集及内部数据集上，相较于基线模型，在图像级异常检测和异常定位任务中分别实现了显著性能提升，展示了其在实际工业检测中的潜力和有效性。
Advancing Text Classification with Large Language Models and Neural Attention Mechanisms,基于大语言模型与神经注意力机制的文本分类进展,10 Dec 2025,LLM,Other,https://arxiv.org/pdf/2512.09444v1,http://arxiv.org/abs/2512.09444v1,2512.09444v1,本文提出了一种基于大型语言模型和注意力机制的文本分类算法，旨在克服传统方法在捕捉长距离依赖、理解语义上下文及处理类别不平衡方面的不足。通过深度语义表示和注意力增强，该方法有效提取关键特征，并结合多种特征聚合策略提升文本向量表达。实验结果显示，该模型在多个评价指标上优于现有主流方法，尤其在召回率和AUC方面表现突出。进一步的敏感性分析验证了模型的稳定性和适应性，表明其在复杂数据环境中具备良好的实用价值和鲁棒性。
Advancing Research via Human-AI Interactive Theorem Proving,通过人机交互定理证明推动研究进展,10 Dec 2025,AI4Science,Other,https://arxiv.org/pdf/2512.09443v1,http://arxiv.org/abs/2512.09443v1,2512.09443v1,本文提出了一种结合大型语言模型与专家人类协作的交互式定理证明流程，用于科学计算中的数学研究。该方法由专家掌控问题设定和假设，模型辅助寻找证明、提出定理候选及构建满足约束的结构，专家再对结果进行精炼与严密证明。通过量子计算中的流形优化案例，展示了该流程在探索数学性质和算法设计中的有效性。该框架为将人工智能工具融入前沿数学研究提供了实用范式，加速了证明空间的探索，同时保持了严谨的推理过程。
Knowledge-Augmented Large Language Model Agents for Explainable Financial Decision-Making,用于可解释金融决策的知识增强大语言模型智能体,10 Dec 2025,Agent,Other,https://arxiv.org/pdf/2512.09440v1,http://arxiv.org/abs/2512.09440v1,2512.09440v1,无法生成摘要。
CourtPressGER: A German Court Decision to Press Release Summarization Dataset,[翻译]CourtPressGER: A German Court Decision to Press Release Summarization Dataset,10 Dec 2025,Other,Other,https://arxiv.org/pdf/2512.09434v1,http://arxiv.org/abs/2512.09434v1,2512.09434v1,本文介绍了CourtPressGER数据集，包含德国最高法院的裁决文本、对应的人类撰写新闻稿及生成新闻稿的提示，用于训练和评估语言模型从冗长司法文本中提取准确且易读的摘要。研究通过多种评测方法比较了不同规模语言模型的表现，发现大型模型能生成高质量摘要，而小型模型在处理长文本时需分层策略。该工作填补了面向公众的司法信息摘要研究空白，促进了司法沟通的自动化与普及。
"A Hierarchical, Model-Based System for High-Performance Humanoid Soccer",一种分层模型驱动的高性能人形机器人足球系统,10 Dec 2025,Embodied AI,Other,https://arxiv.org/pdf/2512.09431v1,http://arxiv.org/abs/2512.09431v1,2512.09431v1,本文介绍了一款面向成人尺寸人形机器人足球的高性能系统，该系统在2024年RoboCup成人组比赛中获胜。硬件方面，采用轻量化结构、高扭矩驱动器和专门设计的足部，实现强力踢球与稳定行走的平衡。软件方面，结合多源视觉信息实现精准定位与感知，规划安全可行的运动轨迹，并通过统一的行为管理实现智能决策和协调动作。系统整体设计提升了机器人在复杂比赛环境中的速度、准确性和战术表现，展示了人形机器人运动能力的重要进展。
ODMA: On-Demand Memory Allocation Framework for LLM Serving on LPDDR-Class Accelerators,ODMA：面向LPDDR级加速器的大语言模型按需内存分配框架,10 Dec 2025,LLM,Other,https://arxiv.org/pdf/2512.09427v1,http://arxiv.org/abs/2512.09427v1,2512.09427v1,本文提出了ODMA，一种针对低随机访问带宽加速器（如基于LPDDR5的设备）的大型语言模型内存分配框架。ODMA通过结合轻量级长度预测与动态分区策略，解决了内存请求分布不均和波动问题，显著提升了内存利用率和模型服务性能。在实际测试中，ODMA较传统静态分配方法提高了内存利用率约17%，并提升了系统响应速度和吞吐量近30%。该方法有效适配了随机访问受限的硬件特点，为高效部署大型语言模型提供了新思路。
Label-free Motion-Conditioned Diffusion Model for Cardiac Ultrasound Synthesis,无标签运动条件扩散模型用于心脏超声合成,10 Dec 2025,Diffusion Model,Other,https://arxiv.org/pdf/2512.09418v1,http://arxiv.org/abs/2512.09418v1,2512.09418v1,本文提出了一种无需标注的心脏超声视频合成方法——运动条件扩散模型（MCDM），通过自监督学习提取运动特征，实现对超声图像运动和外观的有效分离。该方法在无人工标注的情况下，生成了时间连贯且临床可信的心脏超声视频，解决了数据标注难题。实验证明，MCDM在公开数据集上表现出良好的视频合成能力，展示了自监督技术在心脏超声合成领域的应用潜力。相关代码已公开。
DirectSwap: Mask-Free Cross-Identity Training and Benchmarking for Expression-Consistent Video Head Swapping,DirectSwap：无掩码跨身份训练与基准测试的表情一致性视频换头,10 Dec 2025,Diffusion Model,Other,https://arxiv.org/pdf/2512.09417v1,http://arxiv.org/abs/2512.09417v1,2512.09417v1,本文提出了DirectSwap，一种无需掩膜的跨身份视频换头方法，通过合成同步表情和姿态的新头部，构建了首个带真实配对数据的换头基准数据集HeadSwapBench。该方法结合视频扩散模型和运动模块，利用新设计的损失函数提升了换头视频中身份一致性及表情动态的连贯性。实验结果显示，DirectSwap在视觉效果、身份保真度及动作表情一致性方面均优于现有方法，推动了视频换头技术的发展。相关代码和数据集将公开以支持后续研究。
D$^2$GSLAM: 4D Dynamic Gaussian Splatting SLAM,D$^2$GSLAM：4D动态高斯点云SLAM,10 Dec 2025,Other,Other,https://arxiv.org/pdf/2512.09411v1,http://arxiv.org/abs/2512.09411v1,2512.09411v1,本文提出了D²GSLAM，一种针对动态环境的密集SLAM系统，能够同时实现动态物体的精确重建与稳健跟踪。该系统通过几何引导的方法区分动态与静态区域，采用静态三维与动态四维高斯混合表示，实现动态场景的高效建图与优化。结合多视角几何一致性和动态运动信息，D²GSLAM提升了相机位姿估计的精度，并通过运动一致性损失增强动态建模的连续性。实验表明，该方法在动态场景下具有优越的映射和跟踪性能，推动了动态环境中SLAM技术的发展。
Generalizable Collaborative Search-and-Capture in Cluttered Environments via Path-Guided MAPPO and Directional Frontier Allocation,通过路径引导的MAPPO与方向性前沿分配实现杂乱环境中可泛化的协作搜索与捕获,10 Dec 2025,Agent,Other,https://arxiv.org/pdf/2512.09410v1,http://arxiv.org/abs/2512.09410v1,2512.09410v1,本文提出了一种面向复杂环境中多机器人协同搜索与捕获的新方法PGF-MAPPO，通过结合路径规划与反应式控制，有效解决了稀疏奖励和视野受限带来的探索困难。引入基于潜力场的密集奖励设计和方向性边界分配策略，提升了搜索覆盖效率和空间分散性。该方法在保持模型复杂度较低的同时，实现了对更大规模环境的良好泛化能力，显著优于传统规则和现有学习方法，展示了在多机器人追捕任务中的实用价值和推广潜力。
Generative Point Cloud Registration,生成式点云配准,10 Dec 2025,Diffusion Model,Other,https://arxiv.org/pdf/2512.09407v1,http://arxiv.org/abs/2512.09407v1,2512.09407v1,本文提出了一种创新的三维点云配准方法，通过结合先进的二维生成模型与三维匹配任务，提升配准效果。核心在于生成与源点云和目标点云几何对齐且视角一致的图像对，实现几何与颜色特征的融合，增强匹配鲁棒性。为此，设计了Match-ControlNet模型，利用深度信息保证二维与三维几何一致性，并通过联合去噪和提示引导促进视角间纹理一致性。该方法具有通用性，可集成于多种配准技术中，实验证明其在多个数据集上的有效性。
H2R-Grounder: A Paired-Data-Free Paradigm for Translating Human Interaction Videos into Physically Grounded Robot Videos,[翻译]H2R-Grounder: A Paired-Data-Free Paradigm for Translating Human Interaction Videos into Physically Grounded Robot Videos,10 Dec 2025,Other,Other,https://arxiv.org/pdf/2512.09406v1,http://arxiv.org/abs/2512.09406v1,2512.09406v1,本文提出了一种无需配对数据的新方法，将普通人类操作视频转换为具有物理合理性的机器人操作视频。通过对训练机器人视频中的机械臂进行遮挡处理并添加简单的视觉标记，模型学习在场景中重建机械臂；测试时对人类视频进行类似处理，生成与人类动作一致的机器人视频。该方法利用无配对机器人视频进行训练，避免了繁琐的数据收集，且通过微调先进的视频生成模型保证了动作连贯性。实验结果表明，该方法生成的机器人动作更真实、更具物理基础，为从未标注人类视频中扩展机器人学习提供了有效途径。
Black-Box Behavioral Distillation Breaks Safety Alignment in Medical LLMs,[翻译]Black-Box Behavioral Distillation Breaks Safety Alignment in Medical LLMs,10 Dec 2025,Other,Other,https://arxiv.org/pdf/2512.09403v1,http://arxiv.org/abs/2512.09403v1,2512.09403v1,本文针对医疗大型语言模型在安全对齐方面的脆弱性，提出了一种仅通过输出访问的黑盒蒸馏攻击方法。研究通过大量指令查询和响应收集，低成本训练了一个替代模型，该模型在保持正常任务表现的同时，显著增加了对抗性输入下的不安全输出比例，暴露出安全机制易被绕过的风险。论文还设计了动态评估框架和多层防御策略，强调了在实际应用中需加强对模型安全性的监控与防护，提升医疗LLM的安全可靠性。
Towards Resilient Transportation: A Conditional Transformer for Accident-Informed Traffic Forecasting,迈向韧性交通：一种基于事故信息的条件Transformer交通预测模型,10 Dec 2025,Other,Other,https://arxiv.org/pdf/2512.09398v1,http://arxiv.org/abs/2512.09398v1,2512.09398v1,无法生成摘要。
