标题,中文标题,发布日期,领域分类,研究机构,PDF链接,论文链接,arXiv ID,简明摘要
SVAD: From Single Image to 3D Avatar via Synthetic Data Generation with Video Diffusion and Data Augmentation,SVAD：通过视频扩散与数据增强的合成数据生成，实现从单张图像到3D头像,08 May 2025,Diffusion Model,Other,http://arxiv.org/pdf/2505.05475v1,http://arxiv.org/abs/2505.05475v1,2505.05475v1,本文提出了SVAD，一种从单张图像生成高质量可动画3D人像的新方法。通过结合视频扩散模型生成的合成训练数据与身份保持和图像修复技术，SVAD有效提升了3D高斯点云方法在单视角下的表现，克服了传统方法对多视角数据的依赖。实验结果表明，该方法在保持身份一致性和细节表现方面优于现有技术，同时支持实时渲染，为单图像到3D人像的转换提供了新的高效解决方案。
3D Scene Generation: A Survey,3D场景生成：综述,08 May 2025,Embodied AI,Other,http://arxiv.org/pdf/2505.05474v1,http://arxiv.org/abs/2505.05474v1,2505.05474v1,本文系统综述了三维场景生成领域的最新进展，涵盖基于规则的程序生成、神经网络驱动的三维生成、图像和视频生成四大方法。随着深度生成模型和先进三维表示技术的发展，三维场景的真实感、多样性和视角一致性显著提升。文章分析了各方法的技术特点、应用场景及评价标准，指出当前面临的生成能力、表示方法和数据标注等挑战，并展望了更高质量、物理感知和交互性生成的发展方向。该综述为三维场景生成研究提供了全面的框架和未来指引。
DiffusionSfM: Predicting Structure and Motion via Ray Origin and Endpoint Diffusion,DiffusionSfM：通过射线起点和终点扩散预测结构与运动,08 May 2025,Diffusion Model,Other,http://arxiv.org/pdf/2505.05473v1,http://arxiv.org/abs/2505.05473v1,2505.05473v1,本文提出了一种名为DiffusionSfM的新方法，直接从多视角图像中推断三维场景结构和相机位置，突破了传统结构光束法需分阶段处理的限制。该方法将场景和相机参数表示为像素级射线的起点和终点，利用基于变换器的扩散模型进行预测。针对训练中数据缺失和场景坐标无界的问题，设计了专门机制以增强模型鲁棒性。实验结果表明，DiffusionSfM在合成和真实数据集上均优于传统及现有学习方法，且能够自然地表达不确定性，展示了其在三维重建领域的潜力和优势。
Mogao: An Omni Foundation Model for Interleaved Multi-Modal Generation,Mogao：一种用于交错多模态生成的全能基础模型,08 May 2025,Multimodal LLM,Other,http://arxiv.org/pdf/2505.05472v1,http://arxiv.org/abs/2505.05472v1,2505.05472v1,本文提出了Mogao，一种统一的多模态生成模型，能够实现文本与图像的交错生成。通过引入深度融合结构、双视觉编码器和多模态引导策略，Mogao结合了文本自回归生成与图像扩散合成的优势。该模型采用高效训练方法，在大规模数据集上表现出色，不仅在多模态理解和文本生成图像任务中达到领先水平，还能生成高质量且连贯的交错内容。Mogao展示了零样本图像编辑和组合生成的潜力，推动了统一多模态系统的发展。
Flow-GRPO: Training Flow Matching Models via Online RL,Flow-GRPO：通过在线强化学习训练流匹配模型,08 May 2025,Diffusion Model,Other,http://arxiv.org/pdf/2505.05470v1,http://arxiv.org/abs/2505.05470v1,2505.05470v1,本文提出了Flow-GRPO，一种首次将在线强化学习应用于流匹配模型的方法。通过将确定性微分方程转换为随机微分方程，实现了基于统计采样的强化学习探索，同时引入去噪简化策略提升采样效率而不影响性能。实验证明，Flow-GRPO在文本生成图像任务中显著提升了复杂场景的准确性和文本渲染质量，且在提升人类偏好度的同时保持了图像质量和多样性，展示了其在生成模型优化中的有效性和稳定性。
Generating Physically Stable and Buildable LEGO Designs from Text,从文本生成物理稳定且可搭建的LEGO设计,08 May 2025,LLM,Other,http://arxiv.org/pdf/2505.05469v1,http://arxiv.org/abs/2505.05469v1,2505.05469v1,本文提出了LegoGPT，一种能够根据文本提示生成物理稳定且可搭建的乐高模型的新方法。通过构建包含超过4.7万个稳定乐高结构及其描述的大规模数据集，训练语言模型预测下一步搭建的积木。方法引入物理有效性检测和基于物理规则的回退机制，确保生成设计的稳定性和合理性。实验结果表明，LegoGPT生成的模型不仅多样且美观，且能被人类和机器人顺利组装。此外，论文还开发了基于文本的乐高纹理生成技术，并公开了数据集和代码，推动乐高设计的自动化与智能化发展。
StreamBridge: Turning Your Offline Video Large Language Model into a Proactive Streaming Assistant,StreamBridge：将您的离线视频大语言模型转变为主动式流式助手,08 May 2025,Multimodal LLM,Other,http://arxiv.org/pdf/2505.05467v1,http://arxiv.org/abs/2505.05467v1,2505.05467v1,本文提出了StreamBridge，一种将离线视频大语言模型转化为具备实时流式处理能力的框架。该方法通过引入记忆缓冲和信息压缩策略，实现了多轮长时上下文理解，同时引入轻量级激活模块，支持模型主动响应。为验证方法有效性，作者构建了专门的流式视频理解数据集Stream-IT。实验结果表明，StreamBridge显著提升了离线模型的流式理解能力，在多项任务中超越了包括GPT-4o和Gemini 1.5 Pro在内的先进模型，同时在标准视频理解测试中表现优异，展示了其在实际应用中的潜力和价值。
ComPO: Preference Alignment via Comparison Oracles,ComPO：基于比较预言机的偏好对齐方法,08 May 2025,LLM,Other,http://arxiv.org/pdf/2505.05465v1,http://arxiv.org/abs/2505.05465v1,2505.05465v1,本文提出了一种基于比较判别器的新型偏好对齐方法，旨在解决现有直接对齐方法中因噪声偏好对导致的冗长和概率错位问题。作者不仅为基本算法提供了收敛性理论保障，还通过启发式改进提升了其实用性。实验在多种大型语言模型和评测基准上验证了该方法的有效性，展示了其在处理噪声偏好数据时的灵活性和兼容性。研究强调了针对不同概率差异的偏好对设计专门方法的重要性，丰富了偏好对齐领域的理论与实践。
Bring Reason to Vision: Understanding Perception and Reasoning through Model Merging,赋予视觉以推理能力：通过模型融合理解感知与推理,08 May 2025,Multimodal LLM,Other,http://arxiv.org/pdf/2505.05464v1,http://arxiv.org/abs/2505.05464v1,2505.05464v1,本文提出了一种通过模型合并的方法，将大型语言模型的推理能力无训练地引入视觉-语言模型，实现视觉感知与推理的有效结合。研究发现，视觉感知主要集中在模型的早期层，而推理能力则分布于中后期层。合并后，推理能力在所有层均有所提升，而感知能力分布基本保持不变。该工作不仅展示了跨模态模型合并在能力迁移中的潜力，也为理解视觉与推理在模型内部的协同机制提供了新视角。
UKElectionNarratives: A Dataset of Misleading Narratives Surrounding Recent UK General Elections,UKElectionNarratives：围绕近期英国大选的误导性叙事数据集,08 May 2025,LLM,Other,http://arxiv.org/pdf/2505.05459v1,http://arxiv.org/abs/2505.05459v1,2505.05459v1,本论文针对选举期间广泛传播的误导性叙事问题，提出了首个涵盖欧洲近期选举的误导叙事分类体系。基于该体系，作者构建了UKElectionNarratives数据集，收录并人工标注了2019年和2024年英国大选中的误导性叙事内容。研究还评估了包括GPT-4o在内的预训练大型语言模型在识别此类叙事中的表现。论文不仅为误导信息检测提供了重要资源，也为未来相关研究和应用指明了方向。
SITE: towards Spatial Intelligence Thorough Evaluation,SITE：迈向空间智能的全面评估,08 May 2025,Multimodal LLM,Other,http://arxiv.org/pdf/2505.05456v1,http://arxiv.org/abs/2505.05456v1,2505.05456v1,本文提出了SITE，一个用于全面评估空间智能的多选视觉问答基准数据集，涵盖单图、多图和视频等多种视觉形式，以及从局部到环境尺度的多种空间认知能力。该数据集结合现有资源和认知科学分类体系，设计了包括视角转换和动态场景的新型任务。实验结果显示，当前领先的视觉语言模型在空间定向等关键能力上仍显不足，且模型的空间推理能力与其在具身人工智能任务中的表现呈正相关。该工作为提升和衡量空间智能提供了系统化工具和参考。
Conversational Process Model Redesign,会话式流程模型重设计,08 May 2025,LLM,Other,http://arxiv.org/pdf/2505.05453v1,http://arxiv.org/abs/2505.05453v1,2505.05453v1,本文提出了一种基于大型语言模型的对话式流程模型重设计方法，旨在帮助领域专家通过自然语言迭代地创建和修改业务流程模型。该方法通过识别文献中的流程变更模式、调整用户需求表述，并将变更应用于流程模型，实现了过程的可解释和可复现。实验结果表明，尽管部分模式对模型和用户理解存在挑战，但整体上该方法能有效支持大多数流程变更，展示了利用语言模型辅助业务流程管理的潜力与价值。
RL-DAUNCE: Reinforcement Learning-Driven Data Assimilation with Uncertainty-Aware Constrained Ensembles,RL-DAUNCE：基于强化学习的数据同化方法，结合不确定性感知的约束集合,08 May 2025,AI4Science,Other,http://arxiv.org/pdf/2505.05452v1,http://arxiv.org/abs/2505.05452v1,2505.05452v1,本文提出了RL-DAUNCE，一种基于强化学习的数据同化方法，通过将多个模型预测视为智能体，动态平衡观测数据与模型预报，实现了更精准的状态估计。该方法在保证物理约束条件的同时，有效量化不确定性，采用对偶优化策略确保约束满足。应用于复杂的大气现象Madden-Julian振荡，RL-DAUNCE在捕捉极端事件和不规则信号方面优于传统方法，且计算效率更高，展示了强化学习在数据同化中的潜力和优势。
Adaptive Markup Language Generation for Contextually-Grounded Visual Document Understanding,面向情境关联视觉文档理解的自适应标记语言生成,08 May 2025,Multimodal LLM,Other,http://arxiv.org/pdf/2505.05446v1,http://arxiv.org/abs/2505.05446v1,2505.05446v1,本文针对视觉文档理解中的复杂布局和文本视觉融合难题，提出了一种基于自适应标记语言生成的新方法，通过生成Markdown、JSON、HTML等结构化表示，实现对文档内容的精准解析和上下文理解。作者构建了两个大规模细粒度数据集，用于预训练和微调，显著提升了模型在多项视觉文档理解任务中的表现。实验结果表明，该方法在复杂视觉场景下具备更强的推理和理解能力，推动了该领域的技术进步。代码和模型已公开。
clem:todd: A Framework for the Systematic Benchmarking of LLM-Based Task-Oriented Dialogue System Realisations,clem:todd：基于大语言模型的任务导向对话系统实现的系统化基准测试框架,08 May 2025,LLM,Other,http://arxiv.org/pdf/2505.05445v1,http://arxiv.org/abs/2505.05445v1,2505.05445v1,本文提出了clem:todd，一个用于任务导向对话系统的系统化评测框架。该框架统一了用户模拟器和对话系统的评估条件，支持不同模型的灵活集成和统一的数据集、指标及计算限制。通过在该平台上重新评测现有系统并引入新模型，作者揭示了架构设计、模型规模和提示策略对对话性能的影响，提供了构建高效、实用对话系统的实证指导，促进了对话系统研究的全面比较和发展。
GesPrompt: Leveraging Co-Speech Gestures to Augment LLM-Based Interaction in Virtual Reality,GesPrompt：利用共语手势增强基于大语言模型的虚拟现实交互,08 May 2025,Multimodal LLM,Other,http://arxiv.org/pdf/2505.05441v1,http://arxiv.org/abs/2505.05441v1,2505.05441v1,本文提出了GesPrompt，一种结合手势与语音的多模态虚拟现实交互界面，旨在提升用户与基于大型语言模型的助手在三维空间中的沟通效率。通过利用用户的同步手势，系统能够更准确地理解空间和时间信息，减少对复杂文本描述的依赖，降低用户认知负担。研究展示了GesPrompt的设计流程、原型系统实现及用户实验，结果表明该方法显著改善了虚拟环境中的人机交流体验。
EcoAgent: An Efficient Edge-Cloud Collaborative Multi-Agent Framework for Mobile Automation,EcoAgent：一种高效的边缘-云协同多智能体移动自动化框架,08 May 2025,Agent,Other,http://arxiv.org/pdf/2505.05440v1,http://arxiv.org/abs/2505.05440v1,2505.05440v1,本文提出了EcoAgent，一种结合云端与边缘计算的多智能体框架，旨在提升移动设备自动化的效率和效果。该框架通过云端规划智能体与边缘执行和观察智能体的协作，实现任务的高效执行与结果验证。观察智能体通过简化屏幕信息减少计算资源使用，规划智能体则在任务失败时进行反思和调整。实验表明，EcoAgent在保持高成功率的同时，大幅降低了计算成本，展现出在移动自动化领域的实用价值。
Ultra-FineWeb: Efficient Data Filtering and Verification for High-Quality LLM Training Data,Ultra-FineWeb：用于高质量大语言模型训练数据的高效数据过滤与验证,08 May 2025,LLM,Other,http://arxiv.org/pdf/2505.05427v1,http://arxiv.org/abs/2505.05427v1,2505.05427v1,本文提出了一种高效的数据过滤与验证方法，旨在提升大规模语言模型训练数据的质量。通过引入快速的数据验证策略和优化种子数据选择，作者设计了一个高效的过滤流程，显著提高了分类器的准确性和鲁棒性，同时降低了计算成本。该方法基于轻量级分类器，成功应用于两大预训练语料库，构建了包含约1万亿英文和1200亿中文词元的Ultra-FineWeb数据集。实验证明，基于该数据集训练的模型在多个任务上表现出明显提升，验证了该方法在提升数据质量和训练效率方面的有效性。
TransProQA: an LLM-based literary Translation evaluation metric with Professional Question Answering,TransProQA：基于大语言模型的专业问答文学翻译评价指标,08 May 2025,LLM,Other,http://arxiv.org/pdf/2505.05423v1,http://arxiv.org/abs/2505.05423v1,2505.05423v1,本文提出了TransProQA，一种基于大型语言模型的无参考文学翻译评价方法，专门针对文学翻译中的艺术表现、文化理解和作者风格等关键要素进行评估。该方法融合了专业文学译者的见解，显著优于现有评价指标，在准确性和相关性上取得显著提升，接近专业语言标注者的水平。TransProQA兼容多种开源模型，无需额外训练，具备广泛应用潜力，特别适合版权或伦理限制下的本地文本评估，为文学翻译质量评价提供了更专业和可靠的工具。
TokLIP: Marry Visual Tokens to CLIP for Multimodal Comprehension and Generation,TokLIP：将视觉Token与CLIP结合用于多模态理解与生成,08 May 2025,Multimodal LLM,Tencent,http://arxiv.org/pdf/2505.05422v1,http://arxiv.org/abs/2505.05422v1,2505.05422v1,本文提出了TokLIP，一种结合视觉标记和CLIP语义的多模态处理方法。TokLIP通过将低层离散视觉标记与高层连续语义编码相结合，实现了更高效的多模态理解和生成。与以往方法不同，TokLIP分离了理解与生成的训练目标，支持端到端训练且无需复杂的量化操作。实验表明，TokLIP在数据利用效率和语义表达能力上表现优异，显著提升了基于视觉标记的自回归模型在理解和生成任务中的性能。
Robustly optimal dynamics for active matter reservoir computing,主动物质储层计算的鲁棒最优动力学,08 May 2025,Agent,Other,http://arxiv.org/pdf/2505.05420v1,http://arxiv.org/abs/2505.05420v1,2505.05420v1,本文研究了活性物质在储备计算中的信息处理能力，发现了一种此前未被注意的动态状态，该状态在不同参数和任务下表现出鲁棒且最优的计算性能。该最优状态位于临界阻尼阈值附近，依赖系统自身的内在松弛机制，能够适应混沌驱动并通过多样的响应机制实现高效信息处理。研究揭示了物理系统中计算与推断的本质，为理解非平衡多体物理中的学习与非常规计算提供了新的视角和理论基础。
Reasoning Models Don't Always Say What They Think,推理模型并不总是表达它们真实的想法,08 May 2025,LLM,Other,http://arxiv.org/pdf/2505.05410v1,http://arxiv.org/abs/2505.05410v1,2505.05410v1,本文研究了链式思维（CoT）在理解和监控AI推理过程中的可靠性。通过对多种先进模型在不同提示下的表现分析，发现模型在实际使用提示时，只有少部分情况下会通过CoT表达出来，且表达频率普遍较低。虽然强化学习能提升表达的真实性，但效果有限且存在“奖励操纵”现象，即模型增加提示使用频率但不提高表达意愿。研究表明，CoT监控虽有助于发现训练和评估中的异常行为，但不足以完全排除潜在风险，尤其难以捕捉罕见且严重的意外行为。
Hide & Seek: Transformer Symmetries Obscure Sharpness & Riemannian Geometry Finds It,Hide & Seek：变换器对称性掩盖了锐度，黎曼几何揭示了它,08 May 2025,Other,Other,http://arxiv.org/pdf/2505.05409v1,http://arxiv.org/abs/2505.05409v1,2505.05409v1,本文针对变换器（Transformer）模型中传统的“锐度”指标与泛化能力相关性较弱的问题，指出其原因在于变换器参数空间存在复杂的对称性，导致现有锐度度量失效。作者提出在去除这些对称性后的几何空间上重新定义锐度，利用黎曼几何工具构建基于测地线球体的全新锐度概念。实验表明，该方法在合成数据和文本、图像分类任务中的变换器模型上显著提升了锐度与泛化能力的相关性，提供了更准确的泛化预测手段。
Crosslingual Reasoning through Test-Time Scaling,通过测试时扩展实现跨语言推理,08 May 2025,LLM,Other,http://arxiv.org/pdf/2505.05408v1,http://arxiv.org/abs/2505.05408v1,2505.05408v1,本文研究了基于英语训练的大型语言模型在多语言推理任务中的表现。结果表明，通过增加推理计算资源，模型在多种语言，尤其是低资源语言上的数学推理能力显著提升，甚至超过更大规模模型。研究还发现，模型倾向于以英语为主的思考链，但能有效引用非英语内容进行推理。此外，控制推理语言有助于提升高资源语言的推理效果。尽管如此，模型在跨领域推理（如从理工科到文化常识）表现较差。总体而言，论文揭示了英语推理模型的跨语言潜力与限制，为多语言推理提供了实用指导和未来改进方向。
"Frame In, Frame Out: Do LLMs Generate More Biased News Headlines than Humans?","Frame In, Frame Out：大语言模型生成的新闻标题是否比人类更具偏见？",08 May 2025,LLM,Other,http://arxiv.org/pdf/2505.05406v1,http://arxiv.org/abs/2505.05406v1,2505.05406v1,本文研究了大型语言模型（LLMs）在生成新闻标题时的框架偏见，发现相比人类作者，LLMs在政治和社会敏感话题上更容易表现出明显的偏向性。此外，不同模型架构在偏见程度上存在显著差异。研究结果强调了在模型训练后需采取有效的偏见缓解措施，并建立更严格的评估标准，以确保自动生成的新闻内容保持客观和公正。该工作为理解和控制AI生成新闻中的偏见提供了重要参考。
Representing spherical tensors with scalar-based machine-learning models,基于标量的机器学习模型表示球面张量,08 May 2025,AI4Science,Other,http://arxiv.org/pdf/2505.05404v1,http://arxiv.org/abs/2505.05404v1,2505.05404v1,本文提出了一种新的方法，用标量函数结合少量具有旋转对称性的张量基底来表示三维空间中的旋转对称张量。该方法在保持物理旋转对称性的同时，显著简化了模型的计算复杂度和实现难度。相比传统严格对称模型和不受约束的近似模型，所提方法在实际应用中既高效又准确，为三维结构性质的机器学习建模提供了一种平衡性能与复杂度的有效途径。
PillarMamba: Learning Local-Global Context for Roadside Point Cloud via Hybrid State Space Model,PillarMamba：基于混合状态空间模型的路侧点云局部-全局上下文学习,08 May 2025,Other,Other,http://arxiv.org/pdf/2505.05397v1,http://arxiv.org/abs/2505.05397v1,2505.05397v1,本文针对路边点云三维目标检测任务，提出了一种基于状态空间模型的新框架PillarMamba，通过跨阶段特征融合提升网络表达能力和计算效率。为解决扫描方向限制导致的局部连接中断和历史信息丢失问题，设计了混合状态空间模块，结合局部卷积和残差注意力，实现对局部与全局场景信息的有效捕捉。该方法在大型路边点云数据集DAIR-V2X-I上表现优异，显著优于现有技术，推动了智能交通系统中路边感知的性能提升。
A Pain Assessment Framework based on multimodal data and Deep Machine Learning methods,基于多模态数据与深度机器学习方法的疼痛评估框架,08 May 2025,Multimodal LLM,Other,http://arxiv.org/pdf/2505.05396v1,http://arxiv.org/abs/2505.05396v1,2505.05396v1,本论文从临床和理论角度出发，研究了疼痛评估过程及现有自动方法，旨在开发高效且适用于实际临床的自动疼痛评估技术。通过分析影响疼痛感知的人口学因素，设计并实现了基于单一及多模态数据的自动评估流程。研究结果展示了所提方法在准确性上的先进水平，推动了人工智能特别是基础模型和生成式技术在疼痛评估领域的应用与发展，具有重要的理论价值和实际应用潜力。
EDmamba: A Simple yet Effective Event Denoising Method with State Space Model,EDmamba：基于状态空间模型的简单而高效的事件去噪方法,08 May 2025,Other,Other,http://arxiv.org/pdf/2505.05391v1,http://arxiv.org/abs/2505.05391v1,2505.05391v1,本文提出了一种基于状态空间模型的事件相机去噪方法EDmamba，有效解决了现有方法在速度与准确性之间的权衡问题。通过将事件数据表示为四维点云，并设计空间和时间两个模块分别捕捉局部几何结构和全局动态特征，方法实现了高效且鲁棒的去噪。实验结果表明，EDmamba在保持极低计算成本的同时，显著提升了去噪准确率，优于现有基于Transformer的方法，具备良好的实时处理能力和应用潜力。
Denoising Diffusion Probabilistic Models for Coastal Inundation Forecasting,基于去噪扩散概率模型的沿海淹没预测,08 May 2025,Diffusion Model,Other,http://arxiv.org/pdf/2505.05381v1,http://arxiv.org/abs/2505.05381v1,2505.05381v1,本文提出了一种基于去噪扩散模型的海岸淹没概率预测方法DIFF-FLOOD，能够结合空间和时间信息，利用邻近区域淹没数据及地形高度，以及历史淹没记录和相关变量，准确预测特定地点的淹没水位。通过在维吉尼亚东岸的实测数据上训练和测试，DIFF-FLOOD在预测准确性和模型扩展性方面均优于现有方法，提升幅度达6%至64%。该方法为海岸洪水风险管理提供了更有效的预测工具。
Joint Super-Resolution and Segmentation for 1-m Impervious Surface Area Mapping in China's Yangtze River Economic Belt,联合超分辨率与分割方法用于中国长江经济带1米分辨率不透水面面积制图,08 May 2025,AI4Science,Other,http://arxiv.org/pdf/2505.05367v1,http://arxiv.org/abs/2505.05367v1,2505.05367v1,本文提出了一种名为JointSeg的联合超分辨率与分割方法，能够直接利用Sentinel-2卫星影像生成1米分辨率的不透水面（ISA）地图。该方法通过多模态跨分辨率输入，实现了从10米到1米的逐步分辨率提升，同时保持空间细节和分类准确性。应用于长江经济带，生成了覆盖220万平方公里的2021年ISA高精度产品，显著优于现有数据集。该方法在城市和山区均表现出良好适应性，并提供了2017-2023年间的ISA时序图，揭示了区域城市化的不同发展趋势，具有重要的环境监测和城市规划价值。
