标题,中文标题,发布日期,领域分类,研究机构,PDF链接,论文链接,arXiv ID,简明摘要
Human Agency and Creativity in AI-Assisted Learning Environments,AI辅助学习环境中的人类能动性与创造力,08 Dec 2025,Agent,Other,https://arxiv.org/pdf/2512.07117v1,http://arxiv.org/abs/2512.07117v1,2512.07117v1,本文探讨了在人工智能辅助学习环境中，学生自主性如何影响创造力的发展。通过分析四种不同的自主性理论视角，作者揭示了生成式人工智能工具如何改变学生在认知、社交和创造过程中的角色。文章提出了一个新的理论框架，将学生的自主参与与认知、关系和伦理因素结合，强调创造力不仅是结果，更是个体主动参与和意义建构的过程。最后，研究指出未来应关注人工智能环境下创造过程与表现的深入探讨，推动教育实践的发展。
Surrogate compliance modeling enables reinforcement learned locomotion gaits for soft robots,[翻译]Surrogate compliance modeling enables reinforcement learned locomotion gaits for soft robots,08 Dec 2025,Other,Other,https://arxiv.org/pdf/2512.07114v1,http://arxiv.org/abs/2512.07114v1,2512.07114v1,本文提出了一种替代柔性建模方法，通过在刚体仿真中引入间接变量来模拟软体变形，解决了软体机器人仿真难题。以一款具备软体变形四足两栖机器龟为例，结合强化学习训练出适应多种环境的步态策略。该方法实现了高效的仿真到实物迁移，在多种复杂自然地形上表现出优异的机动性和能耗优势，展示了软体机器人在多环境自主运动中的潜力和实用价值。
FOAM: Blocked State Folding for Memory-Efficient LLM Training,FOAM：用于内存高效大语言模型训练的块状状态折叠方法,08 Dec 2025,LLM,Other,https://arxiv.org/pdf/2512.07112v1,http://arxiv.org/abs/2512.07112v1,2512.07112v1,本文提出了一种名为FOAM的新方法，通过块状梯度均值计算和残差校正，有效压缩大型语言模型训练中的优化器状态，从而显著降低内存使用。理论分析表明，FOAM在非凸优化下具备与传统Adam优化器相当的收敛性能。实验结果显示，该方法可减少约50%的训练内存消耗，优化器状态内存开销降低90%，并加快模型收敛速度。此外，FOAM兼容其他节省内存的优化技术，性能和效率均优于现有方案，为大规模模型训练提供了高效实用的解决方案。
MSN: Multi-directional Similarity Network for Hand-crafted and Deep-synthesized Copy-Move Forgery Detection,MSN：用于手工制作与深度合成复制粘贴伪造检测的多方向相似性网络,08 Dec 2025,Other,Other,https://arxiv.org/pdf/2512.07110v1,http://arxiv.org/abs/2512.07110v1,2512.07110v1,无法生成摘要。
A Neural Affinity Framework for Abstract Reasoning: Diagnosing the Compositional Gap in Transformer Architectures via Procedural Task Taxonomy,一种用于抽象推理的神经亲和力框架：通过程序化任务分类诊断Transformer架构中的组合鸿沟,08 Dec 2025,AGI,Other,https://arxiv.org/pdf/2512.07109v1,http://arxiv.org/abs/2512.07109v1,2512.07109v1,本文提出了一个涵盖400个任务的九类任务分类体系，经过严格验证并展现出良好的视觉一致性。通过对Transformer模型在这些任务上的表现分析，发现其存在显著的“组合能力缺口”：模型能较好处理局部模式，但难以实现全局综合，导致性能受限于架构本身而非训练数据。该分类体系还成功预测了不同任务的难度差异，表明未来提升需采用结合多种模块的混合架构。论文为理解和改进抽象推理模型提供了重要工具和方向。
VIGIL: A Reflective Runtime for Self-Healing Agents,VIGIL：用于自愈智能体的反思运行时系统,08 Dec 2025,Agent,Other,https://arxiv.org/pdf/2512.07094v1,http://arxiv.org/abs/2512.07094v1,2512.07094v1,无法生成摘要。
The Geometry of Persona: Disentangling Personality from Reasoning in Large Language Models,[翻译]The Geometry of Persona: Disentangling Personality from Reasoning in Large Language Models,08 Dec 2025,Other,Other,https://arxiv.org/pdf/2512.07092v1,http://arxiv.org/abs/2512.07092v1,2512.07092v1,本论文提出了Soul Engine框架，通过将个性特质视为独立的线性空间，实现了在不改变模型核心参数的情况下，精确分离和控制大型语言模型中的人格特征。基于新构建的数据集SoulBench，方法在心理学标准上表现出高精度，且保证了模型推理能力不受影响。研究首次实现了无需微调即可进行个性化调整，推动了安全且可控的AI个性化发展，为个性化语言模型的稳定性与灵活性提供了新的解决思路。
A Flexible Funnel-Shaped Robotic Hand with an Integrated Single-Sheet Valve for Milligram-Scale Powder Handling,一种集成单片阀门的柔性漏斗形机器人手用于毫克级粉末处理,08 Dec 2025,Embodied AI,Other,https://arxiv.org/pdf/2512.07091v1,http://arxiv.org/abs/2512.07091v1,2512.07091v1,本文提出了一种新型柔性漏斗形机器人手，集成单片阀门，实现毫克级粉末的精确分配。通过结合粉末流动模型和在线参数识别，该系统能自适应不同粉末特性，显著提升称量准确性和响应速度。实验验证显示，80%的测试误差低于2毫克，最大误差约为20毫克，覆盖20毫克至3克的范围。该技术为实验室自动化中粉末处理提供了高效、灵活的解决方案，具备向更大规模和多样任务扩展的潜力。
Leveraging KV Similarity for Online Structured Pruning in LLMs,利用键值相似性进行大语言模型的在线结构化剪枝,08 Dec 2025,LLM,Other,https://arxiv.org/pdf/2512.07090v1,http://arxiv.org/abs/2512.07090v1,2512.07090v1,本文提出了一种名为Token Filtering的在线结构化剪枝方法，用于加速大型语言模型推理。该方法通过实时评估输入中信息的冗余程度，跳过不必要的计算，从而降低推理成本且无需依赖离线校准数据。为提升剪枝稳定性，作者设计了自适应融合策略，确保关键信息得到保留。实验证明，该方法在多个主流模型和任务上均优于现有剪枝技术，能够在保持较高准确率的同时实现高达50%的计算削减。
ThinkTrap: Denial-of-Service Attacks against Black-box LLM Services via Infinite Thinking,ThinkTrap：通过无限思考对黑盒大语言模型服务发起拒绝服务攻击,08 Dec 2025,LLM,Other,https://arxiv.org/pdf/2512.07086v1,http://arxiv.org/abs/2512.07086v1,2512.07086v1,无法生成摘要。
ClinNoteAgents: An LLM Multi-Agent System for Predicting and Interpreting Heart Failure 30-Day Readmission from Clinical Notes,[翻译]ClinNoteAgents: An LLM Multi-Agent System for Predicting and Interpreting Heart Failure 30-Day Readmission from Clinical Notes,08 Dec 2025,Other,Other,https://arxiv.org/pdf/2512.07081v1,http://arxiv.org/abs/2512.07081v1,2512.07081v1,本研究提出了ClinNoteAgents，一种基于大型语言模型的多智能体系统，用于从心衰患者的临床文本中提取风险因素并预测30天内再入院风险。该方法有效处理了临床笔记中的非结构化信息，避免了传统方法对手工规则和大量标注的依赖。实验证明，ClinNoteAgents在提取关键风险因素和预测再入院方面表现优异，具备良好的可解释性和可扩展性，有助于提升数据有限医疗环境下的心衰管理和预防效果。
DFIR-DETR: Frequency Domain Enhancement and Dynamic Feature Aggregation for Cross-Scene Small Object Detection,DFIR-DETR：用于跨场景小目标检测的频域增强与动态特征聚合,08 Dec 2025,Other,Other,https://arxiv.org/pdf/2512.07078v1,http://arxiv.org/abs/2512.07078v1,2512.07078v1,无法生成摘要。
Do Large Language Models Truly Understand Cross-cultural Differences?,大型语言模型是否真正理解跨文化差异？,08 Dec 2025,LLM,Other,https://arxiv.org/pdf/2512.07075v1,http://arxiv.org/abs/2512.07075v1,2512.07075v1,本文针对大型语言模型在跨文化理解能力评估中的不足，提出了基于情境的SAGE基准测试。该测试通过对核心跨文化概念的对齐和生成式任务设计，涵盖九大能力维度和多种现实场景，构建了包含4530个测试项的多语言数据集。实验结果揭示了模型在跨文化推理上的系统性弱点，表明现有模型尚未达到深度理解跨文化差异的水平。该工作为更全面评估和提升语言模型的跨文化能力提供了重要工具和参考。
Persistent Homology-Guided Frequency Filtering for Image Compression,[翻译]Persistent Homology-Guided Frequency Filtering for Image Compression,08 Dec 2025,Other,Other,https://arxiv.org/pdf/2512.07065v1,http://arxiv.org/abs/2512.07065v1,2512.07065v1,本文提出了一种结合傅里叶变换与持久同调分析的图像压缩方法，通过提取与图像拓扑特征相关的频率，实现有效压缩同时保留关键信息。实验结果表明，该方法在多项指标上达到与JPEG相当的压缩效果。该技术不仅提升了图像在噪声环境下的压缩可靠性，还展示了在辅助卷积神经网络进行二分类任务中的潜在优势，体现了其在图像处理和特征提取领域的应用价值。
Self-Supervised Learning on Molecular Graphs: A Systematic Investigation of Masking Design,[翻译]Self-Supervised Learning on Molecular Graphs: A Systematic Investigation of Masking Design,08 Dec 2025,Other,Other,https://arxiv.org/pdf/2512.07064v1,http://arxiv.org/abs/2512.07064v1,2512.07064v1,本文系统研究了分子图自监督学习中掩码设计的关键因素，提出了一个统一的概率框架来比较不同掩码策略。通过严格控制实验，作者分析了掩码分布、预测目标和编码器结构对预训练效果的影响。结果表明，复杂的掩码分布并未显著优于均匀采样，而预测目标的选择及其与编码器的匹配对下游任务性能影响更大。研究还利用信息论方法揭示了预训练信号的有效性，为分子图表征学习提供了实用的设计指导。
$\mathrm{D}^{\mathrm{3}}$-Predictor: Noise-Free Deterministic Diffusion for Dense Prediction,[翻译]$\mathrm{D}^{\mathrm{3}}$-Predictor: Noise-Free Deterministic Diffusion for Dense Prediction,08 Dec 2025,Other,Other,https://arxiv.org/pdf/2512.07062v1,http://arxiv.org/abs/2512.07062v1,2512.07062v1,本文针对扩散模型在密集预测任务中因随机噪声导致空间细节损失的问题，提出了$\mathrm{D}^{\mathrm{3}}$-Predictor，一种去除随机性的确定性框架。该方法将预训练扩散网络视为多个时间步的视觉专家，通过自监督方式融合其多样化先验，形成干净且完整的几何先验，并结合任务监督实现高效适配。实验表明，$\mathrm{D}^{\mathrm{3}}$-Predictor在多种密集预测任务中表现优异，训练数据需求显著减少，且推理仅需一步完成，提升了性能和效率。
Replicating TEMPEST at Scale: Multi-Turn Adversarial Attacks Against Trillion-Parameter Frontier Models,大规模复现TEMPEST：针对万亿参数前沿模型的多轮对抗攻击,08 Dec 2025,LLM,Other,https://arxiv.org/pdf/2512.07059v1,http://arxiv.org/abs/2512.07059v1,2512.07059v1,本文通过对十款大型语言模型进行多轮对抗攻击测试，揭示了当前安全对齐技术在抵御复杂攻击方面的显著不足。研究发现，不同厂商的模型在安全性上差异明显，模型规模并不决定其抗攻击能力。同时，启用延展推理功能显著提升了模型的防御效果。该工作强调了现有方法在面对适应性攻击时的脆弱性，并提出了基于思考推理的推断模式作为有效的安全增强策略，具有重要的实际应用价值。
Balanced Accuracy: The Right Metric for Evaluating LLM Judges - Explained through Youden's J statistic,Balanced Accuracy：通过Youden's J统计量解释评估LLM评判者的正确指标,08 Dec 2025,LLM,Other,https://arxiv.org/pdf/2512.08121v1,http://arxiv.org/abs/2512.08121v1,2512.08121v1,本文针对大语言模型（LLM）评价中常用的评判者选择问题，指出传统指标如准确率和F1分数易受类别不平衡影响，可能导致偏差的评估结果。作者提出采用Youden's J统计量及其等价指标平衡准确率作为评判者选择标准，理论上更符合真实表现的比较需求。通过理论分析和实证验证，研究表明以平衡准确率为依据能够更有效且稳健地选出合适的评判者，提升LLM评估的可信度和公平性。
Detecting Ambiguity Aversion in Cyberattack Behavior to Inform Cognitive Defense Strategies,[翻译]Detecting Ambiguity Aversion in Cyberattack Behavior to Inform Cognitive Defense Strategies,08 Dec 2025,Other,Other,https://arxiv.org/pdf/2512.08107v1,http://arxiv.org/abs/2512.08107v1,2512.08107v1,本文提出了一种新方法，用于识别网络攻击者在入侵过程中表现出的模糊厌恶倾向，即偏好已知风险而非不确定风险的认知偏差。研究结合多源实验数据，利用先进的语言模型将攻击行为转化为标准化序列，并通过计算模型实时推断攻击者的模糊厌恶程度。该方法有助于深入理解攻击者决策心理，为设计更加智能和动态的防御策略提供理论基础和实践支持。
Generalizations of the Normalized Radon Cumulative Distribution Transform for Limited Data Recognition,归一化Radon累积分布变换的推广及其在有限数据识别中的应用,08 Dec 2025,Other,Other,https://arxiv.org/pdf/2512.08099v1,http://arxiv.org/abs/2512.08099v1,2512.08099v1,无法生成摘要。
Training LLMs for Honesty via Confessions,通过忏悔训练大语言模型的诚实性,08 Dec 2025,LLM,Other,https://arxiv.org/pdf/2512.08093v1,http://arxiv.org/abs/2512.08093v1,2512.08093v1,本文提出了一种通过“自我坦白”机制提升大型语言模型诚实度的方法。该机制要求模型在回答后主动报告自身可能存在的错误或违规行为，训练时仅根据坦白内容的真实性给予奖励，从而激励模型诚实揭示自身不足。实验证明，该方法在检测模型虚假陈述和违规行为方面有效，且随着训练坦白的诚实度有所提升。该策略为模型行为监控和用户反馈提供了新的手段，促进了更可信的人工智能系统发展。
Adaptation of Embedding Models to Financial Filings via LLM Distillation,[翻译]Adaptation of Embedding Models to Financial Filings via LLM Distillation,08 Dec 2025,Other,Other,https://arxiv.org/pdf/2512.08088v1,http://arxiv.org/abs/2512.08088v1,2512.08088v1,本文提出了一种高效的训练方法，将通用检索嵌入模型与大型语言模型的领域相关性判断相结合，提升金融文档信息检索的效果。通过在无标注数据上反复挖掘难例并迭代优化模型，方法显著改善了多个金融文档类型的检索准确率，且无需大量人工标注。该方案为实现专业领域的高性能检索模型提供了低成本且可扩展的解决路径。
Short-Context Dominance: How Much Local Context Natural Language Actually Needs?,短上下文主导性：自然语言实际需要多少局部上下文？,08 Dec 2025,LLM,Other,https://arxiv.org/pdf/2512.08082v1,http://arxiv.org/abs/2512.08082v1,2512.08082v1,本文研究了自然语言序列预测中局部上下文的重要性，发现大多数情况下只需最近96个词即可准确预测后续内容。针对少数需要更长上下文的复杂序列，作者提出了一种无需真实标签即可检测长上下文需求的指标方法。基于此，设计了一种解码算法，有效提升了模型在问答等任务中的表现。该研究揭示了短上下文主导现象，提供了实用工具以优化大语言模型的预测能力。
Unveiling Latent Knowledge in Chemistry Language Models through Sparse Autoencoders,[翻译]Unveiling Latent Knowledge in Chemistry Language Models through Sparse Autoencoders,08 Dec 2025,Other,Other,https://arxiv.org/pdf/2512.08077v1,http://arxiv.org/abs/2512.08077v1,2512.08077v1,本文提出了一种基于稀疏自编码器的方法，用于揭示化学语言模型内部隐含的知识结构。通过对一个化学基础模型的分析，作者发现模型能够捕捉并编码丰富的化学概念，如分子结构特征、物理化学性质及药物分类等。该方法不仅增强了对模型内部机制的理解，也为化学领域的人工智能应用提供了新的解释工具，有助于推动计算化学的研究与实践。
Identification of Deforestation Areas in the Amazon Rainforest Using Change Detection Models,基于变化检测模型的亚马逊雨林砍伐区域识别,08 Dec 2025,AI4Science,Other,https://arxiv.org/pdf/2512.08075v1,http://arxiv.org/abs/2512.08075v1,2512.08075v1,本论文针对亚马逊雨林砍伐监测中的变化检测问题，系统评估了多种基于卫星影像的模型，包括传统卷积网络和引入自注意力机制的Transformer网络。通过统一数据集和多种图像预处理及后处理方法，显著提升了模型的检测准确率。此外，论文探索了模型融合策略，进一步提高了整体性能，最终实现了80.41%的F1分数。研究为利用机器学习技术精准识别森林砍伐区域提供了有效方法，推动了环境保护和生态监测的发展。
CAMO: Causality-Guided Adversarial Multimodal Domain Generalization for Crisis Classification,CAMO：面向危机分类的因果引导对抗多模态域泛化方法,08 Dec 2025,Multimodal LLM,Other,https://arxiv.org/pdf/2512.08071v1,http://arxiv.org/abs/2512.08071v1,2512.08071v1,本文针对社交媒体中多模态灾害信息分类的泛化难题，提出了一种基于因果关系指导的对抗性多模态域泛化框架。该方法通过对抗学习分离稳定的因果特征，避免了因域变化导致的性能下降，同时将不同模态的特征映射到统一空间，促进了跨模态信息的融合和泛化能力提升。实验结果表明，该方法在未见过的灾害类型上表现优异，有效提升了灾害信息的识别和应急响应能力。
LUNA: Linear Universal Neural Attention with Generalization Guarantees,LUNA：具有泛化保证的线性通用神经注意力机制,08 Dec 2025,Other,Other,https://arxiv.org/pdf/2512.08061v1,http://arxiv.org/abs/2512.08061v1,2512.08061v1,无法生成摘要。
Large Language Models for Education and Research: An Empirical and User Survey-based Analysis,教育与研究中的大语言模型：基于实证与用户调查的分析,08 Dec 2025,LLM,Other,https://arxiv.org/pdf/2512.08057v1,http://arxiv.org/abs/2512.08057v1,2512.08057v1,本文系统评估了两款先进的大型语言模型——ChatGPT和DeepSeek在教育与科研领域的应用表现。通过技术分析、实验测试及用户调查，研究比较了两者在文本生成、编程及专业问题解决上的能力与效率。结果显示，ChatGPT在语言理解和文本生成方面表现优异，DeepSeek则在编程任务中更具优势。两者均能提供准确的医学诊断和复杂数学问题解答。用户反馈进一步揭示了模型的实际价值与局限，为其在教育和科研中的应用提供了有益参考。
An Introduction to Deep Reinforcement and Imitation Learning,深度强化学习与模仿学习导论,08 Dec 2025,Embodied AI,Other,https://arxiv.org/pdf/2512.08052v1,http://arxiv.org/abs/2512.08052v1,2512.08052v1,本文介绍了深度强化学习和深度模仿学习在具身智能体（如机器人和虚拟角色）中的应用，强调通过学习方法解决复杂的连续决策问题。文章采用简明且深入的方式，系统讲解了相关基础算法和技术，涵盖从基本理论到具体方法，如强化学习中的策略优化和模仿学习中的专家示范利用。该文旨在帮助读者深入理解这两类学习方法的核心原理与实现，促进在智能体控制领域的研究和应用发展。
Towards Sustainable Universal Deepfake Detection with Frequency-Domain Masking,面向可持续的通用Deepfake检测的频域掩码方法,08 Dec 2025,Diffusion Model,Other,https://arxiv.org/pdf/2512.08042v1,http://arxiv.org/abs/2512.08042v1,2512.08042v1,无法生成摘要。
Joint Activity Design Heuristics for Enhancing Human-Machine Collaboration,[翻译]Joint Activity Design Heuristics for Enhancing Human-Machine Collaboration,08 Dec 2025,Other,Other,https://arxiv.org/pdf/2512.08036v1,http://arxiv.org/abs/2512.08036v1,2512.08036v1,本文提出了一套针对人机协作中共同活动设计的指导原则，旨在提升多主体协同完成任务的效率。研究强调支持团队中的五大关键认知功能——事件检测、意义构建、适应性调整、视角转换和协调——对于实现有效协作的重要性。基于跨学科文献，作者归纳出十四条设计启发式规则，帮助开发和评估能够作为团队成员的技术工具，从而推动技术不仅具备易用性，更能成为高效的协作伙伴。该研究为人机协作系统设计提供了实用且系统的理论支持。
CLARITY: Medical World Model for Guiding Treatment Decisions by Modeling Context-Aware Disease Trajectories in Latent Space,CLARITY：通过在潜在空间中建模上下文感知的疾病轨迹指导治疗决策的医学世界模型,08 Dec 2025,Other,Other,https://arxiv.org/pdf/2512.08029v1,http://arxiv.org/abs/2512.08029v1,2512.08029v1,本文提出了CLARITY，一种用于肿瘤治疗决策的医学世界模型。该模型通过在潜在空间中建模患者个体的时间和临床背景，动态预测疾病进展轨迹，生成个性化且生理上合理的治疗方案。与现有方法相比，CLARITY不仅提升了预测的准确性，还引入了将预测结果转化为可操作治疗建议的机制。在真实数据集上的实验表明，CLARITY在治疗规划任务中显著优于当前先进模型，展示了其在辅助临床决策中的潜力和实用价值。
Optimized Area Coverage in Disaster Response Utilizing Autonomous UAV Swarm Formations,利用自主无人机群编队优化灾害响应中的区域覆盖,08 Dec 2025,Agent,Other,https://arxiv.org/pdf/2512.08028v1,http://arxiv.org/abs/2512.08028v1,2512.08028v1,本文提出了一种无人机群系统，旨在提升灾害响应中的区域覆盖效率，特别适用于野火等紧急情况。系统通过多无人机协作分布传感器，延长飞行时间并增加数据获取，减少任务失败风险。引入基于局部地图的自主导航方法，实现避障同时保持队形，结合优化路径规划策略，优先覆盖重要区域。仿真结果表明，该系统能够有效扩大监测范围，确保无人机间及与障碍物的安全距离，提升灾害现场的响应能力和信息获取质量。
Toward an AI Reasoning-Enabled System for Patient-Clinical Trial Matching,面向具备推理能力的AI系统的患者与临床试验匹配研究,08 Dec 2025,LLM,Other,https://arxiv.org/pdf/2512.08026v1,http://arxiv.org/abs/2512.08026v1,2512.08026v1,本文提出了一种基于人工智能的患者与临床试验匹配系统，旨在解决现有筛选过程繁琐且耗时的问题。该系统整合多源电子健康数据，利用具备推理能力的大型语言模型，生成结构化且可解释的资格评估，支持专家审核。其动态评估方式不仅识别当前匹配，还提供改善建议，帮助拓展适合患者的试验范围。该工具在保障数据安全的同时，减轻了协调员负担，提升了匹配效率和透明度，具有显著的实际应用价值。
FRIEDA: Benchmarking Multi-Step Cartographic Reasoning in Vision-Language Models,FRIEDA：多步制图推理在多模态大语言模型中的基准测试,08 Dec 2025,Multimodal LLM,Other,https://arxiv.org/pdf/2512.08016v1,http://arxiv.org/abs/2512.08016v1,2512.08016v1,本文提出了FRIEDA，一个专门评测多步骤地图推理能力的基准，旨在检验视觉语言模型对地图中符号、空间关系及跨图信息的理解能力。通过真实地图数据，FRIEDA涵盖了拓扑、距离和方向三类空间关系，要求模型进行复杂推理。实验结果显示，当前最先进的模型表现远低于人类水平，揭示了多步骤地图推理的挑战和不足。该基准为推动视觉语言模型在空间智能领域的发展提供了重要工具和参考。
Benchmarking Offline Multi-Objective Reinforcement Learning in Critical Care,关键护理中离线多目标强化学习的基准测试,08 Dec 2025,Agent,Other,https://arxiv.org/pdf/2512.08012v1,http://arxiv.org/abs/2512.08012v1,2512.08012v1,本论文针对重症监护中的多目标决策问题，比较了三种离线多目标强化学习算法与传统单目标方法在真实医疗数据上的表现。结果显示，基于序列建模的多目标方法不仅在平衡患者生存率和资源利用上更具灵活性，还能根据不同临床需求动态调整策略，无需重新训练。研究表明，离线多目标强化学习为个性化和可调节的医疗决策提供了有效途径，具有重要的临床应用潜力。
