标题,中文标题,领域分类,研究机构,PDF链接,论文链接,简明摘要,Upvote数
Sekai: A Video Dataset towards World Exploration,Sekai：面向世界探索的视频数据集,Embodied AI,Shanghai AI Lab,https://arxiv.org/pdf/2506.15675,https://huggingface.co/papers/2506.15675,本文提出了Sekai，一个涵盖全球100多个国家和750个城市、超过5000小时第一人称视角步行及无人机视频的数据集，专为支持世界探索应用而设计。该数据集包含丰富的标注信息，如地点、场景、天气、人员密度、字幕和摄像机轨迹，解决了现有视频生成数据集在地点多样性、时长和动态场景等方面的不足。作者还开发了高效的视频采集与标注工具，并基于Sekai训练了一个交互式视频世界探索模型YUME。Sekai为视频生成和世界探索领域提供了重要资源，推动相关应用的发展。,40
"ProtoReasoning: Prototypes as the Foundation for Generalizable Reasoning
  in LLMs",ProtoReasoning：以原型为基础的大语言模型泛化推理方法,LLM,ByteDance,https://arxiv.org/pdf/2506.15211,https://huggingface.co/papers/2506.15211,本文提出了ProtoReasoning框架，基于“推理原型”——跨领域共享的抽象推理模式，提升大规模语言模型的推理能力和跨领域泛化性能。通过将问题自动转化为可验证的原型表示（如逻辑推理中的Prolog和规划中的PDDL），ProtoReasoning实现了有效的反馈与问题合成。实验证明，该方法在逻辑推理、规划、通用推理及数学任务上均优于基线模型，且在结构相似问题上的泛化能力显著增强，验证了推理原型作为通用推理基础的假设。,25
"GenRecal: Generation after Recalibration from Large to Small
  Vision-Language Models",GenRecal：从大型到小型视觉语言模型的再校准生成框架,Multimodal LLM,Other,https://arxiv.org/pdf/2506.15681,https://huggingface.co/papers/2506.15681,本文提出了GenRecal，一种通用的知识蒸馏框架，旨在将大型视觉语言模型（VLMs）的知识有效迁移到结构和词汇差异较大的小型模型中。通过引入一个“重校准器”模块，GenRecal能够对不同架构的特征表示进行对齐和适配，解决了传统蒸馏方法在异构模型间应用的难题。实验结果表明，该方法显著提升了小型模型的性能，甚至超越了部分大型开源和闭源视觉语言模型，具备在资源受限设备上推广应用的潜力。,22
"Embodied Web Agents: Bridging Physical-Digital Realms for Integrated
  Agent Intelligence",具身Web智能体：连接物理与数字领域以实现集成智能体智能,Agent,Other,https://arxiv.org/pdf/2506.15677,https://huggingface.co/papers/2506.15677,本文提出了“具身网络代理”这一新范式，旨在融合物理世界的感知与行动能力与网络规模的信息检索和推理能力，突破传统AI系统在数字与实体领域间的割裂。作者开发了一个统一的仿真平台，结合真实的三维环境与功能性网页接口，构建了涵盖烹饪、导航、购物、旅游等多样任务的基准测试，系统评估跨领域智能表现。实验结果显示现有AI与人类能力存在显著差距，揭示了具身认知与网络知识整合领域的挑战与潜力。所有相关资源均公开发布，促进后续研究。,14
BUT System for the MLC-SLM Challenge,BUT系统用于MLC-SLM挑战赛,Other,Other,https://arxiv.org/pdf/2506.13414,https://huggingface.co/papers/2506.13414,本文提出了一种结合DiCoW（基于Whisper的说话人分离变体）与DiariZen（基于Pyannote的说话人分离管线）的双说话人自动语音识别系统。系统在多语言和多说话人场景下表现出良好的泛化能力，且在针对特定任务数据微调后性能进一步提升。最终，该系统在MLC-SLM挑战赛中获得第二名，达到16.75%的错误率。此外，论文还发现并解决了训练数据中的标注不一致问题，提升了系统的鲁棒性。该工作为多说话人多语言语音识别提供了有效的解决方案。,12
"Revisiting Reinforcement Learning for LLM Reasoning from A Cross-Domain
  Perspective",从跨领域视角重新审视强化学习在大语言模型推理中的应用,LLM,Other,https://arxiv.org/pdf/2506.14965,https://huggingface.co/papers/2506.14965,本文提出了GURU，一个涵盖数学、编程、科学、逻辑、模拟和表格六个领域的9.2万条高质量强化学习训练样本库，解决了跨领域强化学习奖励信号缺乏的问题。研究发现，常见于预训练的数据领域能通过跨领域训练提升表现，而较少见领域则需专门领域内训练，表明强化学习有助于模型真正掌握新技能。基于GURU，作者训练出两个开源模型，在多项推理任务中显著超越现有方法，特别提升了复杂任务的表现，推动了大语言模型通用推理能力的发展。相关数据和代码已公开。,11
All is Not Lost: LLM Recovery without Checkpoints,[翻译]All is Not Lost: LLM Recovery without Checkpoints,Other,Other,https://arxiv.org/pdf/2506.15461,https://huggingface.co/papers/2506.15461,生成摘要时出错,10
"SciVer: Evaluating Foundation Models for Multimodal Scientific Claim
  Verification",SciVer：评估基础模型在多模态科学论断验证中的能力,Multimodal LLM,Other,https://arxiv.org/pdf/2506.15569,https://huggingface.co/papers/2506.15569,本文提出了SciVer，这是首个专门用于评估基础模型在多模态科学论证验证能力的基准数据集。SciVer包含3000个专家标注的样本，覆盖1113篇科学论文，涵盖四种常见的多模态推理类型，并附带详细的支持证据。通过测试21种先进的多模态基础模型，研究发现它们在该任务上的表现远落后于人类专家。进一步分析揭示了当前开源模型在理解和推理科学文献多模态信息方面的关键不足，为未来提升模型的科学文本综合能力提供了重要参考。,9
"Semantically-Aware Rewards for Open-Ended R1 Training in Free-Form
  Generation",面向自由形式开放式R1训练的语义感知奖励,LLM,Other,https://arxiv.org/pdf/2506.15068,https://huggingface.co/papers/2506.15068,本文提出了PrefBERT，一种用于开放式长文本生成评估的评分模型，旨在解决传统评估指标难以准确衡量生成文本质量的问题。PrefBERT通过学习区分优劣输出，为强化学习训练提供更具语义意义的奖励信号。实验表明，PrefBERT在多样化长文本风格和长度下表现稳定，且与人类评价高度一致。利用PrefBERT作为奖励信号训练的生成模型，其输出更符合人类偏好，显著提升了开放式长文本生成的质量和可靠性。,9
"SwarmAgentic: Towards Fully Automated Agentic System Generation via
  Swarm Intelligence",SwarmAgentic：基于群体智能的全自动智能体系统生成方法探索,Agent,Other,https://arxiv.org/pdf/2506.15672,https://huggingface.co/papers/2506.15672,本文提出了SwarmAgentic，一种基于群体智能的全自动智能体系统生成框架。该方法能够从零构建智能体系统，并通过语言驱动的探索同时优化智能体功能和协作。通过维护多个候选系统并借鉴粒子群优化策略，SwarmAgentic在多项真实开放任务中显著优于现有方法，实现了高效的系统级规划与协调。该框架推动了智能体系统设计的自动化和可扩展性，降低了人工干预需求，促进了复杂任务的自主解决。代码已公开，便于进一步研究和应用。,6
Truncated Proximal Policy Optimization,截断近端策略优化,LLM,ByteDance,https://arxiv.org/pdf/2506.15050,https://huggingface.co/papers/2506.15050,本文提出了一种名为Truncated Proximal Policy Optimization（T-PPO）的强化学习方法，旨在提升大型语言模型的训练效率。通过引入一种新的优势估计方法和优化策略与价值模型的独立训练机制，T-PPO有效减少了训练过程中的计算冗余和硬件资源闲置问题。实验结果表明，T-PPO在保持模型性能的同时，将训练速度提升了最多2.5倍，显著优于现有方法，为大规模推理模型的高效训练提供了实用方案。,6
"PictSure: Pretraining Embeddings Matters for In-Context Learning Image
  Classifiers",PictSure：预训练嵌入对上下文学习图像分类器的重要性,Other,Other,https://arxiv.org/pdf/2506.14842,https://huggingface.co/papers/2506.14842,本文提出了PictSure，一种针对少样本图像分类的上下文学习框架，重点优化了图像嵌入模型的架构、预训练和微调策略。研究系统地分析了不同视觉编码器类型和训练方法对分类性能的影响，发现预训练方式对模型在不同领域的泛化能力至关重要。实验表明，PictSure在跨领域任务中显著优于现有方法，同时保持了在同领域任务上的竞争力，展示了通过改进嵌入预训练提升少样本学习效果的潜力。代码已开源。,5
"FedNano: Toward Lightweight Federated Tuning for Pretrained Multimodal
  Large Language Models",FedNano：面向预训练多模态大型语言模型的轻量级联邦调优,Multimodal LLM,Other,https://arxiv.org/pdf/2506.14824,https://huggingface.co/papers/2506.14824,本文提出了FedNano，一种面向预训练多模态大型语言模型的轻量级联邦调优框架。FedNano通过将大型语言模型集中部署在服务器端，利用设计精巧的NanoEdge模块在客户端进行个性化适配，显著降低了客户端的存储和通信负担（分别减少95%和99.99%），同时有效应对了异构数据和资源受限的问题。实验结果表明，FedNano在保障隐私的前提下优于现有联邦学习方法，推动了多模态大型模型在分布式环境中的实际应用和可扩展性。,5
CoMemo: LVLMs Need Image Context with Image Memory,CoMemo：多模态大语言模型需要带有图像记忆的图像上下文,Multimodal LLM,Other,https://arxiv.org/pdf/2506.06279,https://huggingface.co/papers/2506.06279,本文针对大型视觉语言模型（LVLM）在处理图像信息时存在的视觉内容忽视和空间关系感知不足问题，提出了CoMemo方法。该方法采用双路径架构，结合上下文图像路径与图像记忆路径，有效缓解了视觉信息的丢失。同时，引入一种基于缩略图聚合的新型位置编码机制，增强了模型对二维空间结构的理解能力。实验结果表明，CoMemo在多项视觉理解任务中表现优于现有主流LVLM架构，提升了模型的长上下文理解和多图像推理能力。,5
"EmoNet-Voice: A Fine-Grained, Expert-Verified Benchmark for Speech
  Emotion Detection",EmoNet-Voice：一个细粒度、专家验证的语音情感检测基准,Other,Other,https://arxiv.org/pdf/2506.09827,https://huggingface.co/papers/2506.09827,本文提出了EmoNet-Voice，一个面向语音情感识别的新资源，包含大规模预训练数据集和专家标注的基准测试集。该资源覆盖40种细粒度情绪及其不同强度，利用先进的语音合成技术生成隐私保护的合成音频，并由心理学专家验证情绪强度。EmoNet-Voice填补了现有数据集在情绪细致度和隐私保护方面的不足，推动了情感识别模型的评估与发展。基于此，作者还推出了表现优异的情感识别模型，展示了高唤醒情绪比低唤醒情绪更易识别的发现。,5
"MoTE: Mixture of Ternary Experts for Memory-efficient Large Multimodal
  Models",MoTE：用于内存高效大型多模态模型的三值专家混合方法,Multimodal LLM,Other,https://arxiv.org/pdf/2506.14435,https://huggingface.co/papers/2506.14435,本文提出了MoTE，一种基于低精度三值专家的混合专家模型训练方法，旨在提升大规模多模态模型的内存效率。相比传统使用高精度专家的方案，MoTE通过训练更多的三值专家显著降低了模型的内存占用，同时保持了与全精度基线相当的性能。该方法兼容后训练量化技术，在内存受限环境下表现更优，实验证明MoTE在相同内存预算下提升了平均准确率，展示了其在边缘设备部署中的潜力和实用价值。,4
"ImmerseGen: Agent-Guided Immersive World Generation with Alpha-Textured
  Proxies",ImmerseGen：基于Alpha纹理代理的智能体引导沉浸式世界生成,Agent,ByteDance,https://arxiv.org/pdf/2506.14315,https://huggingface.co/papers/2506.14315,本文提出了ImmerseGen，一种基于智能代理引导的虚拟现实沉浸式三维场景生成框架。该方法通过在简化的几何代理模型上合成高质量纹理，实现场景的紧凑表示和真实感外观，支持移动VR设备的实时渲染。系统利用语义网格分析优化资产布局，自动从文本描述生成多样且空间连贯的环境，同时融入动态效果和环境音效，增强沉浸体验。实验结果表明，ImmerseGen在视觉质量、空间一致性和渲染效率上均优于现有方法，显著简化了复杂场景的创建流程。,4
"AssertBench: A Benchmark for Evaluating Self-Assertion in Large Language
  Models","[翻译]AssertBench: A Benchmark for Evaluating Self-Assertion in Large Language
  Models",Other,Other,https://arxiv.org/pdf/2506.11110,https://huggingface.co/papers/2506.11110,生成摘要时出错,3
OS-Harm: A Benchmark for Measuring Safety of Computer Use Agents,OS-Harm：用于衡量计算机使用智能体安全性的基准,Agent,Other,https://arxiv.org/pdf/2506.14866,https://huggingface.co/papers/2506.14866,本文提出了OS-Harm，一个用于评估基于大语言模型的计算机使用代理在图形界面交互中安全性的基准测试。该测试涵盖故意误用、提示注入攻击及模型异常行为三大类风险，通过150个涉及骚扰、版权侵权、虚假信息等多种安全违规的任务，检验代理在多种操作系统应用中的表现。作者还设计了自动评判系统，准确评估代理的安全性和准确性。实验结果显示，当前主流模型普遍容易受误用和提示注入影响，偶尔执行不安全操作。该基准为推动计算机使用代理的安全研究提供了重要工具。,3
SonicVerse: Multi-Task Learning for Music Feature-Informed Captioning,SonicVerse：基于多任务学习的音乐特征辅助描述生成,Multimodal LLM,Other,https://arxiv.org/pdf/2506.15154,https://huggingface.co/papers/2506.15154,本文提出了SonicVerse，一种结合多任务学习的音乐描述生成模型，通过同时识别音乐的关键特征（如调性和人声）来提升描述的准确性和细节。该模型采用一种投影架构，将音频信息转化为语言表达，并利用辅助任务增强描述内容。通过扩展并标注现有音乐数据集，模型能够生成丰富且时间感知的音乐片段描述。实验结果表明，融合音乐特征检测显著提升了自动生成音乐描述的质量，为音乐数据库丰富和音乐人工智能研究提供了有力支持。,3
Evolutionary Caching to Accelerate Your Off-the-Shelf Diffusion Model,[翻译]Evolutionary Caching to Accelerate Your Off-the-Shelf Diffusion Model,Other,Other,https://arxiv.org/pdf/2506.15682,https://huggingface.co/papers/2506.15682,生成摘要时出错,1
GMT: General Motion Tracking for Humanoid Whole-Body Control,GMT：用于人形机器人全身控制的通用运动追踪,Embodied AI,Other,https://arxiv.org/pdf/2506.14770,https://huggingface.co/papers/2506.14770,本文提出了GMT，一种通用且可扩展的人形机器人全身动作追踪框架。通过自适应采样策略和动作专家混合架构，GMT能够训练单一统一策略，有效应对动作的时间和运动学多样性，实现上半身与下半身的协调控制。实验结果表明，GMT在模拟和真实环境中均能稳定跟踪多样化动作，表现出领先的性能和良好的泛化能力，有助于推动具备多样技能的人形机器人在实际应用中的发展。,1
"Improved Iterative Refinement for Chart-to-Code Generation via
  Structured Instruction",基于结构化指令的改进迭代优化方法用于Chart-to-Code生成,Multimodal LLM,Other,https://arxiv.org/pdf/2506.14837,https://huggingface.co/papers/2506.14837,本文提出了一种名为ChartIR的方法，通过结构化指令将图表理解与代码翻译任务分离，采用描述和差异两类指令将图表视觉信息转化为语言表达，进而辅助生成可执行代码。该方法将生成过程分为初始代码生成和迭代优化两个阶段，实现了逐步提升代码质量。实验结果表明，ChartIR在开源模型Qwen2-VL和闭源模型GPT-4o上均显著优于现有方法，有效提升了多模态大语言模型在图表到代码生成任务中的表现。,1
RE-IMAGINE: Symbolic Benchmark Synthesis for Reasoning Evaluation,RE-IMAGINE：用于推理评估的符号基准合成,LLM,Other,https://arxiv.org/pdf/2506.15455,https://huggingface.co/papers/2506.15455,本文提出了RE-IMAGINE框架，旨在评估大型语言模型的推理能力，区别其真实推理与对训练数据的记忆。通过对问题进行符号化变换，框架自动生成多样化的题目变体，这些变体无法仅靠记忆解决，覆盖数学、编程和逻辑等多个领域。实验证明，当模型面对这些变体时表现下降，表明其在推理测试中存在依赖记忆的现象。该工作为深入理解和提升模型的推理能力提供了新的评估工具和思路。,0
