标题,中文标题,领域分类,研究机构,PDF链接,论文链接,简明摘要,Upvote数
"GEMeX-ThinkVG: Towards Thinking with Visual Grounding in Medical VQA via
  Reinforcement Learning",GEMeX-ThinkVG：通过强化学习实现医学视觉问答中的视觉定位思考,Multimodal LLM,Other,https://arxiv.org/pdf/2506.17939,https://huggingface.co/papers/2506.17939,本文提出了一个名为ThinkVG的新型医疗视觉问答数据集，通过将答案生成过程分解为多个推理步骤，并明确标注相关医学图像区域，实现了更细致的可解释性。同时，设计了一种可验证的强化学习奖励机制，用于优化模型训练，增强模型推理过程与最终答案的一致性。该方法在仅使用八分之一训练数据的情况下，仍能达到与现有方法相当的性能，显著提升了医疗视觉问答的可靠性和效率，有助于临床决策支持和结果的可信理解。数据集已公开发布。,2
"Better Language Model Inversion by Compactly Representing Next-Token
  Distributions",通过紧凑表示下一个词分布实现更优的大语言模型反演,LLM,Other,https://arxiv.org/pdf/2506.17090,https://huggingface.co/papers/2506.17090,本文提出了一种名为PILS的新方法，通过紧凑表示语言模型在多个生成步骤中的下一个词概率分布，有效恢复隐藏提示语。该方法基于发现模型输出概率存在低维子空间，利用线性映射实现无损压缩，显著提升了提示语恢复的准确率，最高提升至原方法的2至3.5倍，且在测试时步数增加时表现出良好的泛化能力。此外，PILS在恢复隐藏系统消息等更复杂任务中也表现优异，揭示了下一个词概率是语言模型逆向攻击的关键易受攻击面。该研究对语言模型的安全性和责任追踪具有重要意义。,1
Watermarking Autoregressive Image Generation,自回归图像生成的水印技术,Other,Meta,https://arxiv.org/pdf/2506.16349,https://huggingface.co/papers/2506.16349,本文提出了首个针对自回归图像生成模型输出的水印技术，通过改进的分词器微调和水印同步层，解决了生成图像重新分词时水印易被破坏的问题。该方法有效提升了水印的逆向一致性和鲁棒性，能够抵抗常见图像变换和压缩攻击，实现了可靠且理论支持的水印检测。此项工作为追踪和验证AI生成图像的来源提供了新工具，具有重要的实际应用价值。,1
"Audit & Repair: An Agentic Framework for Consistent Story Visualization
  in Text-to-Image Diffusion Models",Audit & Repair：一种用于文本到图像扩散模型中一致性故事可视化的智能体框架,Agent,Other,https://arxiv.org/pdf/2506.18900,https://huggingface.co/papers/2506.18900,本文提出了一种多智能体协作框架，用于提升基于文本生成多幅连贯故事图像时的视觉一致性。该框架能够自动检测并修正不同画面中角色和场景的细节不一致问题，通过迭代局部更新避免重新生成整个图像序列。方法兼容多种扩散模型，如Flux和Stable Diffusion，显著改善了故事面板间的连续性和角色属性的连贯性。实验结果表明，该框架在保持多幅画面一致性方面优于现有技术，推动了自动故事可视化的应用发展。,1
How Alignment Shrinks the Generative Horizon,对齐如何缩短生成视野,LLM,Other,https://arxiv.org/pdf/2506.17871,https://huggingface.co/papers/2506.17871,本文提出了“分支因子”（Branching Factor，BF）这一指标，用于衡量大语言模型生成过程中可选下一步的有效数量。研究发现，随着生成进展，模型输出变得更可预测，BF逐渐降低；且通过对模型进行对齐调优，BF在生成初期显著减少，导致输出多样性降低但更稳定。进一步分析表明，结合链式思维（Chain-of-Thought）策略，模型生成更长推理链条，进入更加确定的生成阶段，提升输出稳定性。研究还指出，对齐调优主要引导模型偏向某些低熵表达路径，而非根本改变模型行为。该工作为理解和控制语言模型输出的多样性与稳定性提供了新的视角和工具。,1
TPTT: Transforming Pretrained Transformer into Titans,TPTT：将预训练Transformer转变为巨人模型,LLM,Other,https://arxiv.org/pdf/2506.17671,https://huggingface.co/papers/2506.17671,本文提出了TPTT框架，通过引入高效的线性注意力机制和先进的内存管理技术，显著提升了预训练Transformer模型在处理长文本时的计算效率和准确性。TPTT兼容主流Transformer库，支持无需完全重训即可进行参数高效微调。实验表明，在约10亿参数规模的模型上，TPTT在MMLU基准测试中实现了约20%的性能提升。该方法具备良好的扩展性和稳定性，为长上下文推理提供了实用且高效的解决方案。代码和工具已公开，便于社区应用与推广。,1
