公众号,发布时间,原标题,科技报告标题,摘要,领域分类,研究机构,行业大佬,URL
新智元,2025-04-03 13:20:10,被哥大开除后，他靠AI作弊神器年入千万！血洗硅谷大厂拿遍offer成功创业,AI作弊工具对技术面试的影响及创业成功案例,本文报道了一名因面试作弊被哥伦比亚大学开除的学生Roy Lee，利用其开发的AI作弊软件Interview Coder成功创业，月收入达到22.85万美元。文章指出，AI作弊手段的普及已对技术面试造成严重影响，面试官们感到困惑和无奈。尽管大厂依赖生成式AI完成编程任务，但求职者也在利用AI工具通过面试，导致面试过程变得形式化和低效。Roy Lee的成功引发了对AI在招聘领域应用的广泛讨论。,LLM,Other,None,https://mp.weixin.qq.com/s/ZKmv0WajhXjF3faFHsxzoQ
量子位,2025-04-03 13:01:36,智能体丝滑玩手机，决策延迟0.7秒！MSRA等提出验证器架构，不直接依赖大模型生成最终操作,V-Droid: 一种新型验证器驱动的移动GUI任务自动化智能体,V-Droid是由微软亚洲研究院、南洋理工大学、清华大学和香港科技大学等机构联合推出的移动图形用户界面任务自动化智能体。其创新的验证器驱动架构使得任务成功率显著提高，决策延迟降至0.7秒，解决了传统方法在复杂GUI环境中的效率和准确性问题。V-Droid通过构建有限的动作集合并利用经过训练的验证器进行评估，优化了决策过程，推动了移动端自动化控制的发展。,Agent,"Microsoft, THU",None,https://mp.weixin.qq.com/s/GxTJrTp-gfg0N1wchpYptg
量子位,2025-04-03 13:01:36,马斯克擎天柱机器人大秀走姿，背后大佬集体现身喊话招人,特斯拉擎天柱机器人团队招募与技术进展,马斯克在社交媒体上展示了特斯拉擎天柱机器人的最新走姿，吸引了大量关注。特斯拉副总裁Milan Kovac介绍，擎天柱的步态是通过纯强化学习模拟训练实现的。团队成员Ashish Kumar、Julian Ibarz、Russell Mendonca和Murtaza Dalal等人也借此机会招募新成员。马斯克还透露，擎天柱计划在未来几年内进入量产，并可能在2029年或2031年将其送往火星。,Embodied AI,Other,"Elon Musk, Ashish Kumar, Julian Ibarz, Russell Mendonca, Murtaza Dalal",https://mp.weixin.qq.com/s/dDWKmTf6Yh5QkpC9Eup-eA
老刘说NLP,2025-04-03 11:43:26,RAG技术于视频文章生成及东方语种+汉语方言识别Dolphin实现思路解析,RAG技术在视频文章生成与东方语言识别中的应用探讨,本文探讨了RAG技术在视频文章生成中的应用，介绍了WIKIVIDEO方案，该方案通过结合视频语言模型和文本推理模型，从多个视频中生成维基百科风格的文章。此外，文章还讨论了针对东方语言和汉语方言的语音识别开源方案，强调了其在数字人等应用中的基础作用。通过对任务流程的设计，本文提供了对相关技术的深入思考。,Multimodal LLM,Other,None,https://mp.weixin.qq.com/s/PcGsQJ_yysmM-T5BI-GY0A
量子位,2025-04-03 15:42:07,招聘｜量子位智库AI分析师,量子位智库招聘AI分析师,量子位智库现招聘AI分析师和助理分析师，致力于AIGC领域的研究与数据分析。AI分析师将专注于深度产业报告的撰写，并与产业专家建立联系；助理分析师则负责收集和分析AI产品的数据，支持团队的数据库更新和内容发布。岗位要求包括较强的学习能力、逻辑分析能力及相关专业背景。工作地点为北京中关村，欢迎实习生投递简历。,Other,Other,None,https://mp.weixin.qq.com/s/WHzGVLzK-31iBLOUKMOvSA
量子位,2025-04-03 15:42:07,“AI眼镜的终极功能，是AI+社交” | 对话影目科技创始人,AI眼镜的未来：AI与社交的结合,本文探讨了AI眼镜的市场现状及其未来发展，特别是影目科技创始人杨龙昇的观点。他认为，AI眼镜的终极功能是将AI与社交结合，未来可能取代手机成为新的交互入口。文章分析了AI眼镜的不同发展阶段，并强调了AI作为底层能力的重要性，指出AI眼镜在提升用户交互效率方面的潜力。随着AI技术的进步，智能眼镜将迎来新的机遇与挑战。,Embodied AI,Other,杨龙昇,https://mp.weixin.qq.com/s/RY_G0S3H2Y5ZadF-UOgAvg
新智元,2025-04-03 15:16:00,o3狂烧3万美金解一题，反被AGI榜单除名！试错1024次不如10岁小孩哥4分钟,OpenAI o3推理成本飙升与ARC-AGI榜单除名分析,OpenAI的o3推理模型在ARC-AGI测试中的成本从3000美元暴增至30000美元，导致其被除名。尽管o3-high生成了4300万字的解题文本，但其依赖的暴力试错方法引发了对其智能解题能力的质疑。ARC-AGI的最新评估显示，o3的表现未超出预期，且新版本的测试难度加大，顶尖模型的得分均为0%。,AGI,OpenAI,"Toby Ord, François Chollet, Mike Knoop",https://mp.weixin.qq.com/s/GzdaP_kG39zZE6KehE3P2Q
